"id","created","content","moderation_status","parent_id","has_child","like","dislike","recommended","has_rating","rating_average","rating_content","has_more_children","reply_count","message_status","message_type","idt_group_user","cod_profile","cod_profile_hash","nick","user_status","avatar","social_user","social_network","unique_user_id","user_signature","user_register","user_total_messages","user_total_pins","user_total_bookmarks","user_total_likes","profile_nick","profile_url","media_content","subject_id","subject_url","subject_title","subject_views","subject_total","subject_like","subject_start","subject_owner_name","subject_owner_id","subject_owner_cod_profile","subject_owner_userSource","replies","sc"
"22536592","20130822025110","O julgamento do mensalão abriu precedentes jurídicos para outros tipos de corrupções serem julgadas e assim que confirmadas, condenadas. Se em SP. ou no Federal, que a cadeia espere os CASOS COMPROVADOS de corrupção, assim como o MENSALÃO!","APPROVED","0","FALSE","0","0","NONE","FALSE","0.0",NA,"FALSE","0","VISIBLE","MESSAGE",NA,"s28prb278c4e","3693605171774754398","Brasilcora&ccedil;&atilde;odomundo","6","http://forum.imguol.com//forum/themes/jogos/images/nopic.gif","3693605171774754398","UOLK","3693605171774754398@UOLK",NA,NA,NA,NA,NA,NA,NA,NA,NA,"6603558",NA,NA,"0","0","0","20130807173101",NA,NA,NA,NA,NA,"200"
"22535229","20130822003025","É prender os mensaleiros e metade dos ministros do STF. Tem que ir pra rua e fazer o que chamaram de vandalismo, pois passeatazinha pacífica não levou a nada!","APPROVED","0","FALSE","0","0","NONE","FALSE","0.0",NA,"FALSE","0","VISIBLE","MESSAGE",NA,NA,NA,"Alexandre Bacci","1","https://fbcdn-profile-a.akamaihd.net/hprofile-ak-prn1/623829_100000996391921_711617944_q.jpg","100000996391921","FACEBOOK","100000996391921@FACEBOOK",NA,NA,NA,NA,NA,NA,NA,NA,NA,"6603558",NA,NA,"0","0","0","20130807173101",NA,NA,NA,NA,NA,"200"
"22533873","20130821233553","Qual á logica do ministro Marcos Aurelio ?","APPROVED","0","TRUE","1","0","NONE","FALSE","0.0",NA,"FALSE","0","VISIBLE","MESSAGE",NA,"bs1hlmhlddde","1550362392012275186","ROCK 10","1","http://forum.imguol.com/avatars/gallery/noticias/Presidentes/07.gif","1550362392012275186","UOLK","1550362392012275186@UOLK",NA,NA,NA,NA,NA,NA,NA,NA,NA,"6603558",NA,NA,"0","0","0","20130807173101",NA,NA,NA,NA,NA,"200"
"22533023","20130821224611","Agora entendo o porque de tanta atenção ao mensalão... Queriam esconder o trensalão que vem correndo trilho desde o tempo de Mario Covas. Entendi!!!!!","APPROVED","0","TRUE","1","0","NONE","FALSE","0.0",NA,"FALSE","0","VISIBLE","MESSAGE",NA,NA,NA,"Carlos Marinho Marinho","1","https://fbcdn-profile-a.akamaihd.net/hprofile-ak-ash4/372736_100001223278170_353196518_q.jpg","100001223278170","FACEBOOK","100001223278170@FACEBOOK",NA,NA,NA,NA,NA,NA,NA,NA,NA,"6603558",NA,NA,"0","0","0","20130807173101",NA,NA,NA,NA,NA,"200"
"22532089","20130821215115","FECHA O CONGRESSO.....","APPROVED","0","FALSE","3","0","NONE","FALSE","0.0",NA,"FALSE","0","VISIBLE","MESSAGE",NA,"cs37hei1lc9b","1682158673825135183","prchiabai","1","http://forum.imguol.com/avatars/gallery/Futebol Nacional [1]/0010.gif","1682158673825135183","UOLK","1682158673825135183@UOLK",NA,NA,NA,NA,NA,NA,NA,NA,NA,"6603558",NA,NA,"0","0","0","20130807173101",NA,NA,NA,NA,NA,"200"
"22531313","20130821210941","ESTÃO  ARRUMANDO  TANTO  ""EMPURRA-EMPURRA""  PARA  DISFARÇAR,  QUE  ESSE  MENSALÃO  VAI  ACABAR  EM  ""SAMBA-ENREDO""  COM A  ESCOLA     ""C A M P E Ã""  !!!  ISSO  ÉÉÉÉÉÉ    BRAAAASIIIIIIIIIILLLLLLLLLLLL","APPROVED","0","FALSE","0","0","NONE","FALSE","0.0",NA,"FALSE","0","VISIBLE","MESSAGE",NA,"t0xau8fgvnqn","3820411470369404399","CARLITOS55","1","http://forum.imguol.com//forum/themes/jogos/images/nopic.gif","3820411470369404399","UOLK","3820411470369404399@UOLK",NA,NA,NA,NA,NA,NA,NA,NA,NA,"6603558",NA,NA,"0","0","0","20130807173101",NA,NA,NA,NA,NA,"200"
"22530873","20130821204523","É incrível como temos que tolerar certas atitudes suspeitas como a do Sr. Lewandowski e do Sr. Tóffoli. Infelçizmente o que eles menos querem é justiça!","APPROVED","0","FALSE","4","0","NONE","FALSE","0.0",NA,"FALSE","0","VISIBLE","MESSAGE",NA,"hxpc7z6n7n9x","2360795671214534805","Santos SP","1","http://forum.imguol.com//forum/themes/jogos/images/nopic.gif","2360795671214534805","UOLK","2360795671214534805@UOLK",NA,NA,NA,NA,NA,NA,NA,NA,NA,"6603558",NA,NA,"0","0","0","20130807173101",NA,NA,NA,NA,NA,"200"
"22530229","20130821200816","Está absolutamente clara a posição do Sr. Lewandowski em relação aos mensaleiros, principalmente quando estes são do PT. Ficou clara essa posição ao longo do julgamento e não fosse o pito que ele tomou do Presidente, continuaria a tentar procrastinar questões já claramente definidas pela maioria. O cidadão nem disfarça a sua posição. É o fim da picada ter gente como ele e o Sr. Tofoli na mais alta corte do País.","APPROVED","0","FALSE","6","0","NONE","FALSE","0.0",NA,"FALSE","0","VISIBLE","MESSAGE",NA,"dvg9wddkzmym","1826075947660023550","Vitch&eacute;nicol&eacute;","1","http://forum.imguol.com/avatars/gallery/noticias/Basquete 01/1105.gif","1826075947660023550","UOLK","1826075947660023550@UOLK",NA,NA,NA,NA,NA,NA,NA,NA,NA,"6603558",NA,NA,"0","0","0","20130807173101",NA,NA,NA,NA,NA,"200"
"22529491","20130821192327","STF, estamos de olho nos senhores !!!!!!!!","APPROVED","0","FALSE","5","0","NONE","FALSE","0.0",NA,"FALSE","0","VISIBLE","MESSAGE",NA,"m6mq098xpvmn","2919922123205959007","Marrod69","1","http://forum.imguol.com/avatars/gallery/noticias/Musica 01/jovem1710.jpg","2919922123205959007","UOLK","2919922123205959007@UOLK",NA,NA,NA,NA,NA,NA,NA,NA,NA,"6603558",NA,NA,"0","0","0","20130807173101",NA,NA,NA,NA,NA,"200"
"22528960","20130821185213","Infelizmente a maioria dos ministro é da cupula do PT, infelizmente brasileiros que se preza, vai ser preciso uma revolução nesse país para acabarmos com todas essas farsas e mordomias e esmolas que estam dando para permanecer no poder. SAUPREMO TRIBUNAL FEDERAL, MUITOS  DE SEUS MINISTROS É UMA VERGONHA, UMA GRANDE FARSA.sustendo com nossos impostos. Tem ministros advogado e  não julgando.","APPROVED","0","FALSE","4","0","NONE","FALSE","0.0",NA,"FALSE","0","VISIBLE","MESSAGE",NA,"uejbbz7rozcp","4001798943477542905","Revoltado52","1","http://forum.imguol.com//forum/themes/jogos/images/nopic.gif","4001798943477542905","UOLK","4001798943477542905@UOLK",NA,NA,NA,NA,NA,NA,NA,NA,NA,"6603558",NA,NA,"0","0","0","20130807173101",NA,NA,NA,NA,NA,"200"
"22528934","20130821185034","A vergonha é um juiz fazer jogo sujo para ir adiando o que não tem jeito. E querer que Joaquim peça desculpas. Será que eles estão acima de Deus, estes juízes? O que acham que são?????","APPROVED","0","FALSE","5","0","NONE","FALSE","0.0",NA,"FALSE","0","VISIBLE","MESSAGE",NA,"utli5fikw8te","4056863674694254754","MISAB","1","http://forum.imguol.com//forum/themes/jogos/images/nopic.gif","4056863674694254754","UOLK","4056863674694254754@UOLK",NA,NA,NA,NA,NA,NA,NA,NA,NA,"6603558",NA,NA,"0","0","0","20130807173101",NA,NA,NA,NA,NA,"200"
"22528655","20130821183640","Vou valendo que nenhum dos condenados serão presos esse ano. E tenho certeza que muitos condenados estarão envolvidos na próxima campanha. E esse ministro Lewandowski não devia estar participando dessa corte ele esta o tempo todo querendo amenizar a situação dos réus!!!","APPROVED","0","FALSE","4","0","NONE","FALSE","0.0",NA,"FALSE","0","VISIBLE","MESSAGE",NA,NA,NA,"Wellington Pimentel","1","https://fbcdn-profile-a.akamaihd.net/hprofile-ak-prn2/1118833_1476775502_477848186_q.jpg","1476775502","FACEBOOK","1476775502@FACEBOOK",NA,NA,NA,NA,NA,NA,NA,NA,NA,"6603558",NA,NA,"0","0","0","20130807173101",NA,NA,NA,NA,NA,"200"
"22528501","20130821182727","O que eu acho interessante, é o fato de o STF entender que não há nada comprometendo Lula. Mas caramba, quem acredita que ele não sabia do que se passava? Como é possível, nas circunstânicas, sendo ele o chefão e amigo de longa data dos envolvidos, não saber do que se passava? Acho que vamos acabar tendo que acreditar na existência do Papai Noel...","APPROVED","0","FALSE","5","0","NONE","FALSE","0.0",NA,"FALSE","0","VISIBLE","MESSAGE",NA,"4ydzzfvcc4ps","652217997907311328","Ruiflu","1","http://forum.imguol.com//forum/themes/jogos/images/nopic.gif","652217997907311328","UOLK","652217997907311328@UOLK",NA,NA,NA,NA,NA,NA,NA,NA,NA,"6603558",NA,NA,"0","0","0","20130807173101",NA,NA,NA,NA,NA,"200"
"22528263","20130821181300","Estranho mesmo, como já começam alguns a achar. Todos se voltam para o Lewandowski mas será que ele está sózinho nessa defesa dos mensaleiros? E esse Marco Aurelio? Estranho, muito estranho...","APPROVED","0","FALSE","5","0","NONE","FALSE","0.0",NA,"FALSE","0","VISIBLE","MESSAGE",NA,"3690wedk2i61","417718640725168249","palha","1","http://forum.imguol.com//forum/themes/jogos/images/nopic.gif","417718640725168249","UOLK","417718640725168249@UOLK",NA,NA,NA,NA,NA,NA,NA,NA,NA,"6603558",NA,NA,"0","0","0","20130807173101",NA,NA,NA,NA,NA,"200"
"22527439","20130821173138","Olho nos dois Ministros do PT. O Lendowiswski e o Reprovado","APPROVED","0","FALSE","1","0","NONE","FALSE","0.0",NA,"FALSE","0","VISIBLE","MESSAGE",NA,"43d1ts6fxaur","538780725136063539","deveres","1","http://forum.imguol.com//forum/themes/jogos/images/nopic.gif","538780725136063539","UOLK","538780725136063539@UOLK",NA,NA,NA,NA,NA,NA,NA,NA,NA,"6603558",NA,NA,"0","0","0","20130807173101",NA,NA,NA,NA,NA,"200"
"22527276","20130821172450","Só queria saber por que Lulinha paz & amor não pode incluso como réu no julgamento. Se ele não ""sabia de nada"", não tem o que temer. Ou tem???","APPROVED","0","FALSE","3","0","NONE","FALSE","0.0",NA,"FALSE","0","VISIBLE","MESSAGE",NA,"n8ras4a4eb74","3059320989337541680","Danger Mouse","1","http://forum.imguol.com//forum/themes/jogos/images/nopic.gif","3059320989337541680","UOLK","3059320989337541680@UOLK",NA,NA,NA,NA,NA,NA,NA,NA,NA,"6603558",NA,NA,"0","0","0","20130807173101",NA,NA,NA,NA,NA,"200"
"22527073","20130821171511","A pergunta é: De quem será que o Marco Aurélio está Lewandowski por fora?","APPROVED","0","TRUE","4","0","NONE","FALSE","0.0",NA,"FALSE","0","VISIBLE","MESSAGE",NA,"24c5bqbic09t","279101785772411489","M Marcelo","1","http://forum.imguol.com//forum/themes/jogos/images/nopic.gif","279101785772411489","UOLK","279101785772411489@UOLK",NA,NA,NA,NA,NA,NA,NA,NA,NA,"6603558",NA,NA,"0","0","0","20130807173101",NA,NA,NA,NA,NA,"200"
"22527030","20130821171315","o lewandowski gosta dos mensaleiros é bem suspeito","APPROVED","0","FALSE","1","0","NONE","FALSE","0.0",NA,"FALSE","0","VISIBLE","MESSAGE",NA,"6at6uot67djv","829256377788701275","fidivo-df","1","http://forum.imguol.com//forum/themes/jogos/images/nopic.gif","829256377788701275","UOLK","829256377788701275@UOLK",NA,NA,NA,NA,NA,NA,NA,NA,NA,"6603558",NA,NA,"0","0","0","20130807173101",NA,NA,NA,NA,NA,"200"
"22526895","20130821170653","Tem ministro que está querendo amenizar a situação dos réus. O povo brasileiro não pode deixar que isso aconteça. Vamos para as ruas.  ","APPROVED","0","FALSE","4","0","NONE","FALSE","0.0",NA,"FALSE","0","VISIBLE","MESSAGE",NA,NA,NA,"Ilson Br&iacute;gida","1","https://fbcdn-profile-a.akamaihd.net/hprofile-ak-ash4/369380_100001082185993_2028777819_q.jpg","100001082185993","FACEBOOK","100001082185993@FACEBOOK",NA,NA,NA,NA,NA,NA,NA,NA,NA,"6603558",NA,NA,"0","0","0","20130807173101",NA,NA,NA,NA,NA,"200"
"22526823","20130821170337","COmo pode o sapo barbudo caxaceiro nao estar ai na lista?? Somente nesse pais comunista q eh o Brasil .","APPROVED","0","FALSE","1","0","NONE","FALSE","0.0",NA,"FALSE","0","VISIBLE","MESSAGE",NA,"hujt19egv7mn","2349265268714508383","Revolta total","1","http://forum.imguol.com//forum/themes/jogos/images/nopic.gif","2349265268714508383","UOLK","2349265268714508383@UOLK",NA,NA,NA,NA,NA,NA,NA,NA,NA,"6603558",NA,NA,"0","0","0","20130807173101",NA,NA,NA,NA,NA,"200"
"22526811","20130821170306","Não era preciso os condenados pelo escândalo de mensalão contratarem caros advogados se o melhor advogado de defesa pertence ao próprio STF.  Esse tal  de ministro Lewandowski é um tremendo cara de pau. Está indo contra toda a população brasileira que quer ver esses ladrões do dinheiro público, presos.  O exemplo tem que vir de cima, isto da mais alta Corte fato que não está acontecendo.  Quanto ao min istro Dias Tófoli, outra conduta não se podia esperar dele posto que foi  (ou ainda seria ?) advogado do PT e do José Dirceu.  Precisa falar mais alguma coisa. É um blá-blá-blá insuportável que , possivelmente não levará a lugar nenhum. , isto é, quanta inutilidade.

","APPROVED","0","FALSE","1","0","NONE","FALSE","0.0",NA,"FALSE","0","VISIBLE","MESSAGE",NA,"bmdzjbf1lftx","1529694760003170405","Renariando","1","http://forum.imguol.com//forum/themes/jogos/images/nopic.gif","1529694760003170405","UOLK","1529694760003170405@UOLK",NA,NA,NA,NA,NA,NA,NA,NA,NA,"6603558",NA,NA,"0","0","0","20130807173101",NA,NA,NA,NA,NA,"200"
"22526798","20130821170240","Esse Ministro Joaquim Barbosa é o ""cara"". É justo e tem notável saber jurídico. O ex presidente Lula deve estar bastante arrependido da sua indicação. Quis fazer populismo e atirou no pé.   ","APPROVED","0","FALSE","3","0","NONE","FALSE","0.0",NA,"FALSE","0","VISIBLE","MESSAGE",NA,"3hgnm9hd543u","458711394495087882","cascasul","1","http://forum.imguol.com//forum/themes/jogos/images/nopic.gif","458711394495087882","UOLK","458711394495087882@UOLK",NA,NA,NA,NA,NA,NA,NA,NA,NA,"6603558",NA,NA,"0","0","0","20130807173101",NA,NA,NA,NA,NA,"200"
"22526729","20130821165952","Desculpe a minha ignorância = Os srs Dias Toffoli e Ricardo Lewandowski são Ministros do STF? Por um instante (vendo a votação acima) pensei q eram advogados de defesa dos réus. Salve Barbosa!","APPROVED","0","TRUE","3","0","NONE","FALSE","0.0",NA,"FALSE","0","VISIBLE","MESSAGE",NA,"6yg9y3rj6dg3","915692631888328851","Jr - SP","1","http://forum.imguol.com//forum/themes/jogos/images/nopic.gif","915692631888328851","UOLK","915692631888328851@UOLK",NA,NA,NA,NA,NA,NA,NA,NA,NA,"6603558",NA,NA,"0","0","0","20130807173101",NA,NA,NA,NA,NA,"200"
"22526248","20130821163726","Para acompanharem a votação dos recursos do mensalão.","APPROVED","0","FALSE","0","0","NONE","FALSE","0.0",NA,"FALSE","0","VISIBLE","MESSAGE",NA,NA,NA,"Rui Arruda Camargo","1","https://fbcdn-profile-a.akamaihd.net/hprofile-ak-prn1/174087_100000466564620_1488005_q.jpg","100000466564620","FACEBOOK","100000466564620@FACEBOOK",NA,NA,NA,NA,NA,NA,NA,NA,NA,"6603558",NA,NA,"0","0","0","20130807173101",NA,NA,NA,NA,NA,"200"
"22526246","20130821163721","Estão esperando o q pra investigar o Marco Aurelio? Seus votos ja denotam algo estranho...
","APPROVED","0","TRUE","0","0","NONE","FALSE","0.0",NA,"FALSE","0","VISIBLE","MESSAGE",NA,"r2abodkknrzs","3562146862679138680","Justuss","1","http://forum.imguol.com/avatars/gallery/noticias/Celebridades 01/celebridades0004.jpg","3562146862679138680","UOLK","3562146862679138680@UOLK",NA,NA,NA,NA,NA,NA,NA,NA,NA,"6603558",NA,NA,"0","0","0","20130807173101",NA,NA,NA,NA,NA,"200"
"22525933","20130821162003","O Ministro, será que todos estão errados e só um certo? O QUE TÁ FALTANDO PRA ESSES MINISTROS VEREM QUE O POVO NÃO QUER MAIS VAGABUNDAGEM COM O DINHEIRO PUBLICO???? SERÁ QUE VAI TER QUE SER RADICAL?????
FAÇAM UMA REFLEXÃO E PENSEM ONDE ESTÃO LEVANDO O POVO BRASILEIRO A AGIR.. QUAIS SERÃO AS ATITUDES A SEREM TOMADAS NUM FUTURO PRÓXIMO....
","APPROVED","0","FALSE","0","0","NONE","FALSE","0.0",NA,"FALSE","0","VISIBLE","MESSAGE",NA,NA,NA,"Atila Rosa","1","https://fbcdn-profile-a.akamaihd.net/hprofile-ak-ash4/275764_1178296055_2032689000_q.jpg","1178296055","FACEBOOK","1178296055@FACEBOOK",NA,NA,NA,NA,NA,NA,NA,NA,NA,"6603558",NA,NA,"0","0","0","20130807173101",NA,NA,NA,NA,NA,"200"
"22524794","20130821152110","Apoio da sociedade ?!?!?! quem ? ","APPROVED","0","FALSE","0","0","NONE","FALSE","0.0",NA,"FALSE","0","VISIBLE","MESSAGE",NA,"du1p718alz8a","1820939542083198874","videbula ","1","http://forum.imguol.com//forum/themes/jogos/images/nopic.gif","1820939542083198874","UOLK","1820939542083198874@UOLK",NA,NA,NA,NA,NA,NA,NA,NA,NA,"6603558",NA,NA,"0","0","0","20130807173101",NA,NA,NA,NA,NA,"200"
"22462121","20130818210642","E tudo ta indicando que nossos ministros , não esta a favor da lei e sim afim de salvar  a pele  bandidos condenados, so não ver quem e cego, acorda brasil., Ministros kd?????????????????//","APPROVED","0","TRUE","2","0","NONE","FALSE","0.0",NA,"FALSE","0","VISIBLE","MESSAGE",NA,"md09036b4qjr","2943232941151703655","Discoveri brarsil","1","http://forum.imguol.com/avatars/gallery/noticias/Basquete 01/1127.gif","2943232941151703655","UOLK","2943232941151703655@UOLK",NA,NA,NA,NA,NA,NA,NA,NA,NA,"6603558",NA,NA,"0","0","0","20130807173101",NA,NA,NA,NA,NA,"200"
"22458070","20130818183739","Tem gente que ja levou mais e ainda esta levando wiski","APPROVED","0","FALSE","2","0","NONE","FALSE","0.0",NA,"FALSE","0","VISIBLE","MESSAGE",NA,"9iu8t378fmwc","1253477833609385388","obama do brasil","1","http://forum.imguol.com/avatars/gallery/noticias/Celebridades 13/celebridades0600.jpg","1253477833609385388","UOLK","1253477833609385388@UOLK",NA,NA,NA,NA,NA,NA,NA,NA,NA,"6603558",NA,NA,"0","0","0","20130807173101",NA,NA,NA,NA,NA,"200"
"22457971","20130818183401","Se ve exatamente quem é ministro e quem advoga para quadrilheiros.","APPROVED","0","FALSE","1","0","NONE","FALSE","0.0",NA,"FALSE","0","VISIBLE","MESSAGE",NA,"9iu8t378fmwc","1253477833609385388","obama do brasil","1","http://forum.imguol.com/avatars/gallery/noticias/Celebridades 13/celebridades0600.jpg","1253477833609385388","UOLK","1253477833609385388@UOLK",NA,NA,NA,NA,NA,NA,NA,NA,NA,"6603558",NA,NA,"0","0","0","20130807173101",NA,NA,NA,NA,NA,"200"
"22456999","20130818180022","BONZINHO E COMPREENSIVO ESSE TAL MINISTRO MARCO AURÉLIO...","APPROVED","0","FALSE","1","0","NONE","FALSE","0.0",NA,"FALSE","0","VISIBLE","MESSAGE",NA,"9zbuxkqnisua","1313765303967875458","NilsonSimas","1","http://forum.imguol.com//forum/themes/jogos/images/nopic.gif","1313765303967875458","UOLK","1313765303967875458@UOLK",NA,NA,NA,NA,NA,NA,NA,NA,NA,"6603558",NA,NA,"0","0","0","20130807173101",NA,NA,NA,NA,NA,"200"
"22452787","20130818140037","A honestidade e a inocência diriam - podem incluir meu nome no caso mensalão; é melhor para o povo e melhor para mim. Mas o Lula, ao invés desse comportamento, prefere chamar os Juízes, procuradores e eventuais testemunhas de ""bandidos"".","APPROVED","0","FALSE","1","0","NONE","FALSE","0.0",NA,"FALSE","0","VISIBLE","MESSAGE",NA,"hvf52htdyg9f","2352447577370646483","Somendra","1","http://forum.imguol.com//forum/themes/jogos/images/nopic.gif","2352447577370646483","UOLK","2352447577370646483@UOLK",NA,NA,NA,NA,NA,NA,NA,NA,NA,"6603558",NA,NA,"0","0","0","20130807173101",NA,NA,NA,NA,NA,"200"
"22424655","20130816210539","Acredito que os ministros do Supremo não julgam com imparcialidade, visto que são indicados pela Presidência da República e é conhecida a trajetória do ""beija mãos"" a políticos para se assegurar o cargo. Já que há tantas manifestações por reformas, fica uma sugestão: Ministro do Supremo seria carreira de Estado de juízes de instancias inferiores que por merecimento e comprovado saber, indicados pelo Conselho de Magistratura e referendados pelo Senado. Os Tribunais de Contas mereceriam idêntico tratamento. ","APPROVED","0","FALSE","0","0","NONE","FALSE","0.0",NA,"FALSE","0","VISIBLE","MESSAGE",NA,NA,NA,"luiz antonio velloso","1","http://a0.twimg.com/sticky/default_profile_images/default_profile_3_normal.png","94779471","TWITTER","94779471@TWITTER",NA,NA,NA,NA,NA,NA,NA,NA,NA,"6603558",NA,NA,"0","0","0","20130807173101",NA,NA,NA,NA,NA,"200"
"22422636","20130816190952","O julgamento do mensalão foi  comentado, observado, questionado e, portanto, sujeito a juízos de valor que se tem notícia na história do Brasil recente. Na realidade, parece não ter havido episódio da vida jurídica nacional que tenha tido semelhante repercussão e gerado tantas opiniões. Vamos acabar do  jargão  jurídico, que internamente prejudica o acompanhamento da sociedade geral, na  manobra para dificultar o andamento do processo.
","APPROVED","0","FALSE","0","0","NONE","FALSE","0.0",NA,"FALSE","0","VISIBLE","MESSAGE",NA,NA,NA,"Jos&eacute; Ribamar Viana Filho","1","https://fbcdn-profile-a.akamaihd.net/hprofile-ak-prn2/212001_100006040364205_1555110452_q.jpg","100006040364205","FACEBOOK","100006040364205@FACEBOOK",NA,NA,NA,NA,NA,NA,NA,NA,NA,"6603558",NA,NA,"0","0","0","20130807173101",NA,NA,NA,NA,NA,"200"
"22412454","20130816103627","Solicitarei em todas as redes sociais que as pessoas se mobilizem para descobrir os enderecos destes ministros que estao defendendo o Dirceu....e facam um vigilia em frente a casa dos familiares dos mesmos, exigindo a condenacao destes politicos do mensalao....","APPROVED","0","FALSE","2","0","NONE","FALSE","0.0",NA,"FALSE","0","VISIBLE","MESSAGE",NA,"0e8ioul54r0b","52051425114380987","rendido","1","http://forum.imguol.com//forum/themes/jogos/images/nopic.gif","52051425114380987","UOLK","52051425114380987@UOLK",NA,NA,NA,NA,NA,NA,NA,NA,NA,"6603558",NA,NA,"0","0","0","20130807173101",NA,NA,NA,NA,NA,"200"
"22406581","20130815234555","Voce e tão inocente ? Leve dowiski? Será que um criminoso antes de uma lei deve se julgado de forma  diferente após a mudança desta? Então antes nao era criminoso antes e agora êh? Ótima maneira de se safar de um crime. Viva nosso Brasil e lewandowisk . Viva nosso ilustre ministro. que durma em paz. E nos pagamos o preço.","APPROVED","0","TRUE","0","0","NONE","FALSE","0.0",NA,"FALSE","0","VISIBLE","MESSAGE",NA,"kkofxwu29879","2708039658747481029","Nappy","1","http://forum.imguol.com//forum/themes/jogos/images/nopic.gif","2708039658747481029","UOLK","2708039658747481029@UOLK",NA,NA,NA,NA,NA,NA,NA,NA,NA,"6603558",NA,NA,"0","0","0","20130807173101",NA,NA,NA,NA,NA,"200"
"22404079","20130815214227","Se o Levando Oski deixar, acho que a coisa vai ser rapida...","APPROVED","0","FALSE","0","0","NONE","FALSE","0.0",NA,"FALSE","0","VISIBLE","MESSAGE",NA,"8i0h1k7v3v8l","1118832563903020005","Hoboligo","1","http://forum.imguol.com//forum/themes/jogos/images/nopic.gif","1118832563903020005","UOLK","1118832563903020005@UOLK",NA,NA,NA,NA,NA,NA,NA,NA,NA,"6603558",NA,NA,"0","0","0","20130807173101",NA,NA,NA,NA,NA,"200"
"22402933","20130815205803","Não entendo porque não querem incluir Lula no processo. Seria ótimo e aí sim, poderiam esclarecer e comprovar muitas coisas, que são de domínio público, mas não se apura.","APPROVED","0","FALSE","1","0","NONE","FALSE","0.0",NA,"FALSE","0","VISIBLE","MESSAGE",NA,"rg5hxwmfgief","3612842954464659495","Tide","1","http://forum.imguol.com//forum/themes/jogos/images/nopic.gif","3612842954464659495","UOLK","3612842954464659495@UOLK",NA,NA,NA,NA,NA,NA,NA,NA,NA,"6603558",NA,NA,"0","0","0","20130807173101",NA,NA,NA,NA,NA,"200"
"22402927","20130815205734","Quero saber sobre o julgamento do mensalão do PSDB em MG. Não sejamos hipócritas, foi lá que tudo começou.  Marcos Valério e Cia Ltda... Só será justo se ambos os esquemas forem julgados da mesma forma e os responsáveis condenados. Se a coisa for parcial será uma INjustiça. ","APPROVED","0","FALSE","1","0","NONE","FALSE","0.0",NA,"FALSE","0","VISIBLE","MESSAGE",NA,NA,NA,"Rogerio Furlan","1","https://fbcdn-profile-a.akamaihd.net/hprofile-ak-ash3/211371_100004066464359_283194680_q.jpg","100004066464359","FACEBOOK","100004066464359@FACEBOOK",NA,NA,NA,NA,NA,NA,NA,NA,NA,"6603558",NA,NA,"0","0","0","20130807173101",NA,NA,NA,NA,NA,"200"
"22400690","20130815191929","Mas, quanta demora pra prender esses ladrões do dinheiro público. Dá até pra desconfiar de alguma mutreta. Vou até perguntar pro tofoli ...","APPROVED","0","FALSE","0","0","NONE","FALSE","0.0",NA,"FALSE","0","VISIBLE","MESSAGE",NA,NA,NA,"Julio Carmo","1","https://fbcdn-profile-a.akamaihd.net/static-ak/rsrc.php/v2/yo/r/UlIqmHJn-SK.gif","100003402276286","FACEBOOK","100003402276286@FACEBOOK",NA,NA,NA,NA,NA,NA,NA,NA,NA,"6603558",NA,NA,"0","0","0","20130807173101",NA,NA,NA,NA,NA,"200"
"22400620","20130815191617","Grato a UOL pela tabela e transparencia da votação,podemos avaliar quem esta cumprindo corretamente suas funções.","APPROVED","0","FALSE","5","0","NONE","FALSE","0.0",NA,"FALSE","0","VISIBLE","MESSAGE",NA,"waciadoqmqak","4249726420247263388","zk1","1","http://forum.imguol.com//forum/themes/jogos/images/nopic.gif","4249726420247263388","UOLK","4249726420247263388@UOLK",NA,NA,NA,NA,NA,NA,NA,NA,NA,"6603558",NA,NA,"0","0","0","20130807173101",NA,NA,NA,NA,NA,"200"
"22400574","20130815191418","Esperamos que o STF resgate a confiança do povo brasileiro na justiça, se esses julgados não forem presos sera desmoralização da justiça brasileira","APPROVED","0","FALSE","0","0","NONE","FALSE","0.0",NA,"FALSE","0","VISIBLE","MESSAGE",NA,"waciadoqmqak","4249726420247263388","zk1","1","http://forum.imguol.com//forum/themes/jogos/images/nopic.gif","4249726420247263388","UOLK","4249726420247263388@UOLK",NA,NA,NA,NA,NA,NA,NA,NA,NA,"6603558",NA,NA,"0","0","0","20130807173101",NA,NA,NA,NA,NA,"200"
"22398957","20130815175815","Cadeia de imediato aos julgados e condenados mensaleiros e corruptos dos PTralhas, traidores da nação.","APPROVED","0","FALSE","0","0","NONE","FALSE","0.0",NA,"FALSE","0","VISIBLE","MESSAGE",NA,NA,NA,"Rui Mascarenhas","1","https://fbcdn-profile-a.akamaihd.net/hprofile-ak-ash4/370122_100001971037572_710088667_q.jpg","100001971037572","FACEBOOK","100001971037572@FACEBOOK",NA,NA,NA,NA,NA,NA,NA,NA,NA,"6603558",NA,NA,"0","0","0","20130807173101",NA,NA,NA,NA,NA,"200"
