"id","created","content","moderation_status","parent_id","has_child","like","dislike","recommended","has_rating","rating_average","rating_content","has_more_children","reply_count","message_status","message_type","idt_group_user","cod_profile","cod_profile_hash","nick","user_status","avatar","social_user","social_network","unique_user_id","user_signature","user_register","user_total_messages","user_total_pins","user_total_bookmarks","user_total_likes","profile_nick","profile_url","media_content","subject_id","subject_url","subject_title","subject_views","subject_total","subject_like","subject_start","subject_owner_name","subject_owner_id","subject_owner_cod_profile","subject_owner_userSource","replies","sc"
"27480773","20140121162633","Isso mostra o radicalismo da comunidade gay. Sem qualquer conhecimento de causa querem dar o veredito","APPROVED","0","TRUE","6","0","NONE","FALSE","0.0",NA,"FALSE","0","VISIBLE","MESSAGE",NA,"b1ejpgsadh1g","1452972336829698436","Rodrigoesa","1","http://forum.imguol.com//forum/themes/jogos/images/nopic.gif","1452972336829698436","UOLK","1452972336829698436@UOLK",NA,NA,NA,NA,NA,NA,NA,NA,NA,"7368994",NA,NA,"0","0","0","20140121151630",NA,NA,NA,NA,NA,"200"
"27480771","20140121162631","Cade a Maria do Rosário agora?","APPROVED","0","FALSE","8","0","NONE","FALSE","0.0",NA,"FALSE","0","VISIBLE","MESSAGE",NA,"tpfhev369oz9","3910005895416252597","Tiago F F","1","http://forum.imguol.com//forum/themes/jogos/images/nopic.gif","3910005895416252597","UOLK","3910005895416252597@UOLK",NA,NA,NA,NA,NA,NA,NA,NA,NA,"7368994",NA,NA,"0","0","0","20140121151630",NA,NA,NA,NA,NA,"200"
"27480769","20140121162629","Suicídio. Ok, ele tirou todos os dentes antes de se jogar do viaduto. Estranho, não acham? ","APPROVED","0","TRUE","2","0","NONE","FALSE","0.0",NA,"FALSE","0","VISIBLE","MESSAGE",NA,"z75c8to45gsi","4632895088160184386","SauloM","1","http://forum.imguol.com//forum/themes/jogos/images/nopic.gif","4632895088160184386","UOLK","4632895088160184386@UOLK",NA,NA,NA,NA,NA,NA,NA,NA,NA,"7368994",NA,NA,"0","0","0","20140121151630",NA,NA,NA,NA,NA,"200"
"27480764","20140121162617","Piada de profundo mau gosto o argumento de que a família conduziu uma investigação paralela à da polícia, considerando que essa família, ao que consta, não possui assim poder financeiro para tanto e que a polícia, muito embora de pouca inteligencia, pouco tinha esclarecido até então.","APPROVED","0","TRUE","0","0","NONE","FALSE","0.0",NA,"FALSE","0","VISIBLE","MESSAGE",NA,"uefebvge06hc","4001401158794665680","shuonga","1","http://forum.imguol.com//forum/themes/jogos/images/nopic.gif","4001401158794665680","UOLK","4001401158794665680@UOLK",NA,NA,NA,NA,NA,NA,NA,NA,NA,"7368994",NA,NA,"0","0","0","20140121151630",NA,NA,NA,NA,NA,"200"
"27480734","20140121162432","Com essa nova face da sociedade, onde todas as minorias consideradas excluisdas, é mais facil considerar que no caso, o rapaz gay, foi morto, por homofobia, doque considerar que o rapaz gay, sofria de depreção!
Ou seja, conclui-se oque se que se quer, em de uma realidade pessoal!
Onde vamos parar!!
O cara é Gay, frustrado, problematico, depressivo, e sociedade tem que acreditar, em homofobia!!","APPROVED","0","TRUE","0","0","NONE","FALSE","0.0",NA,"FALSE","0","VISIBLE","MESSAGE",NA,"ejlk7h4hnaf9","1914360631267075461","Jeton Pinto","1","http://forum.imguol.com/avatars/gallery/noticias/Desenhos 02/desenhos0058.jpg","1914360631267075461","UOLK","1914360631267075461@UOLK",NA,NA,NA,NA,NA,NA,NA,NA,NA,"7368994",NA,NA,"0","0","0","20140121151630",NA,NA,NA,NA,NA,"200"
"27480709","20140121162338","Estranho, de repente muda !!!!!!","APPROVED","0","FALSE","0","0","NONE","FALSE","0.0",NA,"FALSE","0","VISIBLE","MESSAGE",NA,"lz7xs2vieixc","2892827542868960592","HOMEM DAS CAVERNA","1","http://forum.imguol.com//forum/themes/jogos/images/nopic.gif","2892827542868960592","UOLK","2892827542868960592@UOLK",NA,NA,NA,NA,NA,NA,NA,NA,NA,"7368994",NA,NA,"0","0","0","20140121151630",NA,NA,NA,NA,NA,"200"
"27480675","20140121162213","O suicídio de um jovem sempre causa muita dor, especialmente para os pais. Peço a Deus que dê forças e console a mãe do Kaique!","APPROVED","0","FALSE","1","0","NONE","FALSE","0.0",NA,"FALSE","0","VISIBLE","MESSAGE",NA,"qbpjlve07fqi","3464976356719162218","Emily61","1","http://forum.imguol.com//forum/themes/jogos/images/nopic.gif","3464976356719162218","UOLK","3464976356719162218@UOLK",NA,NA,NA,NA,NA,NA,NA,NA,NA,"7368994",NA,NA,"0","0","0","20140121151630",NA,NA,NA,NA,NA,"200"
"27480454","20140121161115","Bem, agora não vai faltar quem diga que a família foi ameaçada pela própria polícia a dizer isso. Espero que haja a conclusão da investigação, que haja acesso a essas provas principalmente a esse diário, etc. E que certos militantes e blogueiros auto-proclamados de progressistas, humanistas, defensores da liberdade etc parem de fazer o sensacionalismo que fazem ao mesmo tempo que criticam o sensacionalismo de outros.","APPROVED","0","TRUE","5","0","NONE","FALSE","0.0",NA,"FALSE","0","VISIBLE","MESSAGE",NA,"rh4m412qn80l","3616409317266045525","Antonio M","1","http://forum.imguol.com//forum/themes/jogos/images/nopic.gif","3616409317266045525","UOLK","3616409317266045525@UOLK",NA,NA,NA,NA,NA,NA,NA,NA,NA,"7368994",NA,NA,"0","0","0","20140121151630",NA,NA,NA,NA,NA,"200"
"27480436","20140121161032","Que bobagem, a imprensa se preocupar com isso. Afinal, o que ele fez DE BOM pelo país? Quem era essa figura? 
BORA PUBLICAR COISA IMPORTANTES!!!","APPROVED","0","TRUE","4","0","NONE","FALSE","0.0",NA,"FALSE","0","VISIBLE","MESSAGE",NA,"6s98aj2uzmad","893040093038129557","Brasileiro, apenas","1","http://forum.imguol.com//forum/themes/jogos/images/nopic.gif","893040093038129557","UOLK","893040093038129557@UOLK",NA,NA,NA,NA,NA,NA,NA,NA,NA,"7368994",NA,NA,"0","0","0","20140121151630",NA,NA,NA,NA,NA,"200"
"27480386","20140121160756","Independente da tragédia que aconteceu com este garoto, e da forma como aconteceu esta fatalidade, é necessário que o MP e o Conselho Tutelar averigue estas festas que acolhem menores durante a madrugada sem nenhum responsável legal e o pior fornecendo bebidas alcoólicas, no estilo ""OpenBar"".","APPROVED","0","TRUE","6","0","NONE","FALSE","0.0",NA,"FALSE","0","VISIBLE","MESSAGE",NA,"g7awtlxznujw","2132648565968908652","flsouza","1","http://forum.imguol.com/avatars/gallery/noticias/Tecnologia 01/icones0023.jpg","2132648565968908652","UOLK","2132648565968908652@UOLK",NA,NA,NA,NA,NA,NA,NA,NA,NA,"7368994",NA,NA,"0","0","0","20140121151630",NA,NA,NA,NA,NA,"200"
"27480294","20140121160342","A ministra Maria do Rosário, que, contrariando as investigações, afirmou que o rapaz foi assassinado brutalmente, deveria vir a público pedir desculpas à Polícia de São Paulo.","APPROVED","0","TRUE","11","0","NONE","FALSE","0.0",NA,"FALSE","0","VISIBLE","MESSAGE",NA,"8l95ls0ujntf","1130682809787669843","MPJ","1","http://forum.imguol.com//forum/themes/jogos/images/nopic.gif","1130682809787669843","UOLK","1130682809787669843@UOLK",NA,NA,NA,NA,NA,NA,NA,NA,NA,"7368994",NA,NA,"0","0","0","20140121151630",NA,NA,NA,NA,NA,"200"
"27480101","20140121155328","Não sou homofóbico e tenho alguns amigos gays. Mas os Gays e seus familiares têm que para com esse complexo de perseguição. Agora só pq são Gays, acham QUE PODE TUDO, fazer tudo e a hora que querem. Pelo contrário, levantam a possibilidade de homofobia, de preconceito e perseguição. Agora mesmo li uma decisão do TJSC negando indenização por dano moral contra um Gay em briga de vizinhos. Oras, se o meu vizinho faz algazarra até altas horas, independentemente de ele ser hétero ou não, logicamente eu vou resguardar meu direito de sossego. O vizinho Gay (fazendo festa pela madrugada), acho que o vizinho hétero é homofóbico, pq reclamou da bagunça na madrugada.     ","APPROVED","0","TRUE","26","0","NONE","FALSE","0.0",NA,"FALSE","0","VISIBLE","MESSAGE",NA,"7y1d46b5eyg5","1045799875435050725","Bscunha","1","http://forum.imguol.com//forum/themes/jogos/images/nopic.gif","1045799875435050725","UOLK","1045799875435050725@UOLK",NA,NA,NA,NA,NA,NA,NA,NA,NA,"7368994",NA,NA,"0","0","0","20140121151630",NA,NA,NA,NA,NA,"200"
"27615865","20140130091945","Tem um tipo de espaço que, obviamente, o governo não conhece e que resolveria isso tudo. Chama-se ESCOLA DE QUALIDADE DE FREQUÊNCIA OBRIGATÓRIA. Chega de mamata para políticos que ""fazem escola"" e para os ""desfavorecidos"", que preferem depredá-las e impedir que aqueles que queiram aprender fiquem sem essa oportunidade. Obrigatoriedade de presença escolar em ambiente de qualidade , sério, profissional. Medidas corretivas aos coitadinhos que depredarem as escolas, traficarem, ameaçarem professores, funcionários, ou seja, fazer a coisa certa. Infelizmente, criar novos espaços na linguagem do polítcos atuais quer dizer: contratar empreiteiras a preços exorbitantes, contratar ONGs de parentes para receberem os repasses e , no final das contas, não ter nada pronto nem funcionando.","APPROVED","0","FALSE","0","0","NONE","FALSE","0.0",NA,"FALSE","0","VISIBLE","MESSAGE",NA,"9g8lrz5jtbre","1243967784938239946","kmasi","1","http://forum.imguol.com//forum/themes/jogos/images/nopic.gif","1243967784938239946","UOLK","1243967784938239946@UOLK",NA,NA,NA,NA,NA,NA,NA,NA,NA,"7372117",NA,NA,"0","0","0","20140122105950",NA,NA,NA,NA,NA,"200"
"27503325","20140122230716","Alguém sem querer fechou um motoqueiro, ou ele te fechou  e você  fez  algum  gesto, ou manifestou irritação?   o que  acontece?   vários motoqueiros cercam seu carro e  te  encaram ...é assim  ...são  grupos que se  juntam e te amedrontam, são grupos que acham que estão acima  de todos. Com a  desculpa de serem carentes, desprovidos de conforto e dinheiro tem que chocar, aparecer coma  pressão. É assim, é fácil  atacar e dividir a sociedade como os pagantes de impostos e  os coitadinhos que precisam que a sociedade supra  tudo, só que o Governo não cumpre a  distribuição da  renda,  eles  arrecadam o dinheiro, se apropriam do  dinheiro e  ainda jogam a culpa na sociedade, na classe média, nos empresários. Eles  arrecadam a  grana  e  sobra para a população  a culpa  das  dificuldades  dos menos favorecidos...A  vá.","APPROVED","0","FALSE","0","0","NONE","FALSE","0.0",NA,"FALSE","0","VISIBLE","MESSAGE",NA,"gjqi3aoxv5kf","2178105869057568495","Azzul","1","http://forum.imguol.com/avatars/gallery/noticias/Tecnologia 01/icones0029.jpg","2178105869057568495","UOLK","2178105869057568495@UOLK",NA,NA,NA,NA,NA,NA,NA,NA,NA,"7372117",NA,NA,"0","0","0","20140122105950",NA,NA,NA,NA,NA,"200"
"27502053","20140122212131","NÃO ADIANTA CRIAR ESSES ESPAÇOS PQ ELES KEREM MESMO É CAUSAR TUMULTUAR!!!! AQUI PROX DA MINHA CASA TEM UM CEU E UM CENTRO DE CULTURA AONDE ENSINA ARTES PINTURA VIOLAO INFORMATICA DANÇA CAPOEIRA AULA DE ESPANHO E INGLES ENTRE OUTROS EVC VAI LÁ SEMPRE TÁ VAZIO!!! PQ ELES NAO VÃO LÁ????","APPROVED","0","FALSE","1","0","NONE","FALSE","0.0",NA,"FALSE","0","VISIBLE","MESSAGE",NA,"7ahy069uz1n0","959735961953629452","socoloco","1","http://forum.imguol.com//forum/themes/jogos/images/nopic.gif","959735961953629452","UOLK","959735961953629452@UOLK",NA,NA,NA,NA,NA,NA,NA,NA,NA,"7372117",NA,NA,"0","0","0","20140122105950",NA,NA,NA,NA,NA,"200"
"27500906","20140122200217","Ouvi dizer que no MASP sábado próximo as 17:00 hs vai ter um rolezinho contra a copa kkkkk este rolezinho ai a Dilma curte?","APPROVED","0","FALSE","0","0","NONE","FALSE","0.0",NA,"FALSE","0","VISIBLE","MESSAGE",NA,"ava7afth7aye","1430594115476449334","FEREX","1","http://forum.imguol.com//forum/themes/jogos/images/nopic.gif","1430594115476449334","UOLK","1430594115476449334@UOLK",NA,NA,NA,NA,NA,NA,NA,NA,NA,"7372117",NA,NA,"0","0","0","20140122105950",NA,NA,NA,NA,NA,"200"
"27499331","20140122180949","Essa turma não quer espaço para lazer não. Eles querem é azucrinar a vida dos outros. Se o governo de São Paulo realmente criar estes espaços para estes desocupados, perderá tempo e dinheiro do contribuinte. Os aproveitadores de plantão usam estes cabeças de vento para criarem polêmica sobre direitos humanos,racismo e aparecerem na mídia. Geração perdida.","APPROVED","0","FALSE","3","0","NONE","FALSE","0.0",NA,"FALSE","0","VISIBLE","MESSAGE",NA,"cp96s3kkjhos","1671797575349007436","Malicuia","1","http://forum.imguol.com//forum/themes/jogos/images/nopic.gif","1671797575349007436","UOLK","1671797575349007436@UOLK",NA,NA,NA,NA,NA,NA,NA,NA,NA,"7372117",NA,NA,"0","0","0","20140122105950",NA,NA,NA,NA,NA,"200"
"27499157","20140122175531","A maioria já prefere ""rolê"" do que escola!. Mais uma geração pronta prá mediocridade e pra viver as custas de bolsa família e similares","APPROVED","0","FALSE","2","0","NONE","FALSE","0.0",NA,"FALSE","0","VISIBLE","MESSAGE",NA,NA,NA,"Julio Souzajip","1","http://abs.twimg.com/sticky/default_profile_images/default_profile_6_normal.png","118658483","TWITTER","118658483@TWITTER",NA,NA,NA,NA,NA,NA,NA,NA,NA,"7372117",NA,NA,"0","0","0","20140122105950",NA,NA,NA,NA,NA,"200"
"27499003","20140122174119","DILMA VAI CRIAR O BOLSA-RALÉ, OU MELHOR, BOLSA-ROLÉ... A MESMA COISA.","APPROVED","0","FALSE","2","0","NONE","FALSE","0.0",NA,"FALSE","0","VISIBLE","MESSAGE",NA,"6s98aj2uzmad","893040093038129557","Brasileiro, apenas","1","http://forum.imguol.com//forum/themes/jogos/images/nopic.gif","893040093038129557","UOLK","893040093038129557@UOLK",NA,NA,NA,NA,NA,NA,NA,NA,NA,"7372117",NA,NA,"0","0","0","20140122105950",NA,NA,NA,NA,NA,"200"
"27498823","20140122172723","Que tal criar escolas profissionais  com tempo integral para estes ""pobres rapazes e moças""?... Duvido que iriam querer. O negócio é vandalismo, impunidade, e leis que só desestruturam o Estado Brasileiro. Hoje são os shoppings, amanhas serão nossas casas. O senhor GERALDO ALKCMIM, demonstra assim como seu secretariado, uma imensa falta de capacidade de impor a lei no estado de São Paulo, assim como covardia, inépcia mental. Quanto a Presidente e seus ministros, só se pode esperar o pior, afinal, são a nata de um regime que aos poucos vai desintegrando a família e a sociedade brasileira. 
Insisto, falta pouco para que nossas casa sejam invadidas, depredadas, roubadas, com a complacência do Estado. A mídia está aparelhada, o 
Congresso aparelhado, o Judiciário com as últimas nomeações, também aparelhado. Não falta bons cargos públicos para parentes de oficiais superiores de nossas Forças Armadas. No final, já estamos caindo num abismo sem fundo ","APPROVED","0","TRUE","2","0","NONE","FALSE","0.0",NA,"FALSE","0","VISIBLE","MESSAGE",NA,"eab5ae75gkz9","1880397517814288181","godar","1","http://forum.imguol.com/avatars/gallery/noticias/Basquete 01/1105.gif","1880397517814288181","UOLK","1880397517814288181@UOLK",NA,NA,NA,NA,NA,NA,NA,NA,NA,"7372117",NA,NA,"0","0","0","20140122105950",NA,NA,NA,NA,NA,"200"
"27498822","20140122172702","Algum tempo atrás, todos se divertiam com o que havia, e tudo bem! Em alguns casos, cobravam-se, sim, ações governamentais, mas, dentro da lei, sem desordem. O que está faltando hoje - e que explica, em parte, essa zorra toda -  sobrava antigamente: educação de berço e imposição severa de limites, também por parte do ESTADO. Uns bons puxões de orelha e, se preciso fosse, algumas chineladas, pelos pais, enquanto mais novos os pimpolhos, forjavam, em sua enorme maioria, cidadãos mais conscientes dos limites de seus atos e atentos ao respeito às coisas e pessoas. Isso, não existe mais nos dias de hoje. Pior para o Brasil e suas futuras gerações.","APPROVED","0","FALSE","1","0","NONE","FALSE","0.0",NA,"FALSE","0","VISIBLE","MESSAGE",NA,"w7kk404w5zwd","4239575567117055229","ferino","1","http://forum.imguol.com//forum/themes/jogos/images/nopic.gif","4239575567117055229","UOLK","4239575567117055229@UOLK",NA,NA,NA,NA,NA,NA,NA,NA,NA,"7372117",NA,NA,"0","0","0","20140122105950",NA,NA,NA,NA,NA,"200"
"27498798","20140122172515","Esperem.... agora vem a BOLSA ROLÉ..... e viva o Brasil!!!!","APPROVED","0","FALSE","3","0","NONE","FALSE","0.0",NA,"FALSE","0","VISIBLE","MESSAGE",NA,"ijpgzek7ys1u","2441244590640634242","Jota Bosco","1","http://forum.imguol.com//forum/themes/jogos/images/nopic.gif","2441244590640634242","UOLK","2441244590640634242@UOLK",NA,NA,NA,NA,NA,NA,NA,NA,NA,"7372117",NA,NA,"0","0","0","20140122105950",NA,NA,NA,NA,NA,"200"
"27498711","20140122171825","ESTE PAÍS ESTÁ COLHENDO DÉCADAS DE DESCASO C/ A EDUCAÇÃO. ESSA GERAÇÃO DE ROLEZEIROS, SEM TAPAR O SOL C/ A PENEIRA,  É RESULTADO DESSA POLÍTICA BRASILEIRA DO ""DEIXA PRA LÁ"". AGORA, BUSCAM UM LOCAL P/ ACOMODÁ-LA, PORQUE MUITO PROVAVELMENTE NÃO HÁ MUITO O QUE FAZER EM TERMOS EDUCACIONAIS P/ DESFAZER O ERRO DO ABANDONO SOCIAL EM QUE MILHÕES DE BRASILEIROS SE ENCONTRAM. TERRA DE POLÍTICOS ESTÚPIDOS...","APPROVED","0","FALSE","2","0","NONE","FALSE","0.0",NA,"FALSE","0","VISIBLE","MESSAGE",NA,"xoir1406inax","4433168365626100857","brasileiro enojado","1","http://forum.imguol.com/avatars/gallery/noticias/Presidentes/15.gif","4433168365626100857","UOLK","4433168365626100857@UOLK",NA,NA,NA,NA,NA,NA,NA,NA,NA,"7372117",NA,NA,"0","0","0","20140122105950",NA,NA,NA,NA,NA,"200"
"27498658","20140122171447","Espaços para rolezeiros??????? Caraca!!!!! Mais presídios????","APPROVED","0","FALSE","2","0","NONE","FALSE","0.0",NA,"FALSE","0","VISIBLE","MESSAGE",NA,"0mpc2lvlhcf9","83008542268275237","Brasil??? S&oacute; Deus!!!!","1","http://forum.imguol.com//forum/themes/jogos/images/nopic.gif","83008542268275237","UOLK","83008542268275237@UOLK",NA,NA,NA,NA,NA,NA,NA,NA,NA,"7372117",NA,NA,"0","0","0","20140122105950",NA,NA,NA,NA,NA,"200"
"27498543","20140122170722","Uma coisa é inegavel, quem tem tempo para ficar o dia inteiro postando suas pérolas na internet, só pode ser vagabundo, pois quem trabalha, não consegue tanto tempo disponivel.","APPROVED","0","FALSE","1","0","NONE","FALSE","0.0",NA,"FALSE","0","VISIBLE","MESSAGE",NA,"1bs4rng9ddg8","174696576790928984","osnizinho","1","http://forum.imguol.com/avatars/gallery/noticias/Celebridades 01/celebridades0050.jpg","174696576790928984","UOLK","174696576790928984@UOLK",NA,NA,NA,NA,NA,NA,NA,NA,NA,"7372117",NA,NA,"0","0","0","20140122105950",NA,NA,NA,NA,NA,"200"
"27498426","20140122165734","Já dizia  Pedro do Borel: O problema não é a pessoa na favela... É a favela na pessoa!  Uma coisa é vc dar um ""rolezinho"" com grupo de amigos, chutando alto vai, umas 30 pessoas... mas grupos de 1500 a 2000 pessoas, dançando nos corredores das lojas, fazendo algazarra num centro comercial onde há trabalhadores e consumidores, já é demais!  Não foi feito pra isso!  Outro dia vi uma matéria dizendo que havia um movimento de pessoas sem moradia querendo organizar um ""rolezinho"" no shopping...","APPROVED","0","FALSE","2","0","NONE","FALSE","0.0",NA,"FALSE","0","VISIBLE","MESSAGE",NA,"g7s0v1e0qv8h","2134386481657079969","Raquel Brito","1","http://forum.imguol.com/avatars/gallery/noticias/Gifs Animados 04/animados179.gif","2134386481657079969","UOLK","2134386481657079969@UOLK",NA,NA,NA,NA,NA,NA,NA,NA,NA,"7372117",NA,NA,"0","0","0","20140122105950",NA,NA,NA,NA,NA,"200"
"27498336","20140122165030","A presidente se diz a favor dos rolezinhos, movimento popular, mas quando em viagens ao exterior é a que se hospeda nos hotéis mais caros . Ela vai fazer média porque tem as eleições e jamais vai ser contra esse movimento.  ","APPROVED","0","FALSE","3","0","NONE","FALSE","0.0",NA,"FALSE","0","VISIBLE","MESSAGE",NA,"u4a5iowdhi22","3964306918899786410","insig","1","http://forum.imguol.com//forum/themes/jogos/images/nopic.gif","3964306918899786410","UOLK","3964306918899786410@UOLK",NA,NA,NA,NA,NA,NA,NA,NA,NA,"7372117",NA,NA,"0","0","0","20140122105950",NA,NA,NA,NA,NA,"200"
"27498327","20140122164953","Nabil Sayhoun, representante dos Shoppings do país, sugere que jovens façam rolezinhos no Sambódromo. Kkkkkkkk Esse cara está de sacanagem mesmo. Que a rapaziada do funk andam com roupas e acessórios parecido com fantasia de escola de samba a gente sabe, mas já está esculachando a rapaziada. Kkkkkkkk  Isso não foi nada, o pior foi: “Esse movimento tem que ser respeitado, mas tem que ser respeitado num local específico (…) Shopping Center não é lugar para essas pessoas” Mega, Ultra reacionário. Tá pior que o Dioguito Mainardi. E fim de papo, AWAY! ","APPROVED","0","FALSE","0","0","NONE","FALSE","0.0",NA,"FALSE","0","VISIBLE","MESSAGE",NA,"z7cjxdhf31p3","4633627679496900183","Edson1977","1","http://forum.imguol.com//forum/themes/jogos/images/nopic.gif","4633627679496900183","UOLK","4633627679496900183@UOLK",NA,NA,NA,NA,NA,NA,NA,NA,NA,"7372117",NA,NA,"0","0","0","20140122105950",NA,NA,NA,NA,NA,"200"
"27498285","20140122164649","Mas que palhaçada do governo! Tudo isso é medo de perder a ""boca rica"" não sendo eleito? Maioria dos políticos só sabem ""mamar"" nas tetas do ""'Estado""!
Se o governo constituído não tem ""altura"" para impor a ordem apoiado na Lei,que se demita!","APPROVED","0","FALSE","1","0","NONE","FALSE","0.0",NA,"FALSE","0","VISIBLE","MESSAGE",NA,"q79mv4mb62r3","3448735952352597615","cido vieira","1","http://forum.imguol.com//forum/themes/jogos/images/nopic.gif","3448735952352597615","UOLK","3448735952352597615@UOLK",NA,NA,NA,NA,NA,NA,NA,NA,NA,"7372117",NA,NA,"0","0","0","20140122105950",NA,NA,NA,NA,NA,"200"
"27498272","20140122164607","Ouvi dizer que no MASP sábado as 17:00 hs vai ter um rolezinho contra a copa kkkkk","APPROVED","0","FALSE","2","0","NONE","FALSE","0.0",NA,"FALSE","0","VISIBLE","MESSAGE",NA,"ava7afth7aye","1430594115476449334","FEREX","1","http://forum.imguol.com//forum/themes/jogos/images/nopic.gif","1430594115476449334","UOLK","1430594115476449334@UOLK",NA,NA,NA,NA,NA,NA,NA,NA,NA,"7372117",NA,NA,"0","0","0","20140122105950",NA,NA,NA,NA,NA,"200"
"27498269","20140122164545","Tem que criar espaço de lazer no Estacionamento, Montando uma Enorme JAULA e botando estes animais lá dentro. kkkkk","APPROVED","0","FALSE","2","0","NONE","FALSE","0.0",NA,"FALSE","0","VISIBLE","MESSAGE",NA,"qvl2qst1jez4","3537645713025025936","cecel45","1","http://forum.imguol.com//forum/themes/jogos/images/nopic.gif","3537645713025025936","UOLK","3537645713025025936@UOLK",NA,NA,NA,NA,NA,NA,NA,NA,NA,"7372117",NA,NA,"0","0","0","20140122105950",NA,NA,NA,NA,NA,"200"
"27498179","20140122163937","Segundo o picolé de chuchu diet, as áreas serão nas margens dos Rios Tietê e Tamanduateí, podendo também serem ditas áreas,  margeando os córregos, preferentemente quando estiverem transbordando...","APPROVED","0","FALSE","0","0","NONE","FALSE","0.0",NA,"FALSE","0","VISIBLE","MESSAGE",NA,"uwubtdft85fb","4068728318074074743","INFIEL","1","http://forum.imguol.com//forum/themes/jogos/images/nopic.gif","4068728318074074743","UOLK","4068728318074074743@UOLK",NA,NA,NA,NA,NA,NA,NA,NA,NA,"7372117",NA,NA,"0","0","0","20140122105950",NA,NA,NA,NA,NA,"200"
"27498145","20140122163717","Esquentar a cabeça pra que? vamos ter a copa","APPROVED","0","FALSE","6","0","NONE","FALSE","0.0",NA,"FALSE","0","VISIBLE","MESSAGE",NA,"4lsjel21y3bg","606164565420277324","Sou soberano","1","http://forum.imguol.com/avatars/gallery/noticias/Futebol Nacional 01/0045.gif","606164565420277324","UOLK","606164565420277324@UOLK",NA,NA,NA,NA,NA,NA,NA,NA,NA,"7372117",NA,NA,"0","0","0","20140122105950",NA,NA,NA,NA,NA,"200"
"27498137","20140122163651","Vou ganhar uma grana vendendo boné...vai dar rolezinho na biblioteca, no museu...vai estudar!","APPROVED","0","FALSE","0","0","NONE","FALSE","0.0",NA,"FALSE","0","VISIBLE","MESSAGE",NA,"9i1hpkmra62w","1250557709342462024","Dr Zema","1","http://forum.imguol.com//forum/themes/jogos/images/nopic.gif","1250557709342462024","UOLK","1250557709342462024@UOLK",NA,NA,NA,NA,NA,NA,NA,NA,NA,"7372117",NA,NA,"0","0","0","20140122105950",NA,NA,NA,NA,NA,"200"
"27498113","20140122163528","A sra.Dilma declarou que é totalmente a favor dos rolezeiros e rolezinhos. O que me intriga mesmo, é o fato de o governo de SP tentar segurar essa onda, que em breve será pura violência, e a presidente dizer que a ""rapaziada"" está certinha e ainda acusar os paulistas de preconceito e racismo.  ","APPROVED","0","FALSE","7","0","NONE","FALSE","0.0",NA,"FALSE","0","VISIBLE","MESSAGE",NA,"6tuf22a8qwfi","898848094865340078","Marina C. do A.W.","1","http://forum.imguol.com/avatars/gallery/noticias/Tecnologia 04/gadgets0116.jpg","898848094865340078","UOLK","898848094865340078@UOLK",NA,NA,NA,NA,NA,NA,NA,NA,NA,"7372117",NA,NA,"0","0","0","20140122105950",NA,NA,NA,NA,NA,"200"
"27497957","20140122162426","Com a graninha oriunda da Alston, Siemens, Rio Titê, Marginalk Tietê, Roubanel, Dersa , CDHU entre outras ' fontes ' , em 20 anos de desgoverno, já daria para ter feito muita coisa pela juventude ! Mas o que seria de melhor , a EDUCAÇÃO, optaram por Aprovação Automática e Repetência Zero ! Estamos colhendo os grandes frutos que esse PSDB nojento plantou e o PT adubou ! Fora Políticos !","APPROVED","0","TRUE","2","0","NONE","FALSE","0.0",NA,"FALSE","0","VISIBLE","MESSAGE",NA,"ckbcmswzc2bc","1653736414706489784","rubensson","1","http://forum.imguol.com//forum/themes/jogos/images/nopic.gif","1653736414706489784","UOLK","1653736414706489784@UOLK",NA,NA,NA,NA,NA,NA,NA,NA,NA,"7372117",NA,NA,"0","0","0","20140122105950",NA,NA,NA,NA,NA,"200"
"27497908","20140122162103","Vão dar rolê na feira da madrugada! Ou na Febem!!","APPROVED","0","FALSE","3","0","NONE","FALSE","0.0",NA,"FALSE","0","VISIBLE","MESSAGE",NA,"e3cqwt6xmnrl","1854966968648764113","Chupacabra da Bahia","1","http://forum.imguol.com/avatars/gallery/noticias/Seriados 03/seriados0148.jpg","1854966968648764113","UOLK","1854966968648764113@UOLK",NA,NA,NA,NA,NA,NA,NA,NA,NA,"7372117",NA,NA,"0","0","0","20140122105950",NA,NA,NA,NA,NA,"200"
