"id","created","content","moderation_status","parent_id","has_child","like","dislike","recommended","has_rating","rating_average","rating_content","has_more_children","reply_count","message_status","message_type","idt_group_user","cod_profile","cod_profile_hash","nick","user_status","avatar","social_user","social_network","unique_user_id","user_signature","user_register","user_total_messages","user_total_pins","user_total_bookmarks","user_total_likes","profile_nick","profile_url","media_content","subject_id","subject_url","subject_title","subject_views","subject_total","subject_like","subject_start","subject_owner_name","subject_owner_id","subject_owner_cod_profile","subject_owner_userSource","replies","sc"
"27439547","20140118115247","Gente, a loteria no Brasil é manipulada................NAO EXISTE SORTE NAS LOTERIAS DA CAIXA...............HÁ ANOS DEPUTADO JOÃO ALVES DECLAROU QUE GANHOU 56 VEZES NA LOTERIA DA CAIXA...........E VC???? GANHOU QUANTAS RIFAS NESSA VIDA??????????.............PELA AMOR................CONTINUEM VOTANDO NO PT ALEM DE TUDO VIU!!!!","APPROVED","0","TRUE","3","0","NONE","FALSE","0.0",NA,"FALSE","0","VISIBLE","MESSAGE",NA,"a38tpbw95b2o","1328081790582513744","PedroSampa","1","http://forum.imguol.com//forum/themes/jogos/images/nopic.gif","1328081790582513744","UOLK","1328081790582513744@UOLK",NA,NA,NA,NA,NA,NA,NA,NA,NA,"7357749",NA,NA,"0","0","0","20140118112356",NA,NA,NA,NA,NA,"200"
"27439546","20140118115245","Junta-se com a fraude que a própria diretoria petista da Caixa fez contra seus próprios poupadores!","APPROVED","0","TRUE","1","0","NONE","FALSE","0.0",NA,"FALSE","0","VISIBLE","MESSAGE",NA,"iqfc1n5c9ozk","2465808170024457920","Sandysilva","1","http://forum.imguol.com//forum/themes/jogos/images/nopic.gif","2465808170024457920","UOLK","2465808170024457920@UOLK",NA,NA,NA,NA,NA,NA,NA,NA,NA,"7357749",NA,NA,"0","0","0","20140118112356",NA,NA,NA,NA,NA,"200"
"27439538","20140118115222","Esse suplente e o s. junior","APPROVED","0","FALSE","0","0","NONE","FALSE","0.0",NA,"FALSE","0","VISIBLE","MESSAGE",NA,"toyki0ienoc2","3908288086380097778","Eu e Ele","1","http://forum.imguol.com/avatars/gallery/noticias/Basquete 01/1150.gif","3908288086380097778","UOLK","3908288086380097778@UOLK",NA,NA,NA,NA,NA,NA,NA,NA,NA,"7357749",NA,NA,"0","0","0","20140118112356",NA,NA,NA,NA,NA,"200"
"27439522","20140118115133","Por essas e outras que há de se andar na lei e na honestidade. Que gestão de um banco estatal!","APPROVED","0","FALSE","1","0","NONE","FALSE","0.0",NA,"FALSE","0","VISIBLE","MESSAGE",NA,"hxhewunyc4hj","2359990783047802807","Tellesprof","1","http://forum.imguol.com/avatars/gallery/noticias/Basquete 01/1130.gif","2359990783047802807","UOLK","2359990783047802807@UOLK",NA,NA,NA,NA,NA,NA,NA,NA,NA,"7357749",NA,NA,"0","0","0","20140118112356",NA,NA,NA,NA,NA,"200"
"27439519","20140118115122","Alguém se arrisca a somar o montante das possíveis fraudes anuais em cada esfera governamental.  Talvez assim se justifique porque não dá para fazer nada neste país.  E claro, ficar sem esse ""dinheirinho"" anual ninguém quer, por isso, a corrupção não tem fim.","APPROVED","0","FALSE","0","0","NONE","FALSE","0.0",NA,"FALSE","0","VISIBLE","MESSAGE",NA,NA,NA,"Esdras Jafet A. Silva","1","https://fbcdn-profile-a.akamaihd.net/hprofile-ak-frc1/t5/370519_100000936866361_562326177_q.jpg","100000936866361","FACEBOOK","100000936866361@FACEBOOK",NA,NA,NA,NA,NA,NA,NA,NA,NA,"7357749",NA,NA,"0","0","0","20140118112356",NA,NA,NA,NA,NA,"200"
"27439512","20140118115050","Gente coisa fácil de resolver!!! Porque quando você faz o jogo nas lotéricas, não colocam seu CPF na aposta??? A desculpe, e como vão lavar dinheiro!!!","APPROVED","0","FALSE","1","0","NONE","FALSE","0.0",NA,"FALSE","0","VISIBLE","MESSAGE",NA,"so465tad4ohv","3773579132205332995","Anti-Podrid&atilde;o","1","http://forum.imguol.com/avatars/gallery/noticias/Gifs Animados 01/animados046.gif","3773579132205332995","UOLK","3773579132205332995@UOLK",NA,NA,NA,NA,NA,NA,NA,NA,NA,"7357749",NA,NA,"0","0","0","20140118112356",NA,NA,NA,NA,NA,"200"
"27439501","20140118115021","UE COMO É FÁCIL ROUBAR NESSE PAIS !!!!!!!!!!!!!! ROUBAR LOGO UM BANCO ?????????????? ALGO ESTÁ MAL CONTADO!!!!!!!!!!!!!!!!!!!!!","APPROVED","0","FALSE","1","0","NONE","FALSE","0.0",NA,"FALSE","0","VISIBLE","MESSAGE",NA,"k51h5pqfgl6t","2650864835709220421","PAZ CELESTIAL","1","http://forum.imguol.com/avatars/gallery/noticias/Desenhos 03/desenhos0129.jpg","2650864835709220421","UOLK","2650864835709220421@UOLK",NA,NA,NA,NA,NA,NA,NA,NA,NA,"7357749",NA,NA,"0","0","0","20140118112356",NA,NA,NA,NA,NA,"200"
"27439499","20140118115017","Só prisão (se houver) não é suficiente pois com uma pequena parte do que eles roubaram logo estarão usufruindo das regalias das cadeias do nosso país. O que funciona mesmo é recuperar 100% do que estes ladrões levaram. Isto é o que nós brasileiros esperamos e continuaremos sempre esperando. ","APPROVED","0","FALSE","1","0","NONE","FALSE","0.0",NA,"FALSE","0","VISIBLE","MESSAGE",NA,"1boos6g4zo7a","174346800513911110","&quot;jonaene","1","http://forum.imguol.com//forum/themes/jogos/images/nopic.gif","174346800513911110","UOLK","174346800513911110@UOLK",NA,NA,NA,NA,NA,NA,NA,NA,NA,"7357749",NA,NA,"0","0","0","20140118112356",NA,NA,NA,NA,NA,"200"
"27439494","20140118114954","As Viuvas do FHC já vão dizerbqbe culpa do PT, fraude do ISS e do PT, mensalão do PSDB e invencionisse das oposicoes Odorico.","APPROVED","0","TRUE","0","0","NONE","FALSE","0.0",NA,"FALSE","0","VISIBLE","MESSAGE",NA,"jih7qe2z3fcr","2568371560080022395","S&oacute; com gol de penalti","1","http://forum.imguol.com//forum/themes/jogos/images/nopic.gif","2568371560080022395","UOLK","2568371560080022395@UOLK",NA,NA,NA,NA,NA,NA,NA,NA,NA,"7357749",NA,NA,"0","0","0","20140118112356",NA,NA,NA,NA,NA,"200"
"27439493","20140118114944","Por essas e outras a mega sena cai em descrédito a cada dia","APPROVED","0","TRUE","1","0","NONE","FALSE","0.0",NA,"FALSE","0","VISIBLE","MESSAGE",NA,"je7upi00dian","2552796142444674527","oliver5000","1","http://forum.imguol.com//forum/themes/jogos/images/nopic.gif","2552796142444674527","UOLK","2552796142444674527@UOLK",NA,NA,NA,NA,NA,NA,NA,NA,NA,"7357749",NA,NA,"0","0","0","20140118112356",NA,NA,NA,NA,NA,"200"
"27439475","20140118114753","Vanderlei diz: Parabens PF. Quero continuar acreditando nessa Instituição.","APPROVED","0","TRUE","0","0","NONE","FALSE","0.0",NA,"FALSE","0","VISIBLE","MESSAGE",NA,"8uwj5j8hn9io","1165962337334710512","jo&atilde;onegro","1","http://forum.imguol.com//forum/themes/jogos/images/nopic.gif","1165962337334710512","UOLK","1165962337334710512@UOLK",NA,NA,NA,NA,NA,NA,NA,NA,NA,"7357749",NA,NA,"0","0","0","20140118112356",NA,NA,NA,NA,NA,"200"
"27439469","20140118114729","bancos estatais são porcarias do brasil .. bancos estatais me dao nojo","APPROVED","0","TRUE","1","0","NONE","FALSE","0.0",NA,"FALSE","0","VISIBLE","MESSAGE",NA,"96nwqo08k4zm","1208960529466613314","bigeagle","1","http://forum.imguol.com/avatars/gallery/esporte/Enviados [109]/enviados5362.jpg","1208960529466613314","UOLK","1208960529466613314@UOLK",NA,NA,NA,NA,NA,NA,NA,NA,NA,"7357749",NA,NA,"0","0","0","20140118112356",NA,NA,NA,NA,NA,"200"
"27439466","20140118114721","Todos os envolvidos, entes públicos ou privados, deveriam serem punidos inclusive os representantes das empresas (mesmo sendo laranjas) com a proibição de exercerem qualquer atividade empresarial, inclusive a venda das empresas tinham que ser monitoradas, por dez anos. Todos não são iguais perante a Lei? Politico tem os direitos cassados por dez anos (geralmente) só porque não cumpriu determinação da Lei, muito embora não tenha ficado com um centavo muitas vezes. Há um caso de um prefeito de MG que deixou de aplicar na educacão 0,2 % ( A lei determina mínimo de 25%) e teve seus direitos cassados por dez anos e virou ficha suja. Se há corruptos há corruptores, ou não? Ser corruptor pode no Brasil, com amparo da Lei e do Judiciário?????","APPROVED","0","FALSE","0","0","NONE","FALSE","0.0",NA,"FALSE","0","VISIBLE","MESSAGE",NA,"0m7xpuwq7x40","81241528391540064","parana serio","1","http://forum.imguol.com//forum/themes/jogos/images/nopic.gif","81241528391540064","UOLK","81241528391540064@UOLK",NA,NA,NA,NA,NA,NA,NA,NA,NA,"7357749",NA,NA,"0","0","0","20140118112356",NA,NA,NA,NA,NA,"200"
"27439464","20140118114712","Reportagem de péssima qualidade. Como funcionava esta a fraude? De onde apareceu o dinheiro da Mega-Sena? Qual a participação do gerente do banco? ","APPROVED","0","TRUE","1","0","NONE","FALSE","0.0",NA,"FALSE","0","VISIBLE","MESSAGE",NA,"ns7q6s8rkcki","3130456424913098658","thiago unifei","1","http://forum.imguol.com//forum/themes/jogos/images/nopic.gif","3130456424913098658","UOLK","3130456424913098658@UOLK",NA,NA,NA,NA,NA,NA,NA,NA,NA,"7357749",NA,NA,"0","0","0","20140118112356",NA,NA,NA,NA,NA,"200"
"27439462","20140118114657","Que reportagem horrível! Quem creditou o dinheiro? O bandido simplesmente chegou no gerente, disse que ganhou na mega sena e o gerente creditou a grana sem pedir o bilhete? Ajuda aí, jornalista! Ajuda aí, editor! Não coloquem uma matéria dessa na capa de um dos maiores sites do Brasil.","APPROVED","0","TRUE","1","0","NONE","FALSE","0.0",NA,"FALSE","0","VISIBLE","MESSAGE",NA,"npue041djmrj","3121789452402821887","carlim 1005","1","http://forum.imguol.com//forum/themes/jogos/images/nopic.gif","3121789452402821887","UOLK","3121789452402821887@UOLK",NA,NA,NA,NA,NA,NA,NA,NA,NA,"7357749",NA,NA,"0","0","0","20140118112356",NA,NA,NA,NA,NA,"200"
"27439461","20140118114656","aaaaaaa .. fala sério... achei que alguém (ou algumas pessoas) tinham tomado a grana do banco, o dinheiro não era da CAIXA !! que pena... queria ver a caixa e o banco do brasil tomando um cano desses....","APPROVED","0","TRUE","0","0","NONE","FALSE","0.0",NA,"FALSE","0","VISIBLE","MESSAGE",NA,"qngisozyqr6f","3507933931919464983","sancho pancinha","1","http://forum.imguol.com//forum/themes/jogos/images/nopic.gif","3507933931919464983","UOLK","3507933931919464983@UOLK",NA,NA,NA,NA,NA,NA,NA,NA,NA,"7357749",NA,NA,"0","0","0","20140118112356",NA,NA,NA,NA,NA,"200"
"27439459","20140118114643","É ISTO QUE DA PATROCINAR O PATROCINAR O CORINTIAS VAI ACABAR SE AFUNDANDO JUNTOS.KKKKK","APPROVED","0","FALSE","0","0","NONE","FALSE","0.0",NA,"FALSE","0","VISIBLE","MESSAGE",NA,NA,NA,"Jorge Benedito","1","https://fbcdn-profile-a.akamaihd.net/hprofile-ak-ash2/t5/273657_100000481051741_1253904137_q.jpg","100000481051741","FACEBOOK","100000481051741@FACEBOOK",NA,NA,NA,NA,NA,NA,NA,NA,NA,"7357749",NA,NA,"0","0","0","20140118112356",NA,NA,NA,NA,NA,"200"
"27439445","20140118114526","Não é possível, Maranhão de novo? Tá russo o negócio lá, viu. Terra de ninguém mesmo.","APPROVED","0","FALSE","0","0","NONE","FALSE","0.0",NA,"FALSE","0","VISIBLE","MESSAGE",NA,"17gk7kdfnhhg","158896787324697412","JorgeFininho","1","http://forum.imguol.com//forum/themes/jogos/images/nopic.gif","158896787324697412","UOLK","158896787324697412@UOLK",NA,NA,NA,NA,NA,NA,NA,NA,NA,"7357749",NA,NA,"0","0","0","20140118112356",NA,NA,NA,NA,NA,"200"
"27439433","20140118114440","Suplente de deputado do MA, provavelmente é da máfia Sarney, mas falando sério as transações na CEF e BB correm muito risco, além de aparecerem na conta corrente do cliente débitos não autorizados, ocorreu comigo no BB se não pedisse o estorno no dia ficaria mais difícil.","APPROVED","0","FALSE","1","0","NONE","FALSE","0.0",NA,"FALSE","0","VISIBLE","MESSAGE",NA,"pc3t4zutuab8","3334803380902900916","ludovico melo","1","http://forum.imguol.com//forum/themes/jogos/images/nopic.gif","3334803380902900916","UOLK","3334803380902900916@UOLK",NA,NA,NA,NA,NA,NA,NA,NA,NA,"7357749",NA,NA,"0","0","0","20140118112356",NA,NA,NA,NA,NA,"200"
"27439426","20140118114401","Eita nós, até qdo teremos q escutar noticias ruins vindo desses governos incompetentes, PilanTras, PicareTas, PeTralhas, e algo mais.","APPROVED","0","FALSE","1","0","NONE","FALSE","0.0",NA,"FALSE","0","VISIBLE","MESSAGE",NA,"b1jpgk8i9fya","1453496365506063106","RogerioL","1","http://forum.imguol.com//forum/themes/jogos/images/nopic.gif","1453496365506063106","UOLK","1453496365506063106@UOLK",NA,NA,NA,NA,NA,NA,NA,NA,NA,"7357749",NA,NA,"0","0","0","20140118112356",NA,NA,NA,NA,NA,"200"
"27537272","20140124215731","Que interessante ""ninguém sabe de nada""","APPROVED","0","FALSE","0","0","NONE","FALSE","0.0",NA,"FALSE","0","VISIBLE","MESSAGE",NA,"taozd5rltdtv","3856128204920454211","Tablet_Zy1","1","http://forum.imguol.com/avatars/gallery/Animados (1)/animados004.gif","3856128204920454211","UOLK","3856128204920454211@UOLK",NA,NA,NA,NA,NA,NA,NA,NA,NA,"7384923",NA,NA,"0","0","0","20140124110936",NA,NA,NA,NA,NA,"200"
"27536575","20140124210208","Este governo incompetente, as autoridades policiais,o judiciário e o ministério público acabaram de criar o TERRITÓRIO LIVRE DA CRACOLÂNDIA !","APPROVED","0","FALSE","0","0","NONE","FALSE","0.0",NA,"FALSE","0","VISIBLE","MESSAGE",NA,"5tl7mwo8qmcr","766291415967062955","paulo claudio","1","http://forum.imguol.com/avatars/gallery/noticias/Basquete 01/1150.gif","766291415967062955","UOLK","766291415967062955@UOLK",NA,NA,NA,NA,NA,NA,NA,NA,NA,"7384923",NA,NA,"0","0","0","20140124110936",NA,NA,NA,NA,NA,"200"
"27533153","20140124171436","POLICIAIS CIVIS DEVEM SEMPRE ESTAR DESCARACTERIZADOS. ESTRANHO SERIA ELES ESTAR ""FARDADOS"". QUANTA GENTE DEFENDENDO O COMÉRCIO DE DROGAS NESSE PAÍS GENTE! A IMPRENSA E VÁRIAS AUTORIDADES, DEFENSORES DOS DIREITOS HUMANOS, etc. TODOS MALHANDO A PC POR QUE PRENDERAM TRAFICANTES. ONDE VAMOS PARAR?
","APPROVED","0","FALSE","1","0","NONE","FALSE","0.0",NA,"FALSE","0","VISIBLE","MESSAGE",NA,"2j1q1zj777ml","332885482572490077","natalino","1","http://forum.imguol.com//forum/themes/jogos/images/nopic.gif","332885482572490077","UOLK","332885482572490077@UOLK",NA,NA,NA,NA,NA,NA,NA,NA,NA,"7384923",NA,NA,"0","0","0","20140124110936",NA,NA,NA,NA,NA,"200"
"27530788","20140124150303","bala de borracha contra reporteres e manifestantes que estao com nojo do governo pode,contra noia,vagabundo que ficam cometendo furtos para fumar crack nao pode?aaaaa entendi e preconceito!!!e descriminaçao!!!!to entendendo,sobre policiais envolvido em trafico para mim e uma grande novidade,rsrs,e politico traficante?aaaa esses tambem nunca ouvi falar!!rsrs.","APPROVED","0","FALSE","0","0","NONE","FALSE","0.0",NA,"FALSE","0","VISIBLE","MESSAGE",NA,"7d2rw1ca36g5","969163787070098789","marcoantonio","1","http://forum.imguol.com//forum/themes/jogos/images/nopic.gif","969163787070098789","UOLK","969163787070098789@UOLK",NA,NA,NA,NA,NA,NA,NA,NA,NA,"7384923",NA,NA,"0","0","0","20140124110936",NA,NA,NA,NA,NA,"200"
"27530100","20140124142524","Era só o que faltava a polícia civil ter que avisar antes o prefeito Haddad sobre as ações que deve fazer onde está escrito isto na lei? e mais se em qualquer lugar do mundo policiais são atacados jamais se viu caso deles oferecerem flores. Deveria se organizar manifestação em apoio a polícia, principalmente de quem mora ou  trabalha na região.","APPROVED","0","FALSE","1","0","NONE","FALSE","0.0",NA,"FALSE","0","VISIBLE","MESSAGE",NA,"ava7afth7aye","1430594115476449334","FEREX","1","http://forum.imguol.com//forum/themes/jogos/images/nopic.gif","1430594115476449334","UOLK","1430594115476449334@UOLK",NA,NA,NA,NA,NA,NA,NA,NA,NA,"7384923",NA,NA,"0","0","0","20140124110936",NA,NA,NA,NA,NA,"200"
"27529975","20140124141714","concordo em genero, numero e grau este país caira em desgraça, quem viver veras","APPROVED","0","FALSE","0","0","NONE","FALSE","0.0",NA,"FALSE","0","VISIBLE","MESSAGE",NA,"g1zqc1uroibb","2113232311664555447","Plastica","1","http://forum.imguol.com//forum/themes/jogos/images/nopic.gif","2113232311664555447","UOLK","2113232311664555447@UOLK",NA,NA,NA,NA,NA,NA,NA,NA,NA,"7384923",NA,NA,"0","0","0","20140124110936",NA,NA,NA,NA,NA,"200"
"27529958","20140124141612","CONVERSA FIADA A NINAR POVO TOLO.

Com a modalidade bolsa craque SAMPA vai ser lugar a acomodar beneficiados de toda nação. 
 É CRAQUEODUTO  retirando dinheiro de UBS e melhor destinação pra escorrer no esgoto.
Dotô!	EPIDEMIA, NÃO SE RESOLVE NA RUA, exposta, contamina, alastra sobre toda cidade os seus iguais, você detesta. 
PELO QUE,  VOCÊ SERÁ LEMBRADO.
Se alcaide responsável, retira e isola para tratamento, mas não joga NOSSA GRANA no esgoto.
Povão! 
A REGIÃO FOI ELEITA COM OUTRA MISSÃO, cracolândia  é só cobertor de pobre a esconder segunda intenção, os desafortunados USADOS a sustentar mentira durante o sucatear da região.
VERGONHA!
Por avara inconseqüência o resto da cidade será contaminada “dança” no ROLE enquanto POVO TOLO fricciona.
E viva painhu do vicio que,  triunfante com$eguiu fonte nece$$ária a MANUTER $obrevivência DOS NEGÓCIOS (“?” um e outro).
Tinha mesmo vir de onde veio; SAMPA detestada tem ser usada destruída.
","APPROVED","0","FALSE","0","0","NONE","FALSE","0.0",NA,"FALSE","0","VISIBLE","MESSAGE",NA,NA,NA,"Milton Dias Medeiros","1","https://fbcdn-profile-a.akamaihd.net/hprofile-ak-frc1/t5/369691_100001833217674_2127095041_q.jpg","100001833217674","FACEBOOK","100001833217674@FACEBOOK",NA,NA,NA,NA,NA,NA,NA,NA,NA,"7384923",NA,NA,"0","0","0","20140124110936",NA,NA,NA,NA,NA,"200"
"27528975","20140124131859","Alguma dúvida?","APPROVED","0","FALSE","2","0","NONE","FALSE","0.0",NA,"FALSE","0","VISIBLE","MESSAGE",NA,"ex4lhszg0pob","1963823960732466683","geran","1","http://forum.imguol.com/avatars/gallery/noticias/Tecnologia 01/icones0010.jpg","1963823960732466683","UOLK","1963823960732466683@UOLK",NA,NA,NA,NA,NA,NA,NA,NA,NA,"7384923",NA,NA,"0","0","0","20140124110936",NA,NA,NA,NA,NA,"200"
"27528927","20140124131625","Bom material para o filme TROPA DE ELITE 3 !","APPROVED","0","FALSE","1","0","NONE","FALSE","0.0",NA,"FALSE","0","VISIBLE","MESSAGE",NA,NA,NA,"Marcos Araceli","1","https://fbcdn-profile-a.akamaihd.net/hprofile-ak-prn2/1119151_100000714198345_703144792_q.jpg","100000714198345","FACEBOOK","100000714198345@FACEBOOK",NA,NA,NA,NA,NA,NA,NA,NA,NA,"7384923",NA,NA,"0","0","0","20140124110936",NA,NA,NA,NA,NA,"200"
"27528858","20140124131305","Só palhaçada. Tampa de bueiro vendida em ferro-velho, equipamentos de combate a incêndio de prédio, vidros de carros quebrados quem anda na extensão da Luz sabe o que é- Major Sertório, Rego Freitas, Arouche, Santa Cecília, Santa Casa, rua Santa Isabel, Terminal Princesa Isabel, Amaral Gurgel, São João...é nojenta essa políticagem toda e a falta de ação. PT e Tucanada- duas piadas para o Brasil.
Não tem polícia, não tem ação efetiva da saúde, da limpeza urbana, tem babaca que vai levar alimento na boca de vagabundo, mas é pra que eles não invadam os seus bairros. São Paulo virou o penico do Brasil e o Centro o esgoto podre da cidade. Dobradinha PT- PSDB unidos para afundar o Brasil.","APPROVED","0","FALSE","2","0","NONE","FALSE","0.0",NA,"FALSE","0","VISIBLE","MESSAGE",NA,"ifbih7g8zjlw","2425202333674259972","kron #","1","http://forum.imguol.com//forum/themes/jogos/images/nopic.gif","2425202333674259972","UOLK","2425202333674259972@UOLK",NA,NA,NA,NA,NA,NA,NA,NA,NA,"7384923",NA,NA,"0","0","0","20140124110936",NA,NA,NA,NA,NA,"200"
"27528854","20140124131259","Cadê os protestos contra essa atitude desumana por parte da administração do Governo Estadual? Por que essa moçada, que curte rolezinho não aproveita esse momento para fazer um rolezinho de protesto nessa região, exigindo um tratamento mais digno para essas pessoas? creio que faria efeito! Por que os meios de comunicação não mostram com mais clareza a não preocupação com o cidadão, apenas jogos de interesses políticos? Por que há pessoas que apoiam toda essa violência? Que nível baixo, que decadência, que vergonha, que decepção! cada vez mais eu acredito menos nesse país!","APPROVED","0","FALSE","0","0","NONE","FALSE","0.0",NA,"FALSE","0","VISIBLE","MESSAGE",NA,NA,NA,"Ira Kutney","1","https://fbcdn-profile-a.akamaihd.net/hprofile-ak-ash1/276366_100001224487493_1030348830_q.jpg","100001224487493","FACEBOOK","100001224487493@FACEBOOK",NA,NA,NA,NA,NA,NA,NA,NA,NA,"7384923",NA,NA,"0","0","0","20140124110936",NA,NA,NA,NA,NA,"200"
"27528807","20140124131104","PUNIDOS,DOUTORA?SÃO TRAFICANTES E DELINQUENTES PERIGOSOS.DEVEM USAR A COCAÍNA APREENDIDA PELO DENARC E DEVOLVE - -LA AO MERCADO DAS DROGAS.CRIMINOSOS,BANDIDOS.POLICIAS FALIDAS","APPROVED","0","FALSE","1","0","NONE","FALSE","0.0",NA,"FALSE","0","VISIBLE","MESSAGE",NA,"apbebrk4ahyz","1408778576481762683","&Acirc;ngelo C Britto","1","http://forum.imguol.com//forum/themes/jogos/images/nopic.gif","1408778576481762683","UOLK","1408778576481762683@UOLK",NA,NA,NA,NA,NA,NA,NA,NA,NA,"7384923",NA,NA,"0","0","0","20140124110936",NA,NA,NA,NA,NA,"200"
"27528796","20140124131024","Tem que exonerár todos da P. Civil, fortaleçam a ROTA  que atua de forma implacável , com investigação e inteligência. ","APPROVED","0","FALSE","0","0","NONE","FALSE","0.0",NA,"FALSE","0","VISIBLE","MESSAGE",NA,"b5isry81klfp","1468028795092093573","wilfel","1","http://forum.imguol.com//forum/themes/jogos/images/nopic.gif","1468028795092093573","UOLK","1468028795092093573@UOLK",NA,NA,NA,NA,NA,NA,NA,NA,NA,"7384923",NA,NA,"0","0","0","20140124110936",NA,NA,NA,NA,NA,"200"
"27528756","20140124130729","Pensei que ia ler uma notícia diferente hoje, nada de novidade!!!","APPROVED","0","FALSE","1","0","NONE","FALSE","0.0",NA,"FALSE","0","VISIBLE","MESSAGE",NA,"uptare1aehh5","4043030672497368569","LUH LK","1","http://forum.imguol.com//forum/themes/jogos/images/nopic.gif","4043030672497368569","UOLK","4043030672497368569@UOLK",NA,NA,NA,NA,NA,NA,NA,NA,NA,"7384923",NA,NA,"0","0","0","20140124110936",NA,NA,NA,NA,NA,"200"
"27528753","20140124130710","POLICIA CIVIL SIGNIFICA: CORRUPÇÃO E TRÁFICO, ESSES SÃO OS VERDADEIROS BANDIDOS!","APPROVED","0","FALSE","1","0","NONE","FALSE","0.0",NA,"FALSE","0","VISIBLE","MESSAGE",NA,"b2ndftee62e3","1457524852036708251","VALDEIR SOUZA","1","http://forum.imguol.com//forum/themes/jogos/images/nopic.gif","1457524852036708251","UOLK","1457524852036708251@UOLK",NA,NA,NA,NA,NA,NA,NA,NA,NA,"7384923",NA,NA,"0","0","0","20140124110936",NA,NA,NA,NA,NA,"200"
"27528736","20140124130611","Façam como nos EUA e outros paises desenvolvidos, uma policia só, e um presidio só ,  cometeu crime vai todo mundo pro mesmo lugar, não a distinção policial bandido tem que ter pena maior, pois tem que dar exemplo. ","APPROVED","0","FALSE","1","0","NONE","FALSE","0.0",NA,"FALSE","0","VISIBLE","MESSAGE",NA,"b5isry81klfp","1468028795092093573","wilfel","1","http://forum.imguol.com//forum/themes/jogos/images/nopic.gif","1468028795092093573","UOLK","1468028795092093573@UOLK",NA,NA,NA,NA,NA,NA,NA,NA,NA,"7384923",NA,NA,"0","0","0","20140124110936",NA,NA,NA,NA,NA,"200"
"27528721","20140124130513","A CIDADE INTEIRA ESTÁ CANSADA DE SABER QUE A POLICIA CIVIL É UMA DAS INSTITUIÇÕES MAIS PODRES DESSE PAÍS, LÁ DENTRO A MAIORIA É CORRUPTO OU TRAFICANTE, QUEM NÃO QUER ENTRAR NO ESQUEMA, É COLOCADO PRÁ FORA, ENQUANTO ISSO O GOVERNADOR SE FAZ DE CEGO E SURDO, TORÇO PARA ALGUM DIA APARECER UM GOVERNANTE HOMEM DE VERDADE COM CORAGEM PARA EXTINGUIR ESSE ORGÃO QUE SÓ TRAZ PREJUÍZO A POPULAÇÃO E AO ESTADO!","APPROVED","0","FALSE","1","0","NONE","FALSE","0.0",NA,"FALSE","0","VISIBLE","MESSAGE",NA,"b2ndftee62e3","1457524852036708251","VALDEIR SOUZA","1","http://forum.imguol.com//forum/themes/jogos/images/nopic.gif","1457524852036708251","UOLK","1457524852036708251@UOLK",NA,NA,NA,NA,NA,NA,NA,NA,NA,"7384923",NA,NA,"0","0","0","20140124110936",NA,NA,NA,NA,NA,"200"
"27528693","20140124130352","Que novidade a Diretora do DENARC não saber de nada!!! O lula também não sabia de nada sobre o mensalão.
Dizer que policiais envolvidos serão punidos chega a ser hilariante.
Traficante é  bandido, porém o policial bandido sustentado pelo pobre povo que paga seu salário é muito mais bandido, e sem o mínimo de caráter.","APPROVED","0","FALSE","1","0","NONE","FALSE","0.0",NA,"FALSE","0","VISIBLE","MESSAGE",NA,"fsbe45vnvvub","2077854975272965619","Kirk.","1","http://forum.imguol.com//forum/themes/jogos/images/nopic.gif","2077854975272965619","UOLK","2077854975272965619@UOLK",NA,NA,NA,NA,NA,NA,NA,NA,NA,"7384923",NA,NA,"0","0","0","20140124110936",NA,NA,NA,NA,NA,"200"
"27528663","20140124130203","ESTA HISTÓRIA É VELHA...chega de cliches !!!. A muito tempo a Polícia Civil é laboratório para chefe de bandidos e ninguem faz nada. SE O CHEFE DO DENARC FOR HONESTO EM SUAS PALAVRAS, 50% DA CORPORAÇÃO CAI...SENÃO.....","APPROVED","0","FALSE","1","0","NONE","FALSE","0.0",NA,"FALSE","0","VISIBLE","MESSAGE",NA,NA,NA,"Isac Passos","1","https://fbcdn-profile-a.akamaihd.net/hprofile-ak-prn1/t5/573004_100002039215588_779078410_q.jpg","100002039215588","FACEBOOK","100002039215588@FACEBOOK",NA,NA,NA,NA,NA,NA,NA,NA,NA,"7384923",NA,NA,"0","0","0","20140124110936",NA,NA,NA,NA,NA,"200"
"27528652","20140124130120","Se acabar com a policia civil , diminuirá consideravelmente:
 Assaltos, latrocínios , roubos de carro , furtos em geral, drogados nas ruas, toda violência reduzirá a quase zero.
E tem que mandar policia para o presidio comum não tem que ter prisão para policial civil separada não alias a pena deles tem que ser maior , pois conhecem as leis e tem que ser exemplo.","APPROVED","0","FALSE","1","0","NONE","FALSE","0.0",NA,"FALSE","0","VISIBLE","MESSAGE",NA,"b5isry81klfp","1468028795092093573","wilfel","1","http://forum.imguol.com//forum/themes/jogos/images/nopic.gif","1468028795092093573","UOLK","1468028795092093573@UOLK",NA,NA,NA,NA,NA,NA,NA,NA,NA,"7384923",NA,NA,"0","0","0","20140124110936",NA,NA,NA,NA,NA,"200"
