"id","created","content","moderation_status","parent_id","has_child","like","dislike","recommended","has_rating","rating_average","rating_content","has_more_children","reply_count","message_status","message_type","idt_group_user","cod_profile","cod_profile_hash","nick","user_status","avatar","social_user","social_network","unique_user_id","user_signature","user_register","user_total_messages","user_total_pins","user_total_bookmarks","user_total_likes","profile_nick","profile_url","media_content","subject_id","subject_url","subject_title","subject_views","subject_total","subject_like","subject_start","subject_owner_name","subject_owner_id","subject_owner_cod_profile","subject_owner_userSource","replies","sc"
"27443445","20140118171230","Pior não é isso! Como a reportagem mesmo informa, trata-se de um gerente geral, ou seja, certamente o maior cargo na agência. E ironicamente, se ele participou do delito, certamente é um tolo. É claro que ele seria pego. Acredito que para se tornar gerente geral, precisa de preparo, de conhecer o negócio a que se propõe uma agência, e muito mais que isso, precisa de ser ""de confiança"". Então fica díficil acreditar que um gerente geral tenha participado de tamanha idiotice, imaginando que não seria pego ... Enfim, tá mal-contada essa história.","APPROVED","0","FALSE","1","0","NONE","FALSE","0.0",NA,"FALSE","0","VISIBLE","MESSAGE",NA,"9w3g9r1nxg5z","1301942986442201879","Arthuria","1","http://forum.imguol.com/avatars/gallery/noticias/Desenhos 06/jovem0545.jpg","1301942986442201879","UOLK","1301942986442201879@UOLK",NA,NA,NA,NA,NA,NA,NA,NA,NA,"7357749",NA,NA,"0","0","0","20140118112356",NA,NA,NA,NA,NA,"200"
"27443415","20140118170929","Deixa eu entender! Quem controla as loterias no Brasil? É a caixa! Quem paga os prêmios? A caixa! Como então a caixa consegue pagar um prêmio inexistente de um sorteio que nunca existiu? Ainda querem falar que a caixa foi vítima!!! Só os tolos acreditam nisso, loteria no Brasil é toda manipulada. Ganha quem a caixa quer que ganhe!","APPROVED","0","FALSE","5","0","NONE","FALSE","0.0",NA,"FALSE","0","VISIBLE","MESSAGE",NA,"2ud4gsu5zqus","374261041363324852","alf00","1","http://forum.imguol.com//forum/themes/jogos/images/nopic.gif","374261041363324852","UOLK","374261041363324852@UOLK",NA,NA,NA,NA,NA,NA,NA,NA,NA,"7357749",NA,NA,"0","0","0","20140118112356",NA,NA,NA,NA,NA,"200"
"27443410","20140118170859","não acredito em uma só linha dessa rePorTagem, essa é a versão oficial. por favor jornalistas verifiquem a informação verdadeira.","APPROVED","0","TRUE","1","0","NONE","FALSE","0.0",NA,"FALSE","0","VISIBLE","MESSAGE",NA,"o2g5k4zf2lp4","3167873852082812248","luri555","1","http://forum.imguol.com//forum/themes/jogos/images/nopic.gif","3167873852082812248","UOLK","3167873852082812248@UOLK",NA,NA,NA,NA,NA,NA,NA,NA,NA,"7357749",NA,NA,"0","0","0","20140118112356",NA,NA,NA,NA,NA,"200"
"27443407","20140118170850","Fiz consignados na Caixa e quitei e mesmo assim todos os meses esta vido descontado em folha de pagamento que só devolvem depois de 25 dias .
","APPROVED","0","TRUE","0","0","NONE","FALSE","0.0",NA,"FALSE","0","VISIBLE","MESSAGE",NA,"t9wd2b9nl3j3","3853221611685244959","toninho14","1","http://forum.imguol.com/avatars/gallery/noticias/Gifs Animados 01/animados002.gif","3853221611685244959","UOLK","3853221611685244959@UOLK",NA,NA,NA,NA,NA,NA,NA,NA,NA,"7357749",NA,NA,"0","0","0","20140118112356",NA,NA,NA,NA,NA,"200"
"27443388","20140118170656","Perguntar não ofende certo? Então vamos lá... Toda semana sai sorteios toda semana tem ganhadores, alguém ai sabe quantos Brasileiros já levaram prêmios com as loterias da Caixa? O Brasil esta cheio de Milionários escondidos?  Quantas pessoas já mudaram de vida no Brasil não deveria ser muitas???? Mas os números em relação a renda dos Brasileiros não dizem isso, ou dizem??? Qual  é a verdade? As mesmas pessoas ganham sempre???? Tem sempre dezenas de ganhadores por semana? Se pesquisas informarem que a situação de renda dos Brasileiros não muda muito então esses ganhadores não entram nas pesquisas???  Ta ai mais uma teoria da conspiração, acho que rola tanto sorteio por ai acredito que deveria ter muita gente mudando de vida no País mas não é isso que vemos, ou é????","APPROVED","0","FALSE","3","0","NONE","FALSE","0.0",NA,"FALSE","0","VISIBLE","MESSAGE",NA,"uptare1aehh5","4043030672497368569","LUH LK","1","http://forum.imguol.com//forum/themes/jogos/images/nopic.gif","4043030672497368569","UOLK","4043030672497368569@UOLK",NA,NA,NA,NA,NA,NA,NA,NA,NA,"7357749",NA,NA,"0","0","0","20140118112356",NA,NA,NA,NA,NA,"200"
"27443357","20140118170408","Esse é o governo do PT. Jamais houve tanto roubo e corrupção. Sabemos que nosso país, graças a nossa colonização, nunca foi honesto, sério, honrado. Mas, o que está acontencendo nos últimos 12 anos é brincadeira. Roubo, falcátruas, corrupção, etc.etc.,antes restrito nos grandes centros, se espalhou em todo território nacional. O exemplo sempre vem de cima. Faça o que eu mando e não faça o que eu faço.","APPROVED","0","TRUE","4","0","NONE","FALSE","0.0",NA,"FALSE","0","VISIBLE","MESSAGE",NA,"jzfrfm0f7u85","2630378711100040133","Ponte","1","http://forum.imguol.com//forum/themes/jogos/images/nopic.gif","2630378711100040133","UOLK","2630378711100040133@UOLK",NA,NA,NA,NA,NA,NA,NA,NA,NA,"7357749",NA,NA,"0","0","0","20140118112356",NA,NA,NA,NA,NA,"200"
"27443352","20140118170357","Droga sempre um deputado do maranhão envolvido aff
","APPROVED","0","TRUE","0","0","NONE","FALSE","0.0",NA,"FALSE","0","VISIBLE","MESSAGE",NA,NA,NA,"fabio do norte","1","http://pbs.twimg.com/profile_images/3275812245/9821aecfaf92971d0220c66ead01facc_normal.png","149714301","TWITTER","149714301@TWITTER",NA,NA,NA,NA,NA,NA,NA,NA,NA,"7357749",NA,NA,"0","0","0","20140118112356",NA,NA,NA,NA,NA,"200"
"27443350","20140118170348","kkkk, bem feito para caixa, ladrão que rouba ladrão 100 anos de perdão","APPROVED","0","TRUE","0","0","NONE","FALSE","0.0",NA,"FALSE","0","VISIBLE","MESSAGE",NA,NA,NA,"Gilliano Lucas","1","https://fbcdn-profile-a.akamaihd.net/hprofile-ak-ash2/t5/1117717_100002997751248_1592834506_q.jpg","100002997751248","FACEBOOK","100002997751248@FACEBOOK",NA,NA,NA,NA,NA,NA,NA,NA,NA,"7357749",NA,NA,"0","0","0","20140118112356",NA,NA,NA,NA,NA,"200"
"27443315","20140118170048","Q história mal contada.  Como é que o gerente não sabia que o sorteio nunca existiu? ","APPROVED","0","TRUE","1","0","NONE","FALSE","0.0",NA,"FALSE","0","VISIBLE","MESSAGE",NA,"rrcry0pc8mxe","3653799836984227346","GabrielSchieza","1","http://forum.imguol.com//forum/themes/jogos/images/nopic.gif","3653799836984227346","UOLK","3653799836984227346@UOLK",NA,NA,NA,NA,NA,NA,NA,NA,NA,"7357749",NA,NA,"0","0","0","20140118112356",NA,NA,NA,NA,NA,"200"
"27443308","20140118170007","Vejam só que coisa, um banco em que o povo deposita tanta confiança.  a Nossa Caixa.  Agora, dá medo até da sombra.","APPROVED","0","TRUE","1","0","NONE","FALSE","0.0",NA,"FALSE","0","VISIBLE","MESSAGE",NA,"lqit2fc4l8cc","2861025981649961340","seleta","1","http://forum.imguol.com/avatars/gallery/noticias/Desenhos 01/desenhos0042.jpg","2861025981649961340","UOLK","2861025981649961340@UOLK",NA,NA,NA,NA,NA,NA,NA,NA,NA,"7357749",NA,NA,"0","0","0","20140118112356",NA,NA,NA,NA,NA,"200"
"27443279","20140118165759","Se tem coisa que Banco cuida é do dinheiro dele.
Agora, um golpinho mixuruca desses?
Hummm! ","APPROVED","0","FALSE","0","0","NONE","FALSE","0.0",NA,"FALSE","0","VISIBLE","MESSAGE",NA,NA,NA,"Jorge Miollo","1","https://fbcdn-profile-a.akamaihd.net/static-ak/rsrc.php/v2/yo/r/UlIqmHJn-SK.gif","100002981945509","FACEBOOK","100002981945509@FACEBOOK",NA,NA,NA,NA,NA,NA,NA,NA,NA,"7357749",NA,NA,"0","0","0","20140118112356",NA,NA,NA,NA,NA,"200"
"27443276","20140118165755","E aquele bilhete inserido após o sorteio?  ","APPROVED","0","FALSE","0","0","NONE","FALSE","0.0",NA,"FALSE","0","VISIBLE","MESSAGE",NA,"f4q27zeneca6","1991597018109809838","Ediosti","1","http://forum.imguol.com/avatars/gallery/noticias/Basquete 01/1112.gif","1991597018109809838","UOLK","1991597018109809838@UOLK",NA,NA,NA,NA,NA,NA,NA,NA,NA,"7357749",NA,NA,"0","0","0","20140118112356",NA,NA,NA,NA,NA,"200"
"27443226","20140118165427","Eu gastaria 90% com mulheres, bebidas e jogo. O resto eu desperdiçaria...","APPROVED","0","FALSE","1","0","NONE","FALSE","0.0",NA,"FALSE","0","VISIBLE","MESSAGE",NA,"jzkw9bthn9jd","2630900124060927241","vovo_zela","1","http://forum.imguol.com/avatars/gallery/noticias/Desenhos 03/desenhos0148.jpg","2630900124060927241","UOLK","2630900124060927241@UOLK",NA,NA,NA,NA,NA,NA,NA,NA,NA,"7357749",NA,NA,"0","0","0","20140118112356",NA,NA,NA,NA,NA,"200"
"27443206","20140118165221","Esse pai´s é mesmo uma desordem! Só tem ladrões corruptos só kerendo se benificiar! Dà muita vergonha desse pais das pessaos q administram som pensam em si dar bem as custas alheia nao importam com a população carente!","APPROVED","0","FALSE","0","0","NONE","FALSE","0.0",NA,"FALSE","0","VISIBLE","MESSAGE",NA,"7ahy069uz1n0","959735961953629452","socoloco","1","http://forum.imguol.com//forum/themes/jogos/images/nopic.gif","959735961953629452","UOLK","959735961953629452@UOLK",NA,NA,NA,NA,NA,NA,NA,NA,NA,"7357749",NA,NA,"0","0","0","20140118112356",NA,NA,NA,NA,NA,"200"
"27443188","20140118165043","Deputado e Gerente de Banco ladrões. Empresário e filho de senador traficantes. Mas quem está na cadeia é o batedor de carteira. Acho que o Brasil está afundando na lama dos porcos.","APPROVED","0","FALSE","0","0","NONE","FALSE","0.0",NA,"FALSE","0","VISIBLE","MESSAGE",NA,NA,NA,"UlyssesBB","1","http://pbs.twimg.com/profile_images/3299327558/b48ce61f98dc873920ae4b39ea8874a3_normal.jpeg","96219731","TWITTER","96219731@TWITTER",NA,NA,NA,NA,NA,NA,NA,NA,NA,"7357749",NA,NA,"0","0","0","20140118112356",NA,NA,NA,NA,NA,"200"
"27443176","20140118164925","O PT junto com PMDB conseguiram desmoralizar todas instituições aonde botaram as suas MÃOS IMUNDAS, com APADRINHAMENTOS, MÁ ADMINISTRAÇÃO E ROUBALHEIRA descarada. Acordem ignorantes, PT NUNCA MAIS!!!","APPROVED","0","FALSE","1","0","NONE","FALSE","0.0",NA,"FALSE","0","VISIBLE","MESSAGE",NA,"pf39e4nlv3e7","3345716149749666799","BrasileiroAssaltado","1","http://forum.imguol.com/avatars/gallery/noticias/Desenhos 03/desenhos0133.jpg","3345716149749666799","UOLK","3345716149749666799@UOLK",NA,NA,NA,NA,NA,NA,NA,NA,NA,"7357749",NA,NA,"0","0","0","20140118112356",NA,NA,NA,NA,NA,"200"
"27443123","20140118164509","Prá acabar com esta lavanderia nestes jogos oficiais de azar, o certo seria a Caixa tornar obrigatória a informação do CPF no bilhete de aposta. Por que até hoje ela não fez isso???","APPROVED","0","TRUE","1","0","NONE","FALSE","0.0",NA,"FALSE","0","VISIBLE","MESSAGE",NA,"qvh423i2vhmo","3537243179595785472","Rodasnepervil","1","http://forum.imguol.com/avatars/gallery/noticias/Desenhos 02/desenhos0068.jpg","3537243179595785472","UOLK","3537243179595785472@UOLK",NA,NA,NA,NA,NA,NA,NA,NA,NA,"7357749",NA,NA,"0","0","0","20140118112356",NA,NA,NA,NA,NA,"200"
"27443119","20140118164453","Aposto que tem carrapato envolvido na sujeira!","APPROVED","0","TRUE","1","0","NONE","FALSE","0.0",NA,"FALSE","0","VISIBLE","MESSAGE",NA,"e4kyamrdel3c","1859456437608168264","Mascalssone","1","http://forum.imguol.com/avatars/gallery/noticias/Musica 02/jovem1784.gif","1859456437608168264","UOLK","1859456437608168264@UOLK",NA,NA,NA,NA,NA,NA,NA,NA,NA,"7357749",NA,NA,"0","0","0","20140118112356",NA,NA,NA,NA,NA,"200"
"27443116","20140118164441","Oqueee????? Vou segunda feira mesmo sacar todo o meu dinheiro da Caixa! Se eles não são responsáveis pelo o que é deles, IMAGINEM PELO QUE NÃO É!!!
PS. (meu saldo é de R$200,00- duzentos rais)","APPROVED","0","FALSE","2","0","NONE","FALSE","0.0",NA,"FALSE","0","VISIBLE","MESSAGE",NA,"11cn3id247ce","136561742354412590","sscarramouch","1","http://forum.imguol.com//forum/themes/jogos/images/nopic.gif","136561742354412590","UOLK","136561742354412590@UOLK",NA,NA,NA,NA,NA,NA,NA,NA,NA,"7357749",NA,NA,"0","0","0","20140118112356",NA,NA,NA,NA,NA,"200"
"27443052","20140118163933","Isso não é nada, a caixa joga fora 32 milhões por ano no Curintia.","APPROVED","0","TRUE","3","0","NONE","FALSE","0.0",NA,"FALSE","0","VISIBLE","MESSAGE",NA,"gncjk6ocgnhw","2191312807982081780","vitor verdao 99","1","http://forum.imguol.com/avatars/gallery/noticias/Futebol Nacional 01/0035.gif","2191312807982081780","UOLK","2191312807982081780@UOLK",NA,NA,NA,NA,NA,NA,NA,NA,NA,"7357749",NA,NA,"0","0","0","20140118112356",NA,NA,NA,NA,NA,"200"
"27443050","20140118163932","O QUE EU FARIA SE GANHASSE NA MEGA SENA?...  Em primeiro lugar me calaria... Contar para alguém, mesmo que para um filho ou esposa é colocar sua vida em risco e a deles próprias... Todo mundo tem um confidente, inclusive o seu... rsrsrsrs","APPROVED","0","FALSE","0","0","NONE","FALSE","0.0",NA,"FALSE","0","VISIBLE","MESSAGE",NA,NA,NA,"BI DE VERDADE!...","1","http://pbs.twimg.com/profile_images/3209786907/9cf80b594d710502d2b032e4dca95961_normal.jpeg","1104268536","TWITTER","1104268536@TWITTER",NA,NA,NA,NA,NA,NA,NA,NA,NA,"7357749",NA,NA,"0","0","0","20140118112356",NA,NA,NA,NA,NA,"200"
"27443033","20140118163816","Seu eu tivesse um tostão depositado na Caixa. eu tiraria correndo.  ","APPROVED","0","FALSE","1","0","NONE","FALSE","0.0",NA,"FALSE","0","VISIBLE","MESSAGE",NA,"eh4fidj245fx","1905308543753630349","eu vivi","1","http://forum.imguol.com//forum/themes/jogos/images/nopic.gif","1905308543753630349","UOLK","1905308543753630349@UOLK",NA,NA,NA,NA,NA,NA,NA,NA,NA,"7357749",NA,NA,"0","0","0","20140118112356",NA,NA,NA,NA,NA,"200"
"27443019","20140118163719","É quase inacreditável que  um banco federal importante, como é a CAIXA tenha mecanismos internos de controle tão deficientes, que uma de suas agências pagou  milhões de reais para criminosos como prêmio por  uma mega-sena FALSA! Que país é esse???","APPROVED","0","TRUE","0","0","NONE","FALSE","0.0",NA,"FALSE","0","VISIBLE","MESSAGE",NA,"6h3q275bau94","852263117549389480","Nuvem Branca","1","http://forum.imguol.com/avatars/gallery/noticias/Basquete 01/1111.gif","852263117549389480","UOLK","852263117549389480@UOLK",NA,NA,NA,NA,NA,NA,NA,NA,NA,"7357749",NA,NA,"0","0","0","20140118112356",NA,NA,NA,NA,NA,"200"
"27443016","20140118163656","Então quer dizer que o sistema de loterias da Caixa é assim tão falho que qualquer gerente consegue liberar 70 MILHÕES do nada, sem qualquer controle adicional? Tenho absoluta certeza que essa grana que sumiu vai para o caixa de campanha eleitoral do partido vermelho.","APPROVED","0","FALSE","1","0","NONE","FALSE","0.0",NA,"FALSE","0","VISIBLE","MESSAGE",NA,"0gh47daaf8if","60236916213488343","Ale____","1","http://forum.imguol.com//forum/themes/jogos/images/nopic.gif","60236916213488343","UOLK","60236916213488343@UOLK",NA,NA,NA,NA,NA,NA,NA,NA,NA,"7357749",NA,NA,"0","0","0","20140118112356",NA,NA,NA,NA,NA,"200"
"27442987","20140118163428","kkkkkkkkkkk...caixa  é  vitima....vitima  somos  nos  brasileiros  enganados  a  mais  de 20 anos...nunca  teve  transparencia...eles  riem  da  nossa  cara...PRÉMIO DA MEGA DA VIRADA. 20 + 30 + 36 + 38 + 47 + 53 = 224 Os seis números somados é o valor pago em milhões do prêmio da mega sena da virada.. Isso é uma mera coincidência?","APPROVED","0","FALSE","2","0","NONE","FALSE","0.0",NA,"FALSE","0","VISIBLE","MESSAGE",NA,"lvrv8rn209kk","2880226952647270004","O.PROFETA","1","http://forum.imguol.com/avatars/gallery/noticias/Presidentes/20.gif","2880226952647270004","UOLK","2880226952647270004@UOLK",NA,NA,NA,NA,NA,NA,NA,NA,NA,"7357749",NA,NA,"0","0","0","20140118112356",NA,NA,NA,NA,NA,"200"
"27442967","20140118163222","Faz algum tempo , O Senador ALVARO DIAS  (pr)  disse que havia sinais claros de marmelada  na MeGA SENA , (Usou outras palavras ) , mas no fim ficou só nisso , ninguém investigou mais nada  a fundo !!!","APPROVED","0","FALSE","1","0","NONE","FALSE","0.0",NA,"FALSE","0","VISIBLE","MESSAGE",NA,"84er8p9hnml4","1069096955765970712","verissimo100","1","http://forum.imguol.com//forum/themes/jogos/images/nopic.gif","1069096955765970712","UOLK","1069096955765970712@UOLK",NA,NA,NA,NA,NA,NA,NA,NA,NA,"7357749",NA,NA,"0","0","0","20140118112356",NA,NA,NA,NA,NA,"200"
"27442915","20140118162754","kkk, como essa gente inverte tudo, quem foi vitima foi os APOSTADORES, a caixa já tinha tirado a parte dela.","APPROVED","0","FALSE","0","0","NONE","FALSE","0.0",NA,"FALSE","0","VISIBLE","MESSAGE",NA,NA,NA,"F&aacute;bio Lu&iacute;s Cardoso","1","https://fbcdn-profile-a.akamaihd.net/hprofile-ak-prn1/49542_100000183584249_1012048886_q.jpg","100000183584249","FACEBOOK","100000183584249@FACEBOOK",NA,NA,NA,NA,NA,NA,NA,NA,NA,"7357749",NA,NA,"0","0","0","20140118112356",NA,NA,NA,NA,NA,"200"
"27442891","20140118162548","Nós é que somos vitimas desse sistema corrupto que já está impregnado nesse pais. As pessoas estão se corrompendo muito fácil pois é garantida a impunidade. Pessoas antes de bem estão se juntando as quadrilhas e políticos porque sabem que não podem ser afetados. Hoje posso dizer com todas as palavras "" NESTA TERRA SEM DONO, O CRIME COMPENSA"" e muito.
","APPROVED","0","FALSE","0","0","NONE","FALSE","0.0",NA,"FALSE","0","VISIBLE","MESSAGE",NA,"zj9el9vohveg","4677181847143349560","Minguine","1","http://forum.imguol.com//forum/themes/jogos/images/nopic.gif","4677181847143349560","UOLK","4677181847143349560@UOLK",NA,NA,NA,NA,NA,NA,NA,NA,NA,"7357749",NA,NA,"0","0","0","20140118112356",NA,NA,NA,NA,NA,"200"
"27442884","20140118162450","A maioria aqui está comentando sem ao menos ler a reportagem. Ou se leu não entenderam nada né. Veja bem não existiu bilhete de loteria coisa nenhuma, simplesmente com o gerente envolvido bolaram um esquema de fraude. Abriram uma conta e o gerente liberou o depósito no valor de 73 milhões como se fosse pagamente de um bilhete da mega sena premiado, entenderam??? Agora esse gerente é um tonho mesmo achar que vai sair 73 milhões da contabilidade do banco e ninguém vai perceber.","APPROVED","0","TRUE","1","0","NONE","FALSE","0.0",NA,"FALSE","0","VISIBLE","MESSAGE",NA,"b0dmil3xua3h","1449222542625213341","Glorioso Sant&aacute;stico","1","http://forum.imguol.com//forum/themes/jogos/images/nopic.gif","1449222542625213341","UOLK","1449222542625213341@UOLK",NA,NA,NA,NA,NA,NA,NA,NA,NA,"7357749",NA,NA,"0","0","0","20140118112356",NA,NA,NA,NA,NA,"200"
"27442856","20140118162259","Enquanto a caixa aplicava o golpe nos clientes roubando suas poupanças para fechar seu rombo de caixa. Os ladroes suplentes de Deputados do PT do maranhao roubavam a caixa. Dente por dente olho por olho. Lei de Taleão","APPROVED","0","FALSE","0","0","NONE","FALSE","0.0",NA,"FALSE","0","VISIBLE","MESSAGE",NA,NA,NA,"Gervasio Trigueiro","1","https://fbcdn-profile-a.akamaihd.net/hprofile-ak-ash3/368608_100000327703465_489034236_q.jpg","100000327703465","FACEBOOK","100000327703465@FACEBOOK",NA,NA,NA,NA,NA,NA,NA,NA,NA,"7357749",NA,NA,"0","0","0","20140118112356",NA,NA,NA,NA,NA,"200"
"27442844","20140118162212","REPUBLICA FEDERATIVA DA MALANDRAGEM.","APPROVED","0","FALSE","0","0","NONE","FALSE","0.0",NA,"FALSE","0","VISIBLE","MESSAGE",NA,"8hl0s0u7irjj","1117263279332457199","JOAO NINGUEM","1","http://forum.imguol.com//forum/themes/jogos/images/nopic.gif","1117263279332457199","UOLK","1117263279332457199@UOLK",NA,NA,NA,NA,NA,NA,NA,NA,NA,"7357749",NA,NA,"0","0","0","20140118112356",NA,NA,NA,NA,NA,"200"
"27442840","20140118162205","Fica claro que a pessoa que liberou o valor também deveria estar presa. Concurso falso ? É claro que tem gente de dentro da CAIXA nesse rolezinho, porque todo o brasil sabe de onde é o ganhador de grandes prêmios. Somente a pessoa que liberou R$ 73.000,00 é que não estranhou que nenhum veículo de comunicação falou sobre este prêmio.","APPROVED","0","FALSE","0","0","NONE","FALSE","0.0",NA,"FALSE","0","VISIBLE","MESSAGE",NA,"omcwf7zreya2","3240666565755157514","PereiraVargas","1","http://forum.imguol.com//forum/themes/jogos/images/nopic.gif","3240666565755157514","UOLK","3240666565755157514@UOLK",NA,NA,NA,NA,NA,NA,NA,NA,NA,"7357749",NA,NA,"0","0","0","20140118112356",NA,NA,NA,NA,NA,"200"
"27442836","20140118162155","Vem pra Caixa vc também.....vém !!!!","APPROVED","0","FALSE","0","0","NONE","FALSE","0.0",NA,"FALSE","0","VISIBLE","MESSAGE",NA,"1cqp5ivmckoz","178207124658980291","Tony Boloni","1","http://forum.imguol.com/avatars/gallery/noticias/Gifs Animados 06/animados295.gif","178207124658980291","UOLK","178207124658980291@UOLK",NA,NA,NA,NA,NA,NA,NA,NA,NA,"7357749",NA,NA,"0","0","0","20140118112356",NA,NA,NA,NA,NA,"200"
"27442832","20140118162141","Essa história está muito estranha. Já recebi um prêmio pequeno q exigiu minha ida à Caixa, lá eles solicitam xerox (e apresentação dos originais) do RG, CPF e comprovante de residência. Antes eles inserem o número do código de barras do bilhete premiado e o sistema é que apresenta o valor e somente mediante os dados inseridos (nome, número de rg e cpf + endereço) o sistema libera o pagamento. Muito estranho tudo isso.","APPROVED","0","FALSE","1","0","NONE","FALSE","0.0",NA,"FALSE","0","VISIBLE","MESSAGE",NA,"6yg9y3rj6dg3","915692631888328851","Jr - SP","1","http://forum.imguol.com//forum/themes/jogos/images/nopic.gif","915692631888328851","UOLK","915692631888328851@UOLK",NA,NA,NA,NA,NA,NA,NA,NA,NA,"7357749",NA,NA,"0","0","0","20140118112356",NA,NA,NA,NA,NA,"200"
"27442829","20140118162125","Sou aposentado da CAIXA. Paguei muitos prêmios para ganhadores (de fato, sem falsidade). Se você pagasse um premio falso, pagava do bolso. Tem gente grauda envolvida nisso, Não tem como pagar um prêmio sem conferir a veracidade dele. Quadrilha dentro e fora do governo. Estão acabando com minha empresa e meu país","APPROVED","0","FALSE","1","0","NONE","FALSE","0.0",NA,"FALSE","0","VISIBLE","MESSAGE",NA,"ac7y07tmh818","1360897794165710060","brunelli13","1","http://forum.imguol.com//forum/themes/jogos/images/nopic.gif","1360897794165710060","UOLK","1360897794165710060@UOLK",NA,NA,NA,NA,NA,NA,NA,NA,NA,"7357749",NA,NA,"0","0","0","20140118112356",NA,NA,NA,NA,NA,"200"
"27442811","20140118162010","Anos atrás a Caixa comprou 60 kg de ouro adulterado ; adicionaram limalha de latão ao ouro em pó vindo de garimpos , enganando os técnicos da Caixa !!!!!!","APPROVED","0","FALSE","0","0","NONE","FALSE","0.0",NA,"FALSE","0","VISIBLE","MESSAGE",NA,"q9g28funryc1","3456700988804990353","C&eacute;sar Augusto Figueiredo","1","http://forum.imguol.com//forum/themes/jogos/images/nopic.gif","3456700988804990353","UOLK","3456700988804990353@UOLK",NA,NA,NA,NA,NA,NA,NA,NA,NA,"7357749",NA,NA,"0","0","0","20140118112356",NA,NA,NA,NA,NA,"200"
"27442796","20140118161934","Onde está o dinheiro que a CAIXA confiscou dos poupadores nos PLANOS BRESSER, VERÃO E COLOR??? Onde? Onde? Será que um dia ainda vamos ver a cor do nosso próprio dinheiro que também foi ""roubado""? Porque até agora o GOVERNO DO PT(LULA E DILMA) ainda não se posicionaram??? É só pagar... Será que é muita coisa ser HONESTO nesse país?","APPROVED","0","TRUE","0","0","NONE","FALSE","0.0",NA,"FALSE","0","VISIBLE","MESSAGE",NA,NA,NA,"Andre Lcn","1","https://fbcdn-profile-a.akamaihd.net/static-ak/rsrc.php/v2/yo/r/UlIqmHJn-SK.gif","100004448880997","FACEBOOK","100004448880997@FACEBOOK",NA,NA,NA,NA,NA,NA,NA,NA,NA,"7357749",NA,NA,"0","0","0","20140118112356",NA,NA,NA,NA,NA,"200"
"27442786","20140118161836","Se o tal gerente não tiver participação eu corto o seu saco fora...","APPROVED","0","FALSE","1","0","NONE","FALSE","0.0",NA,"FALSE","0","VISIBLE","MESSAGE",NA,"uz9xm02xkpqr","4077625521096116307","pedro jj","1","http://forum.imguol.com//forum/themes/jogos/images/nopic.gif","4077625521096116307","UOLK","4077625521096116307@UOLK",NA,NA,NA,NA,NA,NA,NA,NA,NA,"7357749",NA,NA,"0","0","0","20140118112356",NA,NA,NA,NA,NA,"200"
"27442744","20140118161442","Quantos premios da Mega Sena tambem podem ter sido desviados? Essa quadrilha foi pega mas para cada quadrilha que eh pega outras 5 escapam... Esse sistema eh seguro?","APPROVED","0","FALSE","0","0","NONE","FALSE","0.0",NA,"FALSE","0","VISIBLE","MESSAGE",NA,"4molgbpm0fs2","609420262638410210","Choque de Realidade","1","http://forum.imguol.com//forum/themes/jogos/images/nopic.gif","609420262638410210","UOLK","609420262638410210@UOLK",NA,NA,NA,NA,NA,NA,NA,NA,NA,"7357749",NA,NA,"0","0","0","20140118112356",NA,NA,NA,NA,NA,"200"
"27442730","20140118161346","A CAIXA VITIMA DE FRAUDE ´E OFIM DA PICADA!","APPROVED","0","TRUE","0","0","NONE","FALSE","0.0",NA,"FALSE","0","VISIBLE","MESSAGE",NA,"fauwmdnb2i7r","2014025969970823095","agpavao","1","http://forum.imguol.com//forum/themes/jogos/images/nopic.gif","2014025969970823095","UOLK","2014025969970823095@UOLK",NA,NA,NA,NA,NA,NA,NA,NA,NA,"7357749",NA,NA,"0","0","0","20140118112356",NA,NA,NA,NA,NA,"200"
"27442728","20140118161327","Pena que isso não resultará em nada, em breve os meliantes estarão nas ruas fazendo tudo novamente. Enquanto tivermos leis facilitadoras, nada mudará neste país. ","APPROVED","0","FALSE","0","0","NONE","FALSE","0.0",NA,"FALSE","0","VISIBLE","MESSAGE",NA,"bl06secy9gaf","1524637221620395191","drinhos do rio","1","http://forum.imguol.com//forum/themes/jogos/images/nopic.gif","1524637221620395191","UOLK","1524637221620395191@UOLK",NA,NA,NA,NA,NA,NA,NA,NA,NA,"7357749",NA,NA,"0","0","0","20140118112356",NA,NA,NA,NA,NA,"200"
