"id","created","content","moderation_status","parent_id","has_child","like","dislike","recommended","has_rating","rating_average","rating_content","has_more_children","reply_count","message_status","message_type","idt_group_user","cod_profile","cod_profile_hash","nick","user_status","avatar","social_user","social_network","unique_user_id","user_signature","user_register","user_total_messages","user_total_pins","user_total_bookmarks","user_total_likes","profile_nick","profile_url","media_content","subject_id","subject_url","subject_title","subject_views","subject_total","subject_like","subject_start","subject_owner_name","subject_owner_id","subject_owner_cod_profile","subject_owner_userSource","replies","sc"
"22137976","20130801183335","Eu não entendo, Cabral e Paes comemoram o fato de terem ""lançado"" a UPA, mas nós deveríamos ter hospitais de verdade funcionando e não um serviço parcial funcionando que é o caso da UPA, quanto às UPP´s... isso não foi pelo povo, foi pela necessidade de mudar alguma coisa para receber JMJ, Copa e olimpíadas para que assim pudessem fazer contratos bilionários, não foi nada pelo povo, eles viram a oportunidade e correram atrás e o fizeram muito bem, contratos com andrade gutierrez, oderbrecht e delta superfaturados. O governador acha um absurdo pegar transito como todos nós, essa soberba dele alimentou loucuras como a de sua mulher na farra dos helicópteros, eu ainda não entendo como um governador tem sua mulher defendendo como advogada as prestadoras de serviço(metrô e etc) nem como ele tem dinheiro para comprar um iate com um salário desses, agora preparem-se para o truque de mestre, enrará o pupulista garotinho e cabral e filho como deputados...","APPROVED","0","FALSE","0","0","NONE","FALSE","0.0",NA,"FALSE","0","VISIBLE","MESSAGE",NA,"xj4b353l9dsb","4413420755385179915","El pollo","1","http://forum.imguol.com//forum/themes/jogos/images/nopic.gif","4413420755385179915","UOLK","4413420755385179915@UOLK",NA,NA,NA,NA,NA,NA,NA,NA,NA,"6585848",NA,NA,"0","0","0","20130801133943",NA,NA,NA,NA,NA,"200"
"22137955","20130801183243","Acho que tudo está focado demais só no Cabral. Não é só ele! É todo seu entôrno que está podre e deve desaparecer da face do Rio de Janeiro. Todos!","APPROVED","0","FALSE","0","0","NONE","FALSE","0.0",NA,"FALSE","0","VISIBLE","MESSAGE",NA,"8p52y6kq6aux","1144893712438429305","CARDOSO J&Uacute;NIOR","1","http://forum.imguol.com/avatars/gallery/noticias/Desenhos 02/desenhos0061.jpg","1144893712438429305","UOLK","1144893712438429305@UOLK",NA,NA,NA,NA,NA,NA,NA,NA,NA,"6585848",NA,NA,"0","0","0","20130801133943",NA,NA,NA,NA,NA,"200"
"22137694","20130801181940","""Veja, ilustre eleitor, o tipo de governador que você pôs em seu estado.""
Carioca é tão ishpertu...","APPROVED","0","FALSE","0","0","NONE","FALSE","0.0",NA,"FALSE","0","VISIBLE","MESSAGE",NA,"6s98aj2uzmad","893040093038129557","Brasileiro, apenas","1","http://forum.imguol.com//forum/themes/jogos/images/nopic.gif","893040093038129557","UOLK","893040093038129557@UOLK",NA,NA,NA,NA,NA,NA,NA,NA,NA,"6585848",NA,NA,"0","0","0","20130801133943",NA,NA,NA,NA,NA,"200"
"22137558","20130801181257","Os cariocas lhe deram votação recorde e agora ficam ai chorando, fizaram a mesma coisa com o Lula e depois ficam chorando que os governos não prestam. Aprendam a votar.","APPROVED","0","TRUE","0","0","NONE","FALSE","0.0",NA,"FALSE","0","VISIBLE","MESSAGE",NA,"dk1eryassxj9","1784348564742175941","greatva","1","http://forum.imguol.com/avatars/gallery/noticias/Presidentes/44.gif","1784348564742175941","UOLK","1784348564742175941@UOLK",NA,NA,NA,NA,NA,NA,NA,NA,NA,"6585848",NA,NA,"0","0","0","20130801133943",NA,NA,NA,NA,NA,"200"
"22137452","20130801180652","Trata-se de um sacripanta, ""exterminador de estatutários, dos aposentados e dos pensionístas do Estado Rio de Janeiro"". Passou todos seus anos de governo sem dar um centavo de aumento, nem mesmo a inlação annual aos funcionários das Secretarias de Saúde ou da educação -  um algoz pior que o Torquemada!","APPROVED","0","FALSE","0","0","NONE","FALSE","0.0",NA,"FALSE","0","VISIBLE","MESSAGE",NA,"azebbodq4jea","1445636370505738546","wellcanti","1","http://forum.imguol.com//forum/themes/jogos/images/nopic.gif","1445636370505738546","UOLK","1445636370505738546@UOLK",NA,NA,NA,NA,NA,NA,NA,NA,NA,"6585848",NA,NA,"0","0","0","20130801133943",NA,NA,NA,NA,NA,"200"
"22137387","20130801180345","quem mandou fazer ""parceria"" com o lula 9ine fingers? agora aguenta a campanha em favor do lindenberg farias, cheio de processos nas prefeituras por onde passou. aliás ele deve ser parente do P.C Farias","APPROVED","0","FALSE","0","0","NONE","FALSE","0.0",NA,"FALSE","0","VISIBLE","MESSAGE",NA,"1ebjepjirpzx","183979835312982621","duadem","1","http://forum.imguol.com//forum/themes/jogos/images/nopic.gif","183979835312982621","UOLK","183979835312982621@UOLK",NA,NA,NA,NA,NA,NA,NA,NA,NA,"6585848",NA,NA,"0","0","0","20130801133943",NA,NA,NA,NA,NA,"200"
"22137299","20130801175923","Nas proximas eleições quais são os partidos que estão concorrendo???? Como sempre é  o LIXO do PT que enganou 55milhões de eleitores, o PSDB que governa São Paulo que a Segurança Publica esta as MOSCAS , o PMDB que governa o Rio de Janeiro que só tem os olhos na COPA e nas Olimpiadas e os outros Estados que também esta a propria sorte....
QUE arapuca ESTAMOS NÓS Eleitores do Brasil....
","APPROVED","0","FALSE","0","0","NONE","FALSE","0.0",NA,"FALSE","0","VISIBLE","MESSAGE",NA,"6osbc1ydb6du","880353681235769874","AO5432","1","http://forum.imguol.com//forum/themes/jogos/images/nopic.gif","880353681235769874","UOLK","880353681235769874@UOLK",NA,NA,NA,NA,NA,NA,NA,NA,NA,"6585848",NA,NA,"0","0","0","20130801133943",NA,NA,NA,NA,NA,"200"
"22137178","20130801175350","...essa tal de cabral é apenas mais um dos nossos homem público incopetente, ou seja, são pessoas como ele que se candidatam a um cargo público mais que não competência para tal função; é por isso, que nossas cidades são mal administradas...são pessoas que se candidatam a um cargo mpoúblico somente para ganharem dinheiro com licitações fraudulentas entre outros; são pessoas que não se preocupam em administrar comn seriedade em prol da coletividade, que para tal função são bem remunerados coisa que não deveria ser; esses políticos deveriam ter apenas ajuda de custos e não salario desorbitantes... ","APPROVED","0","FALSE","1","0","NONE","FALSE","0.0",NA,"FALSE","0","VISIBLE","MESSAGE",NA,NA,NA,"Renato Soares Sousa","1","https://fbcdn-profile-a.akamaihd.net/hprofile-ak-ash4/372115_100000005329147_50067308_q.jpg","100000005329147","FACEBOOK","100000005329147@FACEBOOK",NA,NA,NA,NA,NA,NA,NA,NA,NA,"6585848",NA,NA,"0","0","0","20130801133943",NA,NA,NA,NA,NA,"200"
"22137061","20130801174851","Cabral diz que ""faltou mais diálogo.."" hehe. No entender dele se tivesse conversado mais, papeado mais... não teria tido os problemas que tem. Cabral, conhecedor do povo brasileiro< tal como Lula, sabe que com mais conversa o povão fica caladinho... É o estelionatário mais mestre. Só o Lula engana melhor..","APPROVED","0","FALSE","1","0","NONE","FALSE","0.0",NA,"FALSE","0","VISIBLE","MESSAGE",NA,"iddhmba8d0fb","2418090715761664871","celiodesousa50","1","http://forum.imguol.com//forum/themes/jogos/images/nopic.gif","2418090715761664871","UOLK","2418090715761664871@UOLK",NA,NA,NA,NA,NA,NA,NA,NA,NA,"6585848",NA,NA,"0","0","0","20130801133943",NA,NA,NA,NA,NA,"200"
"22137050","20130801174823","Acreditarei nessas passeatas quando eu ver faixas e cartazes com estes dizeres: FIM DOS 60 DIAS DE FÉRIAS DE JUÍZES E PROMOTORES; FIM DOS AUXÍLIOS MORADIA E ALIMENTAÇÃO DOS JUÍZES E PROMOTORES e FIM DAS PENSÕES VITALÍCIAS PARA TODOS OS EX-GOVERNADORES. Duvido que apareçam. Pago para ver. ","APPROVED","0","TRUE","3","0","NONE","FALSE","0.0",NA,"FALSE","0","VISIBLE","MESSAGE",NA,"p0moqb9u57ln","3292846683748861883","MANEZINHO DO BREJO","1","http://forum.imguol.com//forum/themes/jogos/images/nopic.gif","3292846683748861883","UOLK","3292846683748861883@UOLK",NA,NA,NA,NA,NA,NA,NA,NA,NA,"6585848",NA,NA,"0","0","0","20130801133943",NA,NA,NA,NA,NA,"200"
"22137029","20130801174726","Acreditarei nessas passeatas quando eu ver faixas e cartazes com estes dizeres: FIM DOS 60 DIAS DE FÉRIAS DE JUÍZES E PROMOTORES; FIM DOS AUXÍLIOS MORADIA E ALIMENTAÇÃO DOS JUÍZES E PROMOTORES e FIM DAS PENSÕES VITALÍCIAS PARA TODOS OS EX-GOVERNADORES. Duvido que apareçam. Pago para ver. ","APPROVED","0","FALSE","2","0","NONE","FALSE","0.0",NA,"FALSE","0","VISIBLE","MESSAGE",NA,"p0moqb9u57ln","3292846683748861883","MANEZINHO DO BREJO","1","http://forum.imguol.com//forum/themes/jogos/images/nopic.gif","3292846683748861883","UOLK","3292846683748861883@UOLK",NA,NA,NA,NA,NA,NA,NA,NA,NA,"6585848",NA,NA,"0","0","0","20130801133943",NA,NA,NA,NA,NA,"200"
"22136953","20130801174343","Acreditarei nessas passeatas quando eu ver faixas e cartazes com estes dizeres: FIM DOS 60 DIAS DE FÉRIAS DE JUÍZES E PROMOTORES; FIM DOS AUXÍLIOS MORADIA E ALIMENTAÇÃO DOS JUÍZES E PROMOTORES e FIM DAS PENSÕES VITALÍCIAS PARA TODOS OS EX-GOVERNADORES. Duvido que apareçam. Pago para ver. ","APPROVED","0","FALSE","2","0","NONE","FALSE","0.0",NA,"FALSE","0","VISIBLE","MESSAGE",NA,"p0moqb9u57ln","3292846683748861883","MANEZINHO DO BREJO","1","http://forum.imguol.com//forum/themes/jogos/images/nopic.gif","3292846683748861883","UOLK","3292846683748861883@UOLK",NA,NA,NA,NA,NA,NA,NA,NA,NA,"6585848",NA,NA,"0","0","0","20130801133943",NA,NA,NA,NA,NA,"200"
"22136920","20130801174209","Interessante como quem tem, tem mêdo.
Ja repararam que depois das manifestações que ainda se seguem, e digo ainda, porque não vão parar, Estão aceitando N. coisas para não entrarem em CONFLITO com o Povo.
Vejam o caso do infeliz Cabral entre outros.
Brasileiros, sigam sua Marcha.","APPROVED","0","FALSE","2","0","NONE","FALSE","0.0",NA,"FALSE","0","VISIBLE","MESSAGE",NA,NA,NA,"Paulo Screpanti","1","https://fbcdn-profile-a.akamaihd.net/hprofile-ak-ash3/623642_100000907846382_2051847474_q.jpg","100000907846382","FACEBOOK","100000907846382@FACEBOOK",NA,NA,NA,NA,NA,NA,NA,NA,NA,"6585848",NA,NA,"0","0","0","20130801133943",NA,NA,NA,NA,NA,"200"
"22136632","20130801173023","acredito que boa parte da populção esta em sintonia com as mudanças , mas a maioria é facilmente manipulada......PRECISAMOS nos politizar e fazer politica , discutir assuntos que mudam nossas vidas, precisamos alertar os mais vulneraveis sobre as armadilhas  eleitoreras...........de nada adianta nossos votos , se somos minoria.......","APPROVED","0","FALSE","0","0","NONE","FALSE","0.0",NA,"FALSE","0","VISIBLE","MESSAGE",NA,"74vi7pnift61","939176303681576809","hygtrfcedxw","1","http://forum.imguol.com/avatars/gallery/noticias/Celebridades 15/internet0134.jpg","939176303681576809","UOLK","939176303681576809@UOLK",NA,NA,NA,NA,NA,NA,NA,NA,NA,"6585848",NA,NA,"0","0","0","20130801133943",NA,NA,NA,NA,NA,"200"
"22136544","20130801172707","O RJ  esta entregue ao desgoverno, a corrupçao desenfreada, ao populismo ordinario e a total incompetencia. Mas,  o povo do rj merece. Afinal nao só elegeram, como reelegeram esta figura abjeta para governa-los.","APPROVED","0","TRUE","0","0","NONE","FALSE","0.0",NA,"FALSE","0","VISIBLE","MESSAGE",NA,"knn7s09vewlm","2718883542533070730","Maucomu","1","http://forum.imguol.com//forum/themes/jogos/images/nopic.gif","2718883542533070730","UOLK","2718883542533070730@UOLK",NA,NA,NA,NA,NA,NA,NA,NA,NA,"6585848",NA,NA,"0","0","0","20130801133943",NA,NA,NA,NA,NA,"200"
"22136431","20130801172212","CASO A MODA PEGAR, AI VAI FUNCIONAR ESTE PAIS, PORQUE SEM ELES, SEM PROBLEMAS, SEM CRIME, SEM ROUBO, SEM CONFUSÕES SEM SENTIDO. E FORA OS VERMELHOS TAMBÉM...","APPROVED","0","FALSE","1","0","NONE","FALSE","0.0",NA,"FALSE","0","VISIBLE","MESSAGE",NA,"kwiggoaj6afk","2751305670612178256","z&eacute; da mooca","1","http://forum.imguol.com/avatars/gallery/noticias/Tecnologia 01/icones0010.jpg","2751305670612178256","UOLK","2751305670612178256@UOLK",NA,NA,NA,NA,NA,NA,NA,NA,NA,"6585848",NA,NA,"0","0","0","20130801133943",NA,NA,NA,NA,NA,"200"
"22135940","20130801170138","Foi em 1599 que Pedro Alvares Cabral descobriu o Brasil; E só agora na onda dos protestos de rua, um grupo de vizinhos da Zona Sul do Rio, no Leblon. conveniemente mascarados, descobriram o governador Sergio Cabral e não largaram mais o seu pe. dia e noite acampados na sua porta, piores do que os moradores de rua.","APPROVED","0","TRUE","0","0","NONE","FALSE","0.0",NA,"FALSE","0","VISIBLE","MESSAGE",NA,NA,NA,"Jonda Lopes","1","https://fbcdn-profile-a.akamaihd.net/static-ak/rsrc.php/v2/yo/r/UlIqmHJn-SK.gif","100000969635178","FACEBOOK","100000969635178@FACEBOOK",NA,NA,NA,NA,NA,NA,NA,NA,NA,"6585848",NA,NA,"0","0","0","20130801133943",NA,NA,NA,NA,NA,"200"
"22135832","20130801165550","Tem  que largar o  cargo é agora,quer  fazer   a limpeza no  Estado  que  se encontra  falido?  Agora    todos reconhecem  seus erros,sei  qual é a deste  cara.","APPROVED","0","FALSE","1","0","NONE","FALSE","0.0",NA,"FALSE","0","VISIBLE","MESSAGE",NA,"0u79mj9e8s57","110422828826329723","Tonh&atilde;o Granito","1","http://forum.imguol.com//forum/themes/jogos/images/nopic.gif","110422828826329723","UOLK","110422828826329723@UOLK",NA,NA,NA,NA,NA,NA,NA,NA,NA,"6585848",NA,NA,"0","0","0","20130801133943",NA,NA,NA,NA,NA,"200"
"22135644","20130801164541","Tolo e arrogante, em imaginar que esse tal Pezão tem bom curricullum .o que ele fez alem de licitar um veiulo off road para ir ate a sua fazenda?maté onde sei, a verba  que foi enviada pelo governo federal para a região de teresópolis e petrópolis, ele n usou Lara esse fim, então, seu Cabrak continua navegando....que frustrante!","APPROVED","0","FALSE","2","0","NONE","FALSE","0.0",NA,"FALSE","0","VISIBLE","MESSAGE",NA,"985rpzh24w9r","1214430608174748255","bezansson","1","http://forum.imguol.com//forum/themes/jogos/images/nopic.gif","1214430608174748255","UOLK","1214430608174748255@UOLK",NA,NA,NA,NA,NA,NA,NA,NA,NA,"6585848",NA,NA,"0","0","0","20130801133943",NA,NA,NA,NA,NA,"200"
"22135553","20130801164103","O PROBLEMA, É QUE O ""sr."", NÃO VAI SAIR, VAI SER  ""saido"", ...NÃO HÁ DESCULPAS...VACILOU, A PARTIR DE AGORA, DANÇOU.....","APPROVED","0","TRUE","2","0","NONE","FALSE","0.0",NA,"FALSE","0","VISIBLE","MESSAGE",NA,"eu3atuzatgfg","1952723837961424492","Verd&atilde;o Sadio","1","http://forum.imguol.com/avatars/gallery/noticias/Futebol Nacional 01/0035.gif","1952723837961424492","UOLK","1952723837961424492@UOLK",NA,NA,NA,NA,NA,NA,NA,NA,NA,"6585848",NA,NA,"0","0","0","20130801133943",NA,NA,NA,NA,NA,"200"
"22135532","20130801163952","Já está na hora de abolirmos do Brasil as Capitanias Heriditarias, que continuam trazendo ao pais prejuízos morais e financeiros. netos tipp  Eduardo Campos(    Arraes),Aécio( Tancredo), Cabra ( seu filho)l,Gadotinho( sua rosinha e clarice, a filha)Maia,( o tal filho Rodrigo)Roriz,os Alves,os Barbalhos,( Jader) Sarneys e tantos outros...com os seus filhos e curriolas...Na verdade, disso se fez hábito e temos que por um fim, ","APPROVED","0","TRUE","1","0","NONE","FALSE","0.0",NA,"FALSE","0","VISIBLE","MESSAGE",NA,"985rpzh24w9r","1214430608174748255","bezansson","1","http://forum.imguol.com//forum/themes/jogos/images/nopic.gif","1214430608174748255","UOLK","1214430608174748255@UOLK",NA,NA,NA,NA,NA,NA,NA,NA,NA,"6585848",NA,NA,"0","0","0","20130801133943",NA,NA,NA,NA,NA,"200"
"22135485","20130801163744","ELES ESTÃO APOSTANDO, NA MEMÓRIA DO POVO BRASILEIRO...ACHANDO QUE ERA COMO ANTIGAMENTE...NO DIA SEGUINTE, O POVÃO JÁ HAVIA ESQUECIDO TUDO...AGORA MUDOU...ANO QUE VEM, VAMOS COLOCAR NOVOS, SEM VÍCIOS E SE NÃO CORRESPONDEREM, TROCAMOS EM 2018...É ASSIM QUE TEM QUE FUNCIONAR A PARTIR DE AGORA....","APPROVED","0","TRUE","1","0","NONE","FALSE","0.0",NA,"FALSE","0","VISIBLE","MESSAGE",NA,"eu3atuzatgfg","1952723837961424492","Verd&atilde;o Sadio","1","http://forum.imguol.com/avatars/gallery/noticias/Futebol Nacional 01/0035.gif","1952723837961424492","UOLK","1952723837961424492@UOLK",NA,NA,NA,NA,NA,NA,NA,NA,NA,"6585848",NA,NA,"0","0","0","20130801133943",NA,NA,NA,NA,NA,"200"
"22135383","20130801163207","MUITA CARA DE PAU, PAU, PAU....HOJE TODOS ADMITEM ERROS, PEGANDO CARONA NA ONDA DE MANIFESTAÇÕES....PROGRAMAS POLÍTICOS, TODOS ELES, QUERENDO OUVIR A VÓS DAS RUAS??? ANO QUE VEM REFORMAMOS O CONGRESSO, EXECUTIVOS, PARA O BEM DESTE PAÍS....","APPROVED","0","FALSE","1","0","NONE","FALSE","0.0",NA,"FALSE","0","VISIBLE","MESSAGE",NA,"eu3atuzatgfg","1952723837961424492","Verd&atilde;o Sadio","1","http://forum.imguol.com/avatars/gallery/noticias/Futebol Nacional 01/0035.gif","1952723837961424492","UOLK","1952723837961424492@UOLK",NA,NA,NA,NA,NA,NA,NA,NA,NA,"6585848",NA,NA,"0","0","0","20130801133943",NA,NA,NA,NA,NA,"200"
"22135321","20130801162813","E os amiguinhos dele como o lula, dilma, lindberg, e tantos outros petralhas não dão as caras. Por quê????? lula está sumido, não arrota mais como nunca na história deste país. Cadê você para falar da inflação, da Petrobrás??","APPROVED","0","FALSE","3","0","NONE","FALSE","0.0",NA,"FALSE","0","VISIBLE","MESSAGE",NA,"nnl822763l8t","3113546321978290253","Lorren","1","http://forum.imguol.com//forum/themes/jogos/images/nopic.gif","3113546321978290253","UOLK","3113546321978290253@UOLK",NA,NA,NA,NA,NA,NA,NA,NA,NA,"6585848",NA,NA,"0","0","0","20130801133943",NA,NA,NA,NA,NA,"200"
"22135307","20130801162743","Fico lendo estas escritas, tipo o sociólogo  tal e o cientista politico tal, dizem que o Cabral levara anos para recuperar a imagem politica abalada pelas manifestações publicas ocorridas nos últimos dias, o Cabral teve na eleição de reeleição mais de 5 milhões de votos, mas de 66%  dos votos validos, aí tem uma manifestação ali de cerca de 300 pessoas,  aqui de 60 pessoas, qual a credibilidade destas manifestações, qual a credibilidade da pesquisa feita, o fato destes vândalos estarem nas ruas é culpa exclusiva desta mídia, que durante anos de terror no País, se beneficiaram em ganhos de isenções  fiscais para parques  gráficos, canais de televisão, agora tem de pagar fazendo esta propaganda maciça de bandidagem explicita, que significa 0,000000000001% dos votos validos, se a pesquisa fosse verdadeira, estas manifestações teriam milhões de manifestantes e não poucos vândalos, isto é coisa de adeptos de Partido Sem vOtos vaLidos.","APPROVED","0","TRUE","1","0","NONE","FALSE","0.0",NA,"FALSE","0","VISIBLE","MESSAGE",NA,"6fwpd0dja197","847894065568197595","PPN","1","http://forum.imguol.com//forum/themes/jogos/images/nopic.gif","847894065568197595","UOLK","847894065568197595@UOLK",NA,NA,NA,NA,NA,NA,NA,NA,NA,"6585848",NA,NA,"0","0","0","20130801133943",NA,NA,NA,NA,NA,"200"
"22135274","20130801162546","Atenção: o correto seria ""CABRAL É AVALIADO O PIOR GOVERNADOR DO PAÍS"".
E isso é verdade. Dentre os ""grandes feitos"" de Cabral estão promessas de campanha JAMAIS CUMPRIDAS, como casas, notebooks (este, com o Lulla), aumento salarial do funcionalismo, reintegração do triênio aos reformados por invalidez do Corpo de Bombeiros, e muito, muito mais.
MERECE, pois, o título de PIOR GOVERNADOR DO PAÍS.
E o povo carioca, que título merece???
Que título merece quem vota em BRIZOLA, GAROTINHO, CABRAL, LULA E DILMA???","APPROVED","0","FALSE","2","0","NONE","FALSE","0.0",NA,"FALSE","0","VISIBLE","MESSAGE",NA,"6s98aj2uzmad","893040093038129557","Brasileiro, apenas","1","http://forum.imguol.com//forum/themes/jogos/images/nopic.gif","893040093038129557","UOLK","893040093038129557@UOLK",NA,NA,NA,NA,NA,NA,NA,NA,NA,"6585848",NA,NA,"0","0","0","20130801133943",NA,NA,NA,NA,NA,"200"
"22135229","20130801162322","Que protestos são estes quando o povo de bem está trabalhando? quem está fazendo protestos são uns paus mandados  e advinhem por qual partido?????","APPROVED","0","TRUE","1","0","NONE","FALSE","0.0",NA,"FALSE","0","VISIBLE","MESSAGE",NA,"nnl822763l8t","3113546321978290253","Lorren","1","http://forum.imguol.com//forum/themes/jogos/images/nopic.gif","3113546321978290253","UOLK","3113546321978290253@UOLK",NA,NA,NA,NA,NA,NA,NA,NA,NA,"6585848",NA,NA,"0","0","0","20130801133943",NA,NA,NA,NA,NA,"200"
"22135225","20130801162307","Na verdade é o PMDB que agonizante está no calcanhar dele, pois sabem que não arrumarão mais nada nem no Estado nem na Cidade. Não fosse a nossa passividade de ir aturando aturando, o bolsa esmola e globo não teriam eleito Cabral e Paes, a pior dupla de que já tivemos no comando da político no Rio. O governo de união deles está nos custando mais caro do que o piro governo de desunião que já tivemos. Hoje não podemos frequentar nem mais o Maracanã. Detesto o César Maia, até mesmo porque ajudou a esculhambar com educação tal como este dois, mas no jogos panamericanos eu pelo menos pude ir com minha família, e senti o povo da cidade mais envolvido. Com esses dois restou aos carioca ficar em casa para não incomodar os covidados deles para a festa que nós pagamos!!! Para mim tudo isso é falsidade. PMDB NO RIO NUNCA MAIS!!!!!","APPROVED","0","FALSE","1","0","NONE","FALSE","0.0",NA,"FALSE","0","VISIBLE","MESSAGE",NA,"pfy5og0j7qxb","3348854032334616335","Flamenguista Professor","1","http://forum.imguol.com/avatars/gallery/noticias/Basquete 01/1138.gif","3348854032334616335","UOLK","3348854032334616335@UOLK",NA,NA,NA,NA,NA,NA,NA,NA,NA,"6585848",NA,NA,"0","0","0","20130801133943",NA,NA,NA,NA,NA,"200"
"22135004","20130801161229","Só um idota não percebe que essa estratégia de deixar o cargo em abril é uma aposta na idiotia que impera neste país. Ele quer deixar o cargo apostando que o povo vai esquecer que PEZÃO  é cupincha dele. Cabral deveria sair sim, mas exonerado, condenado por improbidade. Está tentando convencer o povo que é um bom moço, mas não é. está envolvido em falcatruas, acusado de beneficiar empresários, incapaz de controlar a ppolícia, governando apenas para os moradores do Leblon e não para o povo mais pobre. Não respondeu onde está Amarildo. Não respondeu sobre o uso de helicóptero, só pensa em eleger o filho e o comparsa. O carioca tem que continuar nas ruas. apertando esse folgadão para que ele trabalhe e de explicações. O Carioca se mostra mais politicamente engajado que os paulista, que mesmo diante de todas as acusações contra ALCKIMIN continua ignorando o escândalo com o desvio de verbas no metro, e a violência policial. ","APPROVED","0","FALSE","2","0","NONE","FALSE","0.0",NA,"FALSE","0","VISIBLE","MESSAGE",NA,"coe98khd3avc","1668656149550115528","kadetti","1","http://forum.imguol.com//forum/themes/jogos/images/nopic.gif","1668656149550115528","UOLK","1668656149550115528@UOLK",NA,NA,NA,NA,NA,NA,NA,NA,NA,"6585848",NA,NA,"0","0","0","20130801133943",NA,NA,NA,NA,NA,"200"
"22134987","20130801161132","Desde a Década de 70 o Rio tem sofrido gds tranformações , as favelas cresceram de tal forma que o ESTADO , deu a entender não estar nem ai com isso , agora com tantos milhoes arrecadados em impostos e Royalties de petróleo , infelizmente nada fazem p/ o seu POVO que tanto sofrem com falta de hospitais , escolas , moradias públicas , segurança etc , se governos que entraram e saíram nada fizeram como o Garotinho e outros , o RJ não deve ser só samba e carnaval , faça algo pelo Povo como contruir moradias e acabe com as favela , de saneamento básico , facilite a entrada das polícia nos morros p/ dar segurança á população , faça algo descente no seu governo CABRAL 
","APPROVED","0","FALSE","1","0","NONE","FALSE","0.0",NA,"FALSE","0","VISIBLE","MESSAGE",NA,NA,NA,"Almir Figueredo","1","https://fbcdn-profile-a.akamaihd.net/hprofile-ak-prn1/371914_1247400515_1605878859_q.jpg","1247400515","FACEBOOK","1247400515@FACEBOOK",NA,NA,NA,NA,NA,NA,NA,NA,NA,"6585848",NA,NA,"0","0","0","20130801133943",NA,NA,NA,NA,NA,"200"
"22134909","20130801160556","Agora é a vez de São Paulo mostrar as caras. Vamos por o Geraldo Alckmin para fora também !!!   20 anos no poder e quando fica doente vai para o Sírio Libanes. O caos se combate com o caos. Vandalismo é o que o governo faz com a população...","APPROVED","0","TRUE","0","0","NONE","FALSE","0.0",NA,"FALSE","0","VISIBLE","MESSAGE",NA,"4o5whae5kkrp","614834048045458213","Dharma - Barone","1","http://forum.imguol.com//forum/themes/jogos/images/nopic.gif","614834048045458213","UOLK","614834048045458213@UOLK",NA,NA,NA,NA,NA,NA,NA,NA,NA,"6585848",NA,NA,"0","0","0","20130801133943",NA,NA,NA,NA,NA,"200"
"22134797","20130801160032","Na  minha opinião devemos banir da política brasileira não só o político ruim, mas banir também até a sua 5 geração.
Filho de peixe, peixinho é. 
Espero que os cariocas não votem mais na família Cabral ou qualquer pessoa indicada pôr ele.","APPROVED","0","FALSE","1","0","NONE","FALSE","0.0",NA,"FALSE","0","VISIBLE","MESSAGE",NA,NA,NA,"Cristina Machado","1","https://fbcdn-profile-a.akamaihd.net/static-ak/rsrc.php/v2/y9/r/IB7NOFmPw2a.gif","100004323073309","FACEBOOK","100004323073309@FACEBOOK",NA,NA,NA,NA,NA,NA,NA,NA,NA,"6585848",NA,NA,"0","0","0","20130801133943",NA,NA,NA,NA,NA,"200"
"22134776","20130801155944","a dilma o hadad deviam seguir o exemplo tbm
","APPROVED","0","TRUE","1","0","NONE","FALSE","0.0",NA,"FALSE","0","VISIBLE","MESSAGE",NA,NA,NA,"Osvaldo Camargo","1","https://fbcdn-profile-a.akamaihd.net/hprofile-ak-ash4/276394_100003322678373_2068769377_q.jpg","100003322678373","FACEBOOK","100003322678373@FACEBOOK",NA,NA,NA,NA,NA,NA,NA,NA,NA,"6585848",NA,NA,"0","0","0","20130801133943",NA,NA,NA,NA,NA,"200"
