"id","created","content","moderation_status","parent_id","has_child","like","dislike","recommended","has_rating","rating_average","rating_content","has_more_children","reply_count","message_status","message_type","idt_group_user","cod_profile","cod_profile_hash","nick","user_status","avatar","social_user","social_network","unique_user_id","user_signature","user_register","user_total_messages","user_total_pins","user_total_bookmarks","user_total_likes","profile_nick","profile_url","media_content","subject_id","subject_url","subject_title","subject_views","subject_total","subject_like","subject_start","subject_owner_name","subject_owner_id","subject_owner_cod_profile","subject_owner_userSource","replies","sc"
"22117187","20130731173140","Quanta futilidade... nunca antes na hiztoria dezte paiz.....","APPROVED","0","FALSE","2","0","NONE","FALSE","0.0",NA,"FALSE","0","VISIBLE","MESSAGE",NA,NA,NA,"Jeep 64","1","http://a0.twimg.com/profile_images/1656401980/Jeep64_normal.jpg","420769612","TWITTER","420769612@TWITTER",NA,NA,NA,NA,NA,NA,NA,NA,NA,"6582149",NA,NA,"0","0","0","20130731125834",NA,NA,NA,NA,NA,"200"
"22116907","20130731172234","Blogueira???? O que é isso? Vem de Cuba tb?  Vai trabalhar!!!!  AhAh.....","APPROVED","0","FALSE","6","0","NONE","FALSE","0.0",NA,"FALSE","0","VISIBLE","MESSAGE",NA,"fm4c6v3lwkt4","2055201674344383064","Macucouol","1","http://forum.imguol.com//forum/themes/jogos/images/nopic.gif","2055201674344383064","UOLK","2055201674344383064@UOLK",NA,NA,NA,NA,NA,NA,NA,NA,NA,"6582149",NA,NA,"0","0","0","20130731125834",NA,NA,NA,NA,NA,"200"
"22116798","20130731171939","Gente tentando dar carteirada de ""sou da imprensa"" é normal. Já trabalhei na porta de eventos como o Anime Friends e festas como Trash 80's e vinha direto um povo falando ""Sou do site XXXXXX e vim com mais 5 amigos, deixa a gente entrar e ver como está"". Ai falamos não e o povo faz cara feia. ","APPROVED","0","FALSE","4","0","NONE","FALSE","0.0",NA,"FALSE","0","VISIBLE","MESSAGE",NA,NA,NA,"David Denis Lob&atilde;o","1","http://a0.twimg.com/profile_images/3110283755/d4521d404bf6bbe9648f95b802ebbe2c_normal.jpeg","34828234","TWITTER","34828234@TWITTER",NA,NA,NA,NA,NA,NA,NA,NA,NA,"6582149",NA,NA,"0","0","0","20130731125834",NA,NA,NA,NA,NA,"200"
"22116731","20130731171728","que coisa mais tosca, não vi graça alguma no ocorrido e muito menos nesse 'memes', só foi um fato comum, apenas concordo com ela que a internet tudo é aumentado em 500% sempre pra fazer com que algo sem graça se torne engraçado e vice-versa ou pra ferrar alguém.","APPROVED","0","FALSE","1","0","NONE","FALSE","0.0",NA,"FALSE","0","VISIBLE","MESSAGE",NA,"c6bq4j6d2f8i","1602588260328795810","Andrews Andy","1","http://forum.imguol.com//forum/themes/jogos/images/nopic.gif","1602588260328795810","UOLK","1602588260328795810@UOLK",NA,NA,NA,NA,NA,NA,NA,NA,NA,"6582149",NA,NA,"0","0","0","20130731125834",NA,NA,NA,NA,NA,"200"
"22116663","20130731171455","Para alguém que vive de escrever, ela se expressa muito mal.","APPROVED","0","FALSE","3","0","NONE","FALSE","0.0",NA,"FALSE","0","VISIBLE","MESSAGE",NA,NA,NA,"Amanda Vieira","1","http://a0.twimg.com/profile_images/1338510469/Darth_Vader_penguim_normal.jpg","56198243","TWITTER","56198243@TWITTER",NA,NA,NA,NA,NA,NA,NA,NA,NA,"6582149",NA,NA,"0","0","0","20130731125834",NA,NA,NA,NA,NA,"200"
"22116518","20130731170927","oi eu tenho um blog de humor, posso experimentar uma comida num restaurante e se eu nao gostar nao pagar. kk","APPROVED","0","FALSE","4","0","NONE","FALSE","0.0",NA,"FALSE","0","VISIBLE","MESSAGE",NA,"ytw5tbz2w9du","4584432848188380546","Sherlok Hamister","1","http://forum.imguol.com/avatars/gallery/noticias/Desenhos 01/desenhos0037.jpg","4584432848188380546","UOLK","4584432848188380546@UOLK",NA,NA,NA,NA,NA,NA,NA,NA,NA,"6582149",NA,NA,"0","0","0","20130731125834",NA,NA,NA,NA,NA,"200"
"22116340","20130731170324","Na entrevista ela diz que foi a própria hostess quem perguntou sobre ela, no facebook, ela diz que chegou e logo mencionou que tinha um blog na Capricho! fala serio! cresça e apareça filha! quer ir pra balada? pague por elas!","APPROVED","0","FALSE","3","0","NONE","FALSE","0.0",NA,"FALSE","0","VISIBLE","MESSAGE",NA,NA,NA,"Ana Karine","1","https://fbcdn-profile-a.akamaihd.net/hprofile-ak-frc3/371549_100001663367142_865387582_q.jpg","100001663367142","FACEBOOK","100001663367142@FACEBOOK",NA,NA,NA,NA,NA,NA,NA,NA,NA,"6582149",NA,NA,"0","0","0","20130731125834",NA,NA,NA,NA,NA,"200"
"22116254","20130731170028","Eu como blogueiro oficial da Revista Bundas entro direto nessas baladas e furo até fila de carros da Fórmula Um  ahahahaha É só dizer que é pra dar uma olhadinha.","APPROVED","0","FALSE","1","0","NONE","FALSE","0.0",NA,"FALSE","0","VISIBLE","MESSAGE",NA,"qiyk30gvj6v8","3491484848657868932","garlic","1","http://forum.imguol.com//forum/themes/jogos/images/nopic.gif","3491484848657868932","UOLK","3491484848657868932@UOLK",NA,NA,NA,NA,NA,NA,NA,NA,NA,"6582149",NA,NA,"0","0","0","20130731125834",NA,NA,NA,NA,NA,"200"
"22115990","20130731165118","Nossa queridinha esta rindo para não chorar (hahah), porque sei que no fundo, ela tá se moendo de tanta vergonha...","APPROVED","0","FALSE","2","0","NONE","FALSE","0.0",NA,"FALSE","0","VISIBLE","MESSAGE",NA,"1hzxh5pxjrer","197425437076383363","klinger soberano","1","http://forum.imguol.com/avatars/gallery/Basquete [1]/1150.gif","197425437076383363","UOLK","197425437076383363@UOLK",NA,NA,NA,NA,NA,NA,NA,NA,NA,"6582149",NA,NA,"0","0","0","20130731125834",NA,NA,NA,NA,NA,"200"
"22115855","20130731164639","""Sei disso porque já tive minha época de tédio na frente do computador e já dei muita risada de situações como essa. Hahaha."" Detalhe: ela é blogueira.","APPROVED","0","FALSE","3","0","NONE","FALSE","0.0",NA,"FALSE","0","VISIBLE","MESSAGE",NA,"kg53s4z2kdxd","2691451080023765377","danielmp","1","http://forum.imguol.com//forum/themes/jogos/images/nopic.gif","2691451080023765377","UOLK","2691451080023765377@UOLK",NA,NA,NA,NA,NA,NA,NA,NA,NA,"6582149",NA,NA,"0","0","0","20130731125834",NA,NA,NA,NA,NA,"200"
"22115593","20130731163507","Desnecessário hein Fábio Pancherix!! ","APPROVED","0","FALSE","0","0","NONE","FALSE","0.0",NA,"FALSE","0","VISIBLE","MESSAGE",NA,"owykqeuamm67","3279429492796357567","Hitler Bonit&atilde;o","1","http://forum.imguol.com/avatars/gallery/jogos/VT2011 (09)/vt_442.jpg","3279429492796357567","UOLK","3279429492796357567@UOLK",NA,NA,NA,NA,NA,NA,NA,NA,NA,"6582149",NA,NA,"0","0","0","20130731125834",NA,NA,NA,NA,NA,"200"
"22115157","20130731161448","Mas se ela levou numa boa por que apagou o post??","APPROVED","0","FALSE","4","0","NONE","FALSE","0.0",NA,"FALSE","0","VISIBLE","MESSAGE",NA,NA,NA,"Liliane Ferrari","1","https://fbcdn-profile-a.akamaihd.net/hprofile-ak-ash4/186015_711737699_1012666285_q.jpg","711737699","FACEBOOK","711737699@FACEBOOK",NA,NA,NA,NA,NA,NA,NA,NA,NA,"6582149",NA,NA,"0","0","0","20130731125834",NA,NA,NA,NA,NA,"200"
"22114379","20130731153402","COISA MAIS LIXO QUI EU LI EM TODA MINHA VIDA -'-","APPROVED","0","FALSE","1","0","NONE","FALSE","0.0",NA,"FALSE","0","VISIBLE","MESSAGE",NA,NA,NA,"L&aacute;zaro Resenha","1","https://fbcdn-profile-a.akamaihd.net/hprofile-ak-ash4/371275_100003100271998_968492974_q.jpg","100003100271998","FACEBOOK","100003100271998@FACEBOOK",NA,NA,NA,NA,NA,NA,NA,NA,NA,"6582149",NA,NA,"0","0","0","20130731125834",NA,NA,NA,NA,NA,"200"
"22113288","20130731143059","Ela também é uma zé ninguém com o nariz empinado. ","APPROVED","0","FALSE","1","0","NONE","FALSE","0.0",NA,"FALSE","0","VISIBLE","MESSAGE",NA,NA,NA,"Bruna Cruz","1","https://fbcdn-profile-a.akamaihd.net/hprofile-ak-prn2/211889_100001054219177_615182135_q.jpg","100001054219177","FACEBOOK","100001054219177@FACEBOOK",NA,NA,NA,NA,NA,NA,NA,NA,NA,"6582149",NA,NA,"0","0","0","20130731125834",NA,NA,NA,NA,NA,"200"
"22112959","20130731141122","Ah tah.. deu risada... ""O que aconteceu foi que eu pedi pra dar uma olhada na festa antes de entrar na fila..."" Agora mudou a frase e chamou os internautas de ociosos... E quem vai numa balada as 2:00 hrs da manhã e tenta entrar sem pagar é o quê???? Além do mais denegriu a imagem da Boate, falou mal porque simplesmente não a deixaram entrar sem furar a fila e sem pagar.. ela e a cambadinha dela, pq disse que estavam em cinco homens, onde o ingresso é 120,00 cada... se fosse assim todas as blogueiras iriam entrar sem pagar...","APPROVED","0","TRUE","2","0","NONE","FALSE","0.0",NA,"FALSE","0","VISIBLE","MESSAGE",NA,"89lkdxc4rpeg","1088069329288445272","Fofocas Gatinha","1","http://forum.imguol.com//forum/themes/jogos/images/nopic.gif","1088069329288445272","UOLK","1088069329288445272@UOLK",NA,NA,NA,NA,NA,NA,NA,NA,NA,"6582149",NA,NA,"0","0","0","20130731125834",NA,NA,NA,NA,NA,"200"
"22112912","20130731140812","Mudou a história que escreveu no Facebook. Agora foi a hostess quem perguntou quem era ela. Mentiu de qualquer forma. Não é blogueira da Capricho. Só hospeda seu site lá. ","APPROVED","0","TRUE","10","0","NONE","FALSE","0.0",NA,"FALSE","0","VISIBLE","MESSAGE",NA,"kgq93afbndzz","2693598818535771551","Fabio Pancheri","1","http://forum.imguol.com/avatars/gallery/Enviados%20%5B05%5D/diversos245.gif","2693598818535771551","UOLK","2693598818535771551@UOLK",NA,NA,NA,NA,NA,NA,NA,NA,NA,"6582149",NA,NA,"0","0","0","20130731125834",NA,NA,NA,NA,NA,"200"
"22112685","20130731135332","ela continua #chatiada","APPROVED","0","FALSE","3","0","NONE","FALSE","0.0",NA,"FALSE","0","VISIBLE","MESSAGE",NA,NA,NA,"Luciana Ventura","1","https://fbcdn-profile-a.akamaihd.net/hprofile-ak-prn2/260865_591135200_299303668_q.jpg","591135200","FACEBOOK","591135200@FACEBOOK",NA,NA,NA,NA,NA,NA,NA,NA,NA,"6582149",NA,NA,"0","0","0","20130731125834",NA,NA,NA,NA,NA,"200"
"22112581","20130731134752","Acho muito engraçado ela falar que 90% das pessoas que entram na internet são ociosas, sendo que a maioria entra e olha pro site dela, isso então é o que? Uma coisa eu aprendi, quer desabafar, faça com seus amigos, Facebook não é terapeuta!","APPROVED","0","TRUE","4","0","NONE","FALSE","0.0",NA,"FALSE","0","VISIBLE","MESSAGE",NA,NA,NA,"Sabrina Passos","1","https://fbcdn-profile-a.akamaihd.net/hprofile-ak-ash2/1085848_1257177560_1565908723_q.jpg","1257177560","FACEBOOK","1257177560@FACEBOOK",NA,NA,NA,NA,NA,NA,NA,NA,NA,"6582149",NA,NA,"0","0","0","20130731125834",NA,NA,NA,NA,NA,"200"
"22112046","20130731131028","O que fala e o que faz parecem meio paradoxais... ""Não me julgue... só eu posso julgar ..."". Não pode esquecer o ""hahaha"". Típico...","APPROVED","0","FALSE","1","0","NONE","FALSE","0.0",NA,"FALSE","0","VISIBLE","MESSAGE",NA,"1wmi9rgwkx3a","250904638022104198","Zap BSB","1","http://forum.imguol.com//forum/themes/jogos/images/nopic.gif","250904638022104198","UOLK","250904638022104198@UOLK",NA,NA,NA,NA,NA,NA,NA,NA,NA,"6582149",NA,NA,"0","0","0","20130731125834",NA,NA,NA,NA,NA,"200"
"22127043","20130801081737","Pensei que só os homens tinham tanto ciúmes de uma mulher para tirar a vida dela para ninguém mais ter...... 16 anos de idade, já é sufuciente para ser condenada por crimes !! Abaixem a maioridade penal para 13 anos !!!","APPROVED","0","FALSE","0","0","NONE","FALSE","0.0",NA,"FALSE","0","VISIBLE","MESSAGE",NA,"lfuqp7gu7all","2822020280205967209","ARQ","1","http://forum.imguol.com//forum/themes/jogos/images/nopic.gif","2822020280205967209","UOLK","2822020280205967209@UOLK",NA,NA,NA,NA,NA,NA,NA,NA,NA,"6581856",NA,NA,"0","0","0","20130731114507",NA,NA,NA,NA,NA,"200"
"22126684","20130801072459","Pelo mesmo cálculo da reportagem, um apartamento de 80m² custaria R$6.000,00 o que não está muito fora da realidade de São Paulo. Quanto se paga de aluguel por um apartamento nos Jardins? Deve estar próximo disso. Nos tempos áureos de Nova Iorque, acho que se pagava até mais. O único fato interessante nesta matéria, é que os chineses aceitam morar em cubículos que muitos de nós acham absurdo mas, pelo preço, acho que muita gente aceitaria para morar mais próximo do trabalho.","APPROVED","0","FALSE","0","0","NONE","FALSE","0.0",NA,"FALSE","0","VISIBLE","MESSAGE",NA,"1m48fa3020jf","212487195641363259","roger oto","1","http://forum.imguol.com//forum/themes/jogos/images/nopic.gif","212487195641363259","UOLK","212487195641363259@UOLK",NA,NA,NA,NA,NA,NA,NA,NA,NA,"6581856",NA,NA,"0","0","0","20130731114507",NA,NA,NA,NA,NA,"200"
"22125939","20130801005656","Com uma notícia dessas vocês podem se perguntar: Será que uma pessoa de 15,16,17 anos de idade não tem consciência das suas atitudes? Colocando o caso em dados; se trata de um crime premeditado, por motivo fútil(ou banal), com altos índices de crueldade e sem dar chances para vitima de defesa. Ou seja, sobretudo, requiriu uma analise lógica e profunda da situação, onde uma(ou mais) pessoa(s) com condição de insanidade temporária ou permanente não poderia realizar, ou ainda uma pessoa incapaz.
Obviamente eu já tive essa idade, mas nunca cogitei a hipótese e realizar um crime tão horrível e posso afirmar que desde meus 13 anos de idade eu(e a quase totalidade das pessoas) tenho consciência  das minhas atitudes e as suas consequências. E se eu fosse fazer tudo que eu tivesse vontade, eu teria me tornado um serial killer ou estuprador, #sqn  obviamente.
Essas leis antigas já não satisfazem a vontade de  quem espera por justiça, essa é a verdade.
","APPROVED","0","FALSE","2","0","NONE","FALSE","0.0",NA,"FALSE","0","VISIBLE","MESSAGE",NA,"4soebbj6yoxm","631337073300542650","Jefferson Baima","6","http://forum.imguol.com/avatars/gallery/noticias/Jogos PS3 01/ps3093.jpg","631337073300542650","UOLK","631337073300542650@UOLK",NA,NA,NA,NA,NA,NA,NA,NA,NA,"6581856",NA,NA,"0","0","0","20130731114507",NA,NA,NA,NA,NA,"200"
"22125149","20130731235130","Que coisa horrivel!!! Meu Deus, que país é esse??? Já não basta o genocídio de mulheres que homens fazem todos os dias no brasil, agora mulheres fazendo isso também??? Mulher virou objeto agora??? Não podem recusar ninguém que tudo é motivo pra matar??? Abismada.","APPROVED","0","FALSE","0","0","NONE","FALSE","0.0",NA,"FALSE","0","VISIBLE","MESSAGE",NA,NA,NA,"Vivian Malaman","1","https://fbcdn-profile-a.akamaihd.net/hprofile-ak-prn1/173988_100001969147974_312952706_q.jpg","100001969147974","FACEBOOK","100001969147974@FACEBOOK",NA,NA,NA,NA,NA,NA,NA,NA,NA,"6581856",NA,NA,"0","0","0","20130731114507",NA,NA,NA,NA,NA,"200"
"22124720","20130731232539","3 anos e ficha limpa! Absurdo!","APPROVED","0","FALSE","1","0","NONE","FALSE","0.0",NA,"FALSE","0","VISIBLE","MESSAGE",NA,NA,NA,"M&aacute;rcio Aerografia","1","https://fbcdn-profile-a.akamaihd.net/hprofile-ak-ash2/1076776_100004035381552_1605638483_q.jpg","100004035381552","FACEBOOK","100004035381552@FACEBOOK",NA,NA,NA,NA,NA,NA,NA,NA,NA,"6581856",NA,NA,"0","0","0","20130731114507",NA,NA,NA,NA,NA,"200"
"22123444","20130731222544","Meu Deus, que crueldade, gente muito ruim..coitada dessa família perder uma jovem desse jeito...por pura maldade!","APPROVED","0","FALSE","2","0","NONE","FALSE","0.0",NA,"FALSE","0","VISIBLE","MESSAGE",NA,"9c7iwch0gi6f","1229233470339507207","lesote","1","http://forum.imguol.com//forum/themes/jogos/images/nopic.gif","1229233470339507207","UOLK","1229233470339507207@UOLK",NA,NA,NA,NA,NA,NA,NA,NA,NA,"6581856",NA,NA,"0","0","0","20130731114507",NA,NA,NA,NA,NA,"200"
"22123197","20130731221402","todo criminoso que age com premeditação considera seu plano infalível  portanto estamos lidando com duas amadoras em primeiro grau deixou pistas para todos os lados não podemos afirmar que elas cometeram o crime por ter certeza da impunidade porque antes de tudo elas não imaginava serem descobertas diante de tudo isso vejo um sentimento de sadismo  na garota que se diz apaixonada a premeditação  explica isso infelizmente esse pai essa mae estão passando por momentos difíceis de ter perdido uma filha e ainda uma historia do qual a vitima não pode se defender  elas podem dizer o que acharem conveniente nunca  vai saber se verdade ou mentira que deus ilumine o o  coração do pai da mae e de seus entes queridos","APPROVED","0","TRUE","1","0","NONE","FALSE","0.0",NA,"FALSE","0","VISIBLE","MESSAGE",NA,"y4yi26d1f8wi","4493266553479868370","pitta","1","http://forum.imguol.com/avatars/gallery/noticias/Basquete 01/1110.gif","4493266553479868370","UOLK","4493266553479868370@UOLK",NA,NA,NA,NA,NA,NA,NA,NA,NA,"6581856",NA,NA,"0","0","0","20130731114507",NA,NA,NA,NA,NA,"200"
"22121501","20130731210036","Deviam prender e jogar a chave fora...cada vez tem mais gente doida no mundo, eu hein?","APPROVED","0","FALSE","2","0","NONE","FALSE","0.0",NA,"FALSE","0","VISIBLE","MESSAGE",NA,"ki3g44xraw37","2698595070600028147","CrocBsb","1","http://forum.imguol.com//forum/themes/jogos/images/nopic.gif","2698595070600028147","UOLK","2698595070600028147@UOLK",NA,NA,NA,NA,NA,NA,NA,NA,NA,"6581856",NA,NA,"0","0","0","20130731114507",NA,NA,NA,NA,NA,"200"
"22120993","20130731203107","No início das diligências os policiais fora à residência da menor L. que, ao lado da sua genitora, negou que a vítima estivesse lá. Mais tarde, dando continuidade às investigações, os agentes da lei retornaram à casa da menor L. que não estava na moradia, mas sua mãe os recebeu. A mulher, então, permitiu que a vistoria dos aposentos da filha e lá estava o corpo da vítima sob a cama. A própria mãe da adolescente-infratora negara mais cedo que a vítima estivesse na casa e, mais tarde, ela presenciou o encontro do cadáver no cômodo. Uma perguntinha que não quer calar: será que a dona da casa não tem por hábito fazer varredura (sob os móveis principalmente) e retirar a poeira diariamente?. No curso do inquérito a distinta senhora será intimada para se explicar, tendo o seu termo colhido e devidamente assinado. O engraçado é que a Justiça deste país é representada por uma balança, mas retiram os pratos dela quando a acusação envolve menoridade.","APPROVED","0","FALSE","1","0","NONE","FALSE","0.0",NA,"FALSE","0","VISIBLE","MESSAGE",NA,"twc0pgw0tptt","3935247196856707073","Copacarioca","1","http://forum.imguol.com//forum/themes/jogos/images/nopic.gif","3935247196856707073","UOLK","3935247196856707073@UOLK",NA,NA,NA,NA,NA,NA,NA,NA,NA,"6581856",NA,NA,"0","0","0","20130731114507",NA,NA,NA,NA,NA,"200"
"22120718","20130731201945","ESTÃO CALUNIADO A BIANCA,ELA SÓ QUERIA SE RELACIONAR COM HOMEM,A CARTA ESTAVA AMEAÇANDO PARA ELA SE RELACIONAR COM A ASSASSINO,E FOI POR ISSO QUE ELA FOI MORTA.","APPROVED","0","FALSE","0","0","NONE","FALSE","0.0",NA,"FALSE","0","VISIBLE","MESSAGE",NA,"622af2wnj6x7","797275052736610507","FRANISCO GO","1","http://forum.imguol.com/avatars/gallery/noticias/Celebridades 01/celebridades0003.jpg","797275052736610507","UOLK","797275052736610507@UOLK",NA,NA,NA,NA,NA,NA,NA,NA,NA,"6581856",NA,NA,"0","0","0","20130731114507",NA,NA,NA,NA,NA,"200"
"22119964","20130731194057","Nossa...uma moça tão bonita, ser vítima, em nome do amor, de um crime tão bárbaro. Não entendo, não admito, não tolero.","APPROVED","0","FALSE","1","0","NONE","FALSE","0.0",NA,"FALSE","0","VISIBLE","MESSAGE",NA,"p5jzff5f8q5o","3310852974722582892","pcalvarez","1","http://forum.imguol.com/avatars/gallery/noticias/Gifs Animados 01/animados005.gif","3310852974722582892","UOLK","3310852974722582892@UOLK",NA,NA,NA,NA,NA,NA,NA,NA,NA,"6581856",NA,NA,"0","0","0","20130731114507",NA,NA,NA,NA,NA,"200"
"22119845","20130731193406","Agora me digam se essas aí tem mais jeito? Não tem, não tem reabilitação. Até prisão perpétua já seria um gasto desnecessário.","APPROVED","0","FALSE","2","0","NONE","FALSE","0.0",NA,"FALSE","0","VISIBLE","MESSAGE",NA,"24726jhkbla7","278585115967187071","Stoker","1","http://forum.imguol.com/avatars/gallery/noticias/Celebridades 07/celebridades0329.jpg","278585115967187071","UOLK","278585115967187071@UOLK",NA,NA,NA,NA,NA,NA,NA,NA,NA,"6581856",NA,NA,"0","0","0","20130731114507",NA,NA,NA,NA,NA,"200"
"22119684","20130731192613","Creio que a menoridade tenha contribuído para se encorajarem a cometer o crime. Daqui a pouco as duas estarão na ruas. Mais um exemplo da necessidade da redução da idade para a responsabilização penal, mas os políticos, por influência do Lula, não querem isso.","APPROVED","0","TRUE","0","0","NONE","FALSE","0.0",NA,"FALSE","0","VISIBLE","MESSAGE",NA,"rtiwyzlnja3p","3661735695118390501","Delano","1","http://forum.imguol.com//forum/themes/jogos/images/nopic.gif","3661735695118390501","UOLK","3661735695118390501@UOLK",NA,NA,NA,NA,NA,NA,NA,NA,NA,"6581856",NA,NA,"0","0","0","20130731114507",NA,NA,NA,NA,NA,"200"
"22119679","20130731192605","Que Deus ajude essa família, sua filha teve sua sentença decretada por essas criminosas! que pais nojento.","APPROVED","0","FALSE","1","0","NONE","FALSE","0.0",NA,"FALSE","0","VISIBLE","MESSAGE",NA,"1486amst9zdi","147076577188390998","Bruno#","1","http://forum.imguol.com/avatars/gallery/televisao/Celebridades 01/celebridades0033.jpg","147076577188390998","UOLK","147076577188390998@UOLK",NA,NA,NA,NA,NA,NA,NA,NA,NA,"6581856",NA,NA,"0","0","0","20130731114507",NA,NA,NA,NA,NA,"200"
"22119453","20130731191629","gente louca e maldita existe em todos os lugares do planeta...infelizmente essa ""criança"" teve o azar de cruzar no caminho de uma delas...só existe um jeito de apaziguar o coração desses pais: simples: Cadeira Elétrica...","APPROVED","0","FALSE","0","0","NONE","FALSE","0.0",NA,"FALSE","0","VISIBLE","MESSAGE",NA,"f10i28bywjgi","1978032670918744194","guinlly","1","http://forum.imguol.com//forum/themes/jogos/images/nopic.gif","1978032670918744194","UOLK","1978032670918744194@UOLK",NA,NA,NA,NA,NA,NA,NA,NA,NA,"6581856",NA,NA,"0","0","0","20130731114507",NA,NA,NA,NA,NA,"200"
"22119286","20130731190837","essa ""menina"", que matou sua ""amiga"" não tem nada de inocente, é espantoso ver um adolescente do sexo feminino agir assim. este tipo de crime é típico de um psicopata do sexo masculino, deveria ser julgada como tal.","APPROVED","0","FALSE","1","0","NONE","FALSE","0.0",NA,"FALSE","0","VISIBLE","MESSAGE",NA,"qr277i5z2c82","3521104033555792226","Jaiminho79","1","http://forum.imguol.com//forum/themes/jogos/images/nopic.gif","3521104033555792226","UOLK","3521104033555792226@UOLK",NA,NA,NA,NA,NA,NA,NA,NA,NA,"6581856",NA,NA,"0","0","0","20130731114507",NA,NA,NA,NA,NA,"200"
"22119188","20130731190419","Isso acontece porque a pessoa sabe que a lei aqui só existe no papel e nao vai dar em nada. Se tivessemos uma justiça que pudesse ser chamada de justiça com certeza as pessoas pensariam duas vezes antes destes atos. Isso só vai mudar o dia em neste pais lugar de banndido for na cadeia e nao no meio da sociedade amparado por um monte de ongs de direitos (des)humanos.","APPROVED","0","FALSE","0","0","NONE","FALSE","0.0",NA,"FALSE","0","VISIBLE","MESSAGE",NA,"7ab4ln83gbgi","959043651462451458","Smithb","1","http://forum.imguol.com/avatars/gallery/noticias/Desenhos 01/desenhos0043.jpg","959043651462451458","UOLK","959043651462451458@UOLK",NA,NA,NA,NA,NA,NA,NA,NA,NA,"6581856",NA,NA,"0","0","0","20130731114507",NA,NA,NA,NA,NA,"200"
"22118911","20130731185203","Esse é um País sujo, onde se mata por nada, não existe leis, justiça, esse ECA é uma vergonha, quantos mais pais vão enterrar seus filhos, por conta de crimes como esses, Acorda Brasil","APPROVED","0","FALSE","1","0","NONE","FALSE","0.0",NA,"FALSE","0","VISIBLE","MESSAGE",NA,"tj4er5b7e2p9","3886944284546205741","Os&oacute;rio Brasil","1","http://forum.imguol.com/avatars/gallery/noticias/Basquete 01/1105.gif","3886944284546205741","UOLK","3886944284546205741@UOLK",NA,NA,NA,NA,NA,NA,NA,NA,NA,"6581856",NA,NA,"0","0","0","20130731114507",NA,NA,NA,NA,NA,"200"
"22118904","20130731185144","Daqui mais um tempo ela vai dizer que foi torturada.","APPROVED","0","FALSE","0","0","NONE","FALSE","0.0",NA,"FALSE","0","VISIBLE","MESSAGE",NA,"1um3ex7kjrlj","243550408810476151","JoaoF","1","http://forum.imguol.com//forum/themes/jogos/images/nopic.gif","243550408810476151","UOLK","243550408810476151@UOLK",NA,NA,NA,NA,NA,NA,NA,NA,NA,"6581856",NA,NA,"0","0","0","20130731114507",NA,NA,NA,NA,NA,"200"
"22118871","20130731185035","..e as Feministas,tão agressivas e ferozes contra qualquer tapa do homem...Não Vão Falar Nadiaca??!! Cínicas!","APPROVED","0","FALSE","0","0","NONE","FALSE","0.0",NA,"FALSE","0","VISIBLE","MESSAGE",NA,"oaxocco3mws9","3198902629771530873","lan&ccedil;achamas","1","http://forum.imguol.com/avatars/gallery/noticias/Jogos PC 03/pc125.jpg","3198902629771530873","UOLK","3198902629771530873@UOLK",NA,NA,NA,NA,NA,NA,NA,NA,NA,"6581856",NA,NA,"0","0","0","20130731114507",NA,NA,NA,NA,NA,"200"
"22118783","20130731184545","Ora..são apenas crianças.","APPROVED","0","FALSE","1","0","NONE","FALSE","0.0",NA,"FALSE","0","VISIBLE","MESSAGE",NA,"bzph42dobjrb","1578391564089410759","Jonathas Rodrigues","1","http://forum.imguol.com//forum/themes/jogos/images/nopic.gif","1578391564089410759","UOLK","1578391564089410759@UOLK",NA,NA,NA,NA,NA,NA,NA,NA,NA,"6581856",NA,NA,"0","0","0","20130731114507",NA,NA,NA,NA,NA,"200"
