"id","created","content","moderation_status","parent_id","has_child","like","dislike","recommended","has_rating","rating_average","rating_content","has_more_children","reply_count","message_status","message_type","idt_group_user","cod_profile","cod_profile_hash","nick","user_status","avatar","social_user","social_network","unique_user_id","user_signature","user_register","user_total_messages","user_total_pins","user_total_bookmarks","user_total_likes","profile_nick","profile_url","media_content","subject_id","subject_url","subject_title","subject_views","subject_total","subject_like","subject_start","subject_owner_name","subject_owner_id","subject_owner_cod_profile","subject_owner_userSource","replies","sc"
"22112221","20130731132406","Aqui no Brasil sabe o que vai acontecer com L e M ???? absolutamente NADA...","APPROVED","0","FALSE","0","0","NONE","FALSE","0.0",NA,"FALSE","0","VISIBLE","MESSAGE",NA,"7vgj59vdx375","1036371812242450289","Sr.X","1","http://forum.imguol.com//forum/themes/jogos/images/nopic.gif","1036371812242450289","UOLK","1036371812242450289@UOLK",NA,NA,NA,NA,NA,NA,NA,NA,NA,"6581856",NA,NA,"0","0","0","20130731114507",NA,NA,NA,NA,NA,"200"
"22112220","20130731132400","Como alguém consegue enfiar uma FACA na outra pessoa por um motivos desses??, Ta na cara que o FATO de serem DE MENOR, e saberem muito bem que não vai dar em nada, foi a mola propulsora do crime.","APPROVED","0","FALSE","0","0","NONE","FALSE","0.0",NA,"FALSE","0","VISIBLE","MESSAGE",NA,"225otpk8c36l","271133559189422877","Barateix&atilde;o","1","http://forum.imguol.com/avatars/gallery/noticias/Desenhos 01/desenhos0024.jpg","271133559189422877","UOLK","271133559189422877@UOLK",NA,NA,NA,NA,NA,NA,NA,NA,NA,"6581856",NA,NA,"0","0","0","20130731114507",NA,NA,NA,NA,NA,"200"
"22112121","20130731131636","Hoje em dia, PAES descentes não desgrudam os olhos dos filhos e nos ""Amigos"" e ""Amizades"" deles. Agente (PAES) temos que ter um saúde divina, para poder ficar atento a tudo e a todos e ainda ter que trabalhar e cuidar de tudo mais. Podem me chamar de careta, chato que desconfia de tudo, não to nem ai... Fico em cima mesmo do meus filhos, FaceBook/MSN e tudo mais é só com consentimento e tutoria do PAI. Celular, computador só se eu tiver acesso se não já era. Nos meus ... ninguém mete a mão não.","APPROVED","0","FALSE","0","0","NONE","FALSE","0.0",NA,"FALSE","0","VISIBLE","MESSAGE",NA,"225otpk8c36l","271133559189422877","Barateix&atilde;o","1","http://forum.imguol.com/avatars/gallery/noticias/Desenhos 01/desenhos0024.jpg","271133559189422877","UOLK","271133559189422877@UOLK",NA,NA,NA,NA,NA,NA,NA,NA,NA,"6581856",NA,NA,"0","0","0","20130731114507",NA,NA,NA,NA,NA,"200"
"22112070","20130731131218","""dimenor""","APPROVED","0","FALSE","0","0","NONE","FALSE","0.0",NA,"FALSE","0","VISIBLE","MESSAGE",NA,NA,NA,"Marcelo Machado","1","https://fbcdn-profile-a.akamaihd.net/hprofile-ak-ash4/186907_1071473920_1390888625_q.jpg","1071473920","FACEBOOK","1071473920@FACEBOOK",NA,NA,NA,NA,NA,NA,NA,NA,NA,"6581856",NA,NA,"0","0","0","20130731114507",NA,NA,NA,NA,NA,"200"
"22112041","20130731131016","Não sou religioso, mas não sou ateu, e sei muito bem que essas ai nunca mais terão sossego na vida, nem nesta e nem nas outras. Como diria o poeta: VOCÊ PERDEU SUA VIDA MEU IRMÃO.","APPROVED","0","FALSE","2","0","NONE","FALSE","0.0",NA,"FALSE","0","VISIBLE","MESSAGE",NA,"225otpk8c36l","271133559189422877","Barateix&atilde;o","1","http://forum.imguol.com/avatars/gallery/noticias/Desenhos 01/desenhos0024.jpg","271133559189422877","UOLK","271133559189422877@UOLK",NA,NA,NA,NA,NA,NA,NA,NA,NA,"6581856",NA,NA,"0","0","0","20130731114507",NA,NA,NA,NA,NA,"200"
"22111995","20130731130723","LEI DE PALMADAS A PARTE, PERGUNT-ME, ONDE ESTAVAM OS SENHORES PAIS DESTAS ""MENINAS""(TRES) QUE NÃO PRESTAVAM A MINIMA ATENÇÃO O QUE ACONTECIA  DENTRO DE SUA PROPRIA CASA?!COMO EM NOME DE DEUS, ESSAS ""MENINAS"" ASSASSINARAM UMA PESSOA A FACADAS , NÃO HAVIA NINGUEM QUE PRESTASSE ATENÇÃO AOS ATOS QUE ACONTECIAM NO QUARTO DA ADOLESCENTE?! NÃO CONSIGO ENTENDER A LIBERDADE DADA ÁS ""CRIANÇAS"" DE HOJE! COMO PODE UM ""PAI/MAE NÃO SABER O QUE ACONTECE NO QUARTO DO FILHO?!E MAIS AINDA, SE NÃO ESTAVAM EM CASA, COMO É QUE DEIXARAM  A CASA AOS CUIDADOS DE UM MENOR DE IDADE?! REALMENTE NÃO CONSIGO ENTENDER, AGORA NÃO ADIANTA NADA CONJECTURAR-MOS O ""SEXO DOS ANJOS"". AS BASES FAMILIARES DE HOJE  JA ESTÃO TOTALMENTE CORROIDAS.....LIBERDADE EM EXCESSO....
SÓ SEI QUE PARA CADA CONTRAVENTOR""DI MENOR"" DEVERIAMOS DAR UMA OLHADINHA NA EDUCAÇÃO QUE OBTIVERAM EM CASA.........MUITAS COISAS SE EXPLICARIAM..... INDEPENDENTES DA"" LEI DE PALMADAS!""....","APPROVED","0","FALSE","2","0","NONE","FALSE","0.0",NA,"FALSE","0","VISIBLE","MESSAGE",NA,"l7u12dpdvmjx","2792698696139474157","magdinhaaaaa","1","http://forum.imguol.com/avatars/gallery/noticias/Desenhos 03/desenhos0109.jpg","2792698696139474157","UOLK","2792698696139474157@UOLK",NA,NA,NA,NA,NA,NA,NA,NA,NA,"6581856",NA,NA,"0","0","0","20130731114507",NA,NA,NA,NA,NA,"200"
"22111896","20130731130012","Nosso estatuto do menor precisa ser repensado. Estas jovens precisam da devida punição. Não há como continuarmos assim, totalmente lenientes com estes crimes. Não estamos falando de pequenos furtos de menores carentes. Quanto a questão de matar por amor, isto já é assunto superado para 90% das pessoas. Não há justificativa para uma morte passional. Não sei porque levantaram isto, mas cada um tem direito de colocar sua opinião...","APPROVED","0","FALSE","1","0","NONE","FALSE","0.0",NA,"FALSE","0","VISIBLE","MESSAGE",NA,"m88n80tm4j6r","2925804745935594531","GusJu","1","http://forum.imguol.com//forum/themes/jogos/images/nopic.gif","2925804745935594531","UOLK","2925804745935594531@UOLK",NA,NA,NA,NA,NA,NA,NA,NA,NA,"6581856",NA,NA,"0","0","0","20130731114507",NA,NA,NA,NA,NA,"200"
"22111763","20130731125221","Vão passar 6 meses na Fundação Casa e ganhar liberdade. Se tiverem pais influentes, nem isso...........","APPROVED","0","FALSE","1","0","NONE","FALSE","0.0",NA,"FALSE","0","VISIBLE","MESSAGE",NA,"a2ex6s7u2u66","1325044822931775294","O BRASIL &Eacute; FLU","1","http://forum.imguol.com//forum/themes/jogos/images/nopic.gif","1325044822931775294","UOLK","1325044822931775294@UOLK",NA,NA,NA,NA,NA,NA,NA,NA,NA,"6581856",NA,NA,"0","0","0","20130731114507",NA,NA,NA,NA,NA,"200"
"22111498","20130731123426","Dormi e essa matéria continua, e penso que deveria FICAR ESTAMPADA até que as “toridades” saíssem de suas REDOMAS e olhassem o que acontece aqui fora. Não sou a favor de ESPANCAR o filho, mas um “diálogo” às vezes seria muito bem vindos. Diálogos do tipo: E AÍ DOEU??..VAI FAZER DE NOVO??..VAI RESPONDER ??..ENTENDEU QUEM MANDA??..Mas não, conseguiram até mesmo INTERFERIR na CRIAÇÃO DE DENTRO DE CASA!!..Tá do jeitinho que “eles” gostam: Não podem APANHAR, ou “EDUCAR”,e se isso vir a acontecer, ameaçam os pais com: “TE DENUNCIO EIN??”.. Graças a Deus HERDEI do meu pai o “OLHAR FUZILANTE” não havendo necessidade, portanto de “dialogar” muito com meus filhos, mas se necessário fosse,QUE SE DANE A “LEI DA PALMADA”!!
","APPROVED","0","TRUE","7","0","NONE","FALSE","0.0",NA,"FALSE","0","VISIBLE","MESSAGE",NA,"7molkv1382ah","1004285729674769561","anonimo por enquanto","1","http://forum.imguol.com/avatars/gallery/noticias/Desenhos 05/desenhos0203.jpg","1004285729674769561","UOLK","1004285729674769561@UOLK",NA,NA,NA,NA,NA,NA,NA,NA,NA,"6581856",NA,NA,"0","0","0","20130731114507",NA,NA,NA,NA,NA,"200"
"22111364","20130731122542","A maior parte dos assasinatos de homossexuais é feita por homossexuais. Assasinatos homofóbicos são poucos. Mas o establishment maldosamente soma tudo, para vitimizar GLB e assim forçar a aceitação goela abaixo. Uma vez aceita, outras formas de manifestação sexual serão impostas.","APPROVED","0","TRUE","2","0","NONE","FALSE","0.0",NA,"FALSE","0","VISIBLE","MESSAGE",NA,"opzk1wcueswg","3253936022695401424","Xcelent","1","http://forum.imguol.com//forum/themes/jogos/images/nopic.gif","3253936022695401424","UOLK","3253936022695401424@UOLK",NA,NA,NA,NA,NA,NA,NA,NA,NA,"6581856",NA,NA,"0","0","0","20130731114507",NA,NA,NA,NA,NA,"200"
"22111240","20130731121628","Quando são gays/lésbicas acham bem empregado. Se fosse um homem matando a esposa, namorada, companheira, seria legítima defesa da honra, como foi tachado assassinato de Ângela Diniz, a Pantera de Minas, por Doca Street.","APPROVED","0","TRUE","0","0","NONE","FALSE","0.0",NA,"FALSE","0","VISIBLE","MESSAGE",NA,"hk41fejwl0u8","2311102402197382016","Petronova","1","http://forum.imguol.com//forum/themes/jogos/images/nopic.gif","2311102402197382016","UOLK","2311102402197382016@UOLK",NA,NA,NA,NA,NA,NA,NA,NA,NA,"6581856",NA,NA,"0","0","0","20130731114507",NA,NA,NA,NA,NA,"200"
"22185182","20130804085713","Gostaria que no Brasil as leis tivessem o mesmo peso e funcionasse, inclusive, contra os que estão no poder! ","APPROVED","0","FALSE","0","0","NONE","FALSE","0.0",NA,"FALSE","0","VISIBLE","MESSAGE",NA,NA,NA,"Edson Galante Guedes","1","https://fbcdn-profile-a.akamaihd.net/hprofile-ak-prn1/157504_100000332358112_1275549486_q.jpg","100000332358112","FACEBOOK","100000332358112@FACEBOOK",NA,NA,NA,NA,NA,NA,NA,NA,NA,"6587143",NA,NA,"0","0","0","20130801185157",NA,NA,NA,NA,NA,"200"
"22146318","20130802094056","Lamentável alguém se vangloriar de que ´aqui´ nunca tivemos um crime desses. Essa semana mesmo podemos acompanhar a morte de uma jovem adolescente. De um filho que matou a mãe. Deixe lembrar de outros absurdos e aberrações... dentistas mortos queimados vivos. Vamos lembrar de outros casos, anos atrás bandidos levaram o carro de uma mãe, na qual o flho ficou preso pelo cinto de segurança e foi arrastado pelo asfalto até a morte. Um menino boliviano de apenas 4 anos de idade implorou pela vida, dando a poucas moedas que tinham em mãos e levou um tiro na cabeça. Sr que  ri da justiça americana ou que acha que temos ´menos crimes horrendos´ nesse país, deveria ser solidário com o sentimento de perda dessas pessoas... que tenho certeza que gostariam que a justiça foi feita. La o cara é condenao a perpetua e pega mais 1000 anos Aqui o cara leva 15 por um crime hediondo e cumpre 5. Então... quem deveria rir de quem????","APPROVED","0","FALSE","0","0","NONE","FALSE","0.0",NA,"FALSE","0","VISIBLE","MESSAGE",NA,"0go7iyxogoo9","60957208372428009","aloka1","1","http://forum.imguol.com//forum/themes/jogos/images/nopic.gif","60957208372428009","UOLK","60957208372428009@UOLK",NA,NA,NA,NA,NA,NA,NA,NA,NA,"6587143",NA,NA,"0","0","0","20130801185157",NA,NA,NA,NA,NA,"200"
"22145889","20130802090436","Se fosse no Brasil ele pegaria 20 anos e em 5 estaria na rua . Será que um dia conseguiremos ter uma justiça justa ? QUE INVEJA !!!!","APPROVED","0","TRUE","2","0","NONE","FALSE","0.0",NA,"FALSE","0","VISIBLE","MESSAGE",NA,"cnkh4t9exul7","1665631625383082779","marcmix","1","http://forum.imguol.com//forum/themes/jogos/images/nopic.gif","1665631625383082779","UOLK","1665631625383082779@UOLK",NA,NA,NA,NA,NA,NA,NA,NA,NA,"6587143",NA,NA,"0","0","0","20130801185157",NA,NA,NA,NA,NA,"200"
"22145884","20130802090414","que ele sofra tudo em dobro na cadeia. que ele mora um dia por vez..é com o juiz falou nao teme spaço no mundo q um ser assim!!!!!!! monstro é pouco p vc!!!! seu ordinario!!!!! mediocre!!!!!! vermeeee!!!! vermeeee!!!! DEus é justo e vc vai pagar por tudo q fez, vai pagar por ter roubado a vida dessas tres mulheres, por toda dor crueldade q fez elas passarem, pr todo sofriemnto angustia q elas passaram eu desejo q vc passe o dobro do dobro!!!!!!!!!!! nao tenho palavras p expressar minha repudia meu odio por uma pessoa como vc1!!!!!!! monstro nao ha perdao p esse crime!!!!!!!!!!!!!!!!!!!!!!!!!!!!!!","APPROVED","0","FALSE","1","0","NONE","FALSE","0.0",NA,"FALSE","0","VISIBLE","MESSAGE",NA,NA,NA,"Aruan&atilde; Anahi Asuko","1","https://fbcdn-profile-a.akamaihd.net/hprofile-ak-prn2/1076182_100005482027482_936303779_q.jpg","100005482027482","FACEBOOK","100005482027482@FACEBOOK",NA,NA,NA,NA,NA,NA,NA,NA,NA,"6587143",NA,NA,"0","0","0","20130801185157",NA,NA,NA,NA,NA,"200"
"22145695","20130802084648","Que inveja tenho da Justiça Americana, rápida! sem enrolação jurídica, sem postergações e DURA como deve ser!!","APPROVED","0","FALSE","1","0","NONE","FALSE","0.0",NA,"FALSE","0","VISIBLE","MESSAGE",NA,"gd8e0iu4zw47","2154329337393604951","V de verd&atilde;o","1","http://forum.imguol.com/avatars/gallery/noticias/Presidentes/34.gif","2154329337393604951","UOLK","2154329337393604951@UOLK",NA,NA,NA,NA,NA,NA,NA,NA,NA,"6587143",NA,NA,"0","0","0","20130801185157",NA,NA,NA,NA,NA,"200"
"22145564","20130802083621","Seria engraçado se não fosse trágico os ignorantes de plantão querendo comparar a nossa justiça com a dos EUA a partir deste caso, quando nunca tivemos um caso como esse aqui no Brasil...","APPROVED","0","TRUE","1","0","NONE","FALSE","0.0",NA,"FALSE","0","VISIBLE","MESSAGE",NA,"mvc8pya2n9iw","3010261718254918136","Gilberto Gil","1","http://forum.imguol.com//forum/themes/jogos/images/nopic.gif","3010261718254918136","UOLK","3010261718254918136@UOLK",NA,NA,NA,NA,NA,NA,NA,NA,NA,"6587143",NA,NA,"0","0","0","20130801185157",NA,NA,NA,NA,NA,"200"
"22145374","20130802081653","E querem criticar os gringos mas eles tem uma coisa que os poderosos aqui nao tem CARÁTER. O que aconteceu deveria acontecer com uma gama enorme de altos ecaloes públicos e de lambuja com a ajuda da polícia italiana.","APPROVED","0","TRUE","0","0","NONE","FALSE","0.0",NA,"FALSE","0","VISIBLE","MESSAGE",NA,"u5k0niri9ebx","3968964949822811853","b timm","1","http://forum.imguol.com/avatars/gallery/noticias/Basquete 01/1111.gif","3968964949822811853","UOLK","3968964949822811853@UOLK",NA,NA,NA,NA,NA,NA,NA,NA,NA,"6587143",NA,NA,"0","0","0","20130801185157",NA,NA,NA,NA,NA,"200"
"22145224","20130802075853","Exemplo!!! Crime hediondo. Condenado à prisão perpétua sem direito a interrupção da pena, EM POUCOS DIAS. Por isso, os Estados Unidos são uma NAÇÃO, e nós somos um PAÍS.","APPROVED","0","FALSE","0","0","NONE","FALSE","0.0",NA,"FALSE","0","VISIBLE","MESSAGE",NA,"u8f4f4i8cz19","3979436251850198109","Belgique","1","http://forum.imguol.com//forum/themes/jogos/images/nopic.gif","3979436251850198109","UOLK","3979436251850198109@UOLK",NA,NA,NA,NA,NA,NA,NA,NA,NA,"6587143",NA,NA,"0","0","0","20130801185157",NA,NA,NA,NA,NA,"200"
"22145189","20130802075526","Se ele fugir, vem para o Brasil, pede asilo político. Receberia o solicitado e viraria personalidade, celebridade. Daria várias entrevistas, diria que foi vítima de armação da polícia e das moças. Casaria com uma brasileira, teria um filho e não seria extraditado. Vide o caso do Ingles Ronald Biggs e seu bando assaltaram um trem pagador naIinglaterra ( não foi o primeiro crime deles), MATARAM um vigia e o Sr Biggs fugiu para o Brasil, virou celebridade, teve um filho, que virou celebridade (em razão de ser filho dele), casou, seus vizinhos, ainda, quando procurados pela mídia,  não poupavam, elogios aquele ""senhor bonzinho"". Ele só foi preso quando, ja velho e debilitado, voltou para Inglaterra, lá eles não esqueceram, não perdoaram, prenderam o ""doce velhinho"". Ele fez isso, por ter passando tanto tempo no Brasil, ter se acostumado com a impunidade deacarada, demagogia ""tupiniquin"" e ufanismo barato.","APPROVED","0","TRUE","3","0","NONE","FALSE","0.0",NA,"FALSE","0","VISIBLE","MESSAGE",NA,"lzs4fj0dag5h","2894877506159807813","ANTONIOVICH","1","http://forum.imguol.com/avatars/gallery/noticias/Gifs Animados 02/animados057.gif","2894877506159807813","UOLK","2894877506159807813@UOLK",NA,NA,NA,NA,NA,NA,NA,NA,NA,"6587143",NA,NA,"0","0","0","20130801185157",NA,NA,NA,NA,NA,"200"
"22145161","20130802075210","Para ela deve começar o resgate da paz, da dignidade, porque SABE que o cara vair de fato apodrecer até a morte atrás das grades. Se ela morasse no Brasil, agora que começaria o verdadeiro inferno na sua vida, pois, primeiro o cara responderia em liberdade por um crime dantesco, demoraria uns 10 anos para ser condenado; seria condenado a uns 28 anos de prisão; como alega doença mental, sairia com a progressaão em 06 anos, fora as fugidinhas no dia das mães, de natal. Enquanto isso, a vítima estaria recebendo ameaças de seu algoz o tempo todo, até mesmo depois que estivesse preso. Será que as redes sociais não devem começar a trabalhar um projeto de vozo anulado em massa nas proximas eleições????????","APPROVED","0","FALSE","1","0","NONE","FALSE","0.0",NA,"FALSE","0","VISIBLE","MESSAGE",NA,"ocjmfmt3cip0","3204787722200645796","BIR","1","http://forum.imguol.com//forum/themes/jogos/images/nopic.gif","3204787722200645796","UOLK","3204787722200645796@UOLK",NA,NA,NA,NA,NA,NA,NA,NA,NA,"6587143",NA,NA,"0","0","0","20130801185157",NA,NA,NA,NA,NA,"200"
"22145030","20130802073542","Bem que a multidão em apoio à mudanças, casamento gay, aborto, liberação de drogas, fora Cabral...fossem às ruas para a reforma judiciária, ao invés de ficarem omissas e reféns de ""monstros-humanos"" cometendo diariamente todo ato de barbariedade e logo-logo livre, leves e soltos para comenterem novos atos de crueldade. Por exemplo, as meninas adolescentes que assassinaram uma jovem por ciúmes e amor homo-afetivo, ficarão apreendidas, no máximo, por 3 anos. ISSO É BRASIL, SÓ COPIANDO O QUE NÃO PRESTA LÁ DE FORA, MAS AS LEIS E UMA JUSTIÇA EFICIENTE, NADA. ","APPROVED","0","FALSE","3","0","NONE","FALSE","0.0",NA,"FALSE","0","VISIBLE","MESSAGE",NA,NA,NA,"M&aacute;rio Luiz Nascimento","1","https://fbcdn-profile-a.akamaihd.net/hprofile-ak-prn1/623789_100004077286407_151959866_q.jpg","100004077286407","FACEBOOK","100004077286407@FACEBOOK",NA,NA,NA,NA,NA,NA,NA,NA,NA,"6587143",NA,NA,"0","0","0","20130801185157",NA,NA,NA,NA,NA,"200"
"22144943","20130802071714","Assim funciona a lei em paises serios. Se fosse em outros paises que conhecemos bem ele pegaria uns meses de caana e pagaria umas sestas basicas. Esta é a diferença entre paises onde a lei funciona e paises onde a (justiça) passa a mao na cabeça de banndido e detrimento das pessoas de bem tudo isso sob olhar atento das ongs dos direitos humanos???????.............................","APPROVED","0","FALSE","2","0","NONE","FALSE","0.0",NA,"FALSE","0","VISIBLE","MESSAGE",NA,"7ab4ln83gbgi","959043651462451458","Smithb","1","http://forum.imguol.com/avatars/gallery/noticias/Desenhos 01/desenhos0043.jpg","959043651462451458","UOLK","959043651462451458@UOLK",NA,NA,NA,NA,NA,NA,NA,NA,NA,"6587143",NA,NA,"0","0","0","20130801185157",NA,NA,NA,NA,NA,"200"
"22144931","20130802071314","ah como esses gringos estão atrasadinhos.... na terrinha dos brazucas os manos dos direitos humanos não permitiriam que o sequestrador sofresse provocações do juiz e das vítimas","APPROVED","0","FALSE","2","0","NONE","FALSE","0.0",NA,"FALSE","0","VISIBLE","MESSAGE",NA,"fxfy13ha8096","2096598189182570826","Zedarrossa","1","http://forum.imguol.com//forum/themes/jogos/images/nopic.gif","2096598189182570826","UOLK","2096598189182570826@UOLK",NA,NA,NA,NA,NA,NA,NA,NA,NA,"6587143",NA,NA,"0","0","0","20130801185157",NA,NA,NA,NA,NA,"200"
"22144929","20130802071249","Por que será que o jurídico, os psicólogos, os sociólogos, ..., brasileiros não conseguem entender e se posicionar firme e prontamente perante os criminosos!??","APPROVED","0","TRUE","2","0","NONE","FALSE","0.0",NA,"FALSE","0","VISIBLE","MESSAGE",NA,"dsmgg10lg5mn","1815735299115894143","UNIDOS PELO BEM!","1","http://forum.imguol.com/avatars/gallery/noticias/Formula 1 02/0910.jpg","1815735299115894143","UOLK","1815735299115894143@UOLK",NA,NA,NA,NA,NA,NA,NA,NA,NA,"6587143",NA,NA,"0","0","0","20130801185157",NA,NA,NA,NA,NA,"200"
"22144918","20130802071118","O Brasil é um pais moderno. Ele tem 60 anos. Aqui a pena máxima para ele seria 30 anos. Com noventa ele não seria mais nada. Para que esse jogo de cena? Prisão perpetua. 1.000 anos de cadeia? Inutilidade. Nos Estados Unidos não é aonde se mata um de vez em quando e depois se descobre que vem, foi um erro judicial etc? Muito mais racional o sistema brasileiro. Menos pretensioso. É o tal complexo do cachorro viralata que faz brasileiros pensar que eles são melhores, que a Justiça deles é melhor. O ser humano quer esfolar — mas esfolar o outro. Não, prefiro a Justiça sensata do Brasil. Mais justa. Mais humanitária. ","APPROVED","0","TRUE","0","0","NONE","FALSE","0.0",NA,"FALSE","0","VISIBLE","MESSAGE",NA,"koo9yyqccshm","2722647448341114682","Basilio de Queiroz","1","http://forum.imguol.com//forum/themes/jogos/images/nopic.gif","2722647448341114682","UOLK","2722647448341114682@UOLK",NA,NA,NA,NA,NA,NA,NA,NA,NA,"6587143",NA,NA,"0","0","0","20130801185157",NA,NA,NA,NA,NA,"200"
"22144867","20130802065604","ta doente ta coitadinho.pois entao pra curar tem q ir pra CADEIA","APPROVED","0","FALSE","1","0","NONE","FALSE","0.0",NA,"FALSE","0","VISIBLE","MESSAGE",NA,NA,NA,"LoveSoundD","1","http://a0.twimg.com/profile_images/1472866549/71782e91-328f-44a3-815a-7676109849c3_normal.png","152839224","TWITTER","152839224@TWITTER",NA,NA,NA,NA,NA,NA,NA,NA,NA,"6587143",NA,NA,"0","0","0","20130801185157",NA,NA,NA,NA,NA,"200"
"22144697","20130802053124","Os defensores dos direitos humanos irão pedir a extradiçao desse marginal. Aqui, em 6 meses estará nas ruas para visitar amigos, amigas, pais falecidos, etc.","APPROVED","0","FALSE","3","0","NONE","FALSE","0.0",NA,"FALSE","0","VISIBLE","MESSAGE",NA,"yq0w8i21734x","4570288991814096033","nikkey","1","http://forum.imguol.com/avatars/gallery/noticias/Gifs Animados 04/animados184.gif","4570288991814096033","UOLK","4570288991814096033@UOLK",NA,NA,NA,NA,NA,NA,NA,NA,NA,"6587143",NA,NA,"0","0","0","20130801185157",NA,NA,NA,NA,NA,"200"
"22144662","20130802043804","Lá o buraco é mais embaixo. O Brasil precisa urgente rever seus códigos de 70 anos atrás para que possamos nos proteger de crimes que naquele tempo não existia e poder impor a Lei atualizada e modernizada contra os bandidos de hoje. Naquele tempo para saber se um determinado individuo era bandido a polícia colocava uma laranja por cima da calça, se a mesma ficasse presa na bainha, ele era detido por vadiagem... Pode ? ","APPROVED","0","FALSE","1","0","NONE","FALSE","0.0",NA,"FALSE","0","VISIBLE","MESSAGE",NA,"c7dsq5iaj015","1606454875159996649","Nixdorf","1","http://forum.imguol.com/avatars/gallery/noticias/Basquete 01/1105.gif","1606454875159996649","UOLK","1606454875159996649@UOLK",NA,NA,NA,NA,NA,NA,NA,NA,NA,"6587143",NA,NA,"0","0","0","20130801185157",NA,NA,NA,NA,NA,"200"
"22144643","20130802042617","Quando Tera perpetua no brasil kk k","APPROVED","0","FALSE","1","0","NONE","FALSE","0.0",NA,"FALSE","0","VISIBLE","MESSAGE",NA,NA,NA,"Vanessa Rezende","1","https://fbcdn-profile-a.akamaihd.net/hprofile-ak-ash4/211881_100003555913806_1802941956_q.jpg","100003555913806","FACEBOOK","100003555913806@FACEBOOK",NA,NA,NA,NA,NA,NA,NA,NA,NA,"6587143",NA,NA,"0","0","0","20130801185157",NA,NA,NA,NA,NA,"200"
"22144640","20130802042342","O Brasil só copia coisas erradas de outros países, quero ver copiar esta lei ","APPROVED","0","FALSE","1","0","NONE","FALSE","0.0",NA,"FALSE","0","VISIBLE","MESSAGE",NA,NA,NA,"Luiz Edz","1","https://fbcdn-profile-a.akamaihd.net/hprofile-ak-frc1/372475_100003927724939_966075367_q.jpg","100003927724939","FACEBOOK","100003927724939@FACEBOOK",NA,NA,NA,NA,NA,NA,NA,NA,NA,"6587143",NA,NA,"0","0","0","20130801185157",NA,NA,NA,NA,NA,"200"
"22144572","20130802030758","Nos Estados Unidos as vítimas podem expressar no tribunal a sua indignação cara a cara com o condenado, o que certamente lhes trás um alívio. O juiz também pode esculhambar o réu em resposta a um comportamento ou alegação mentirosa ou cínica. No Brasil, nem isso. O cara mente desbragadamente e ninguém diz que ele vai pagar caro por isso.","APPROVED","0","FALSE","2","0","NONE","FALSE","0.0",NA,"FALSE","0","VISIBLE","MESSAGE",NA,"7hv27najekrv","986661220505873323","pauloSer","1","http://forum.imguol.com/avatars/gallery/noticias/Basquete 01/1112.gif","986661220505873323","UOLK","986661220505873323@UOLK",NA,NA,NA,NA,NA,NA,NA,NA,NA,"6587143",NA,NA,"0","0","0","20130801185157",NA,NA,NA,NA,NA,"200"
"22144490","20130802021457","Justiça rápida a de lá, como tem que ser. Ele foi preso há poucos meses e já saiu a sentença. Já aqui  Bruno e asseclas cometeram o crime em jun 2010 e só foram julgados em março deste ano. ","APPROVED","0","FALSE","2","0","NONE","FALSE","0.0",NA,"FALSE","0","VISIBLE","MESSAGE",NA,"jc8ck10bfij8","2545534176735331988","Gui Freire","1","http://forum.imguol.com//forum/themes/jogos/images/nopic.gif","2545534176735331988","UOLK","2545534176735331988@UOLK",NA,NA,NA,NA,NA,NA,NA,NA,NA,"6587143",NA,NA,"0","0","0","20130801185157",NA,NA,NA,NA,NA,"200"
"22144483","20130802021319","Dois fatos interessantes nessa historia:
1-Veio a publico,ou seja,foi descoberto em maio em menos de tres meses,julgado e condenado.
2-Sentença pesada,ou seja o crime nao compensa nos EUA,no Brasil ele em 6 anos estaria nas ruas comentendo novos delitos.","APPROVED","0","FALSE","2","0","NONE","FALSE","0.0",NA,"FALSE","0","VISIBLE","MESSAGE",NA,NA,NA,"Ricardo Antonio Orlando Pereira","1","https://fbcdn-profile-a.akamaihd.net/hprofile-ak-prn1/274330_1517243182_1967162643_q.jpg","1517243182","FACEBOOK","1517243182@FACEBOOK",NA,NA,NA,NA,NA,NA,NA,NA,NA,"6587143",NA,NA,"0","0","0","20130801185157",NA,NA,NA,NA,NA,"200"
